{
    "name": "ldb-test",
    "prev": "ldb",
    "next": "mask-field",
    "up": "Numbers Dictionary",
    "header": {
        "type": "Function",
        "text": "ldb-test"
    },
    "sections": [
        {
            "type": "Syntax",
            "defs": [
                {
                    "name": "ldb-test",
                    "text": " bytespec integer =>  generalized-boolean\n"
                }
            ],
            "text": ""
        },
        {
            "type": "Arguments and Values",
            "text": "",
            "values": [
                {
                    "name": "bytespec",
                    "desc": "a byte specifier."
                },
                {
                    "name": "integer",
                    "desc": "an integer."
                },
                {
                    "name": "generalized-boolean",
                    "desc": "a generalized boolean."
                }
            ]
        },
        {
            "type": "Description",
            "text": "Returns true if any of the bits of the byte in integer specified by\nbytespec is non-zero; otherwise returns false.\n"
        },
        {
            "type": "Examples",
            "text": "      (ldb-test (byte 4 1) 16) =>  true\n      (ldb-test (byte 3 1) 16) =>  false\n      (ldb-test (byte 3 2) 16) =>  true\n"
        },
        {
            "type": "See Also",
            "text": "*Note byte; byte-size; byte-position:: , *Note ldb:: , *Note zerop::\n"
        },
        {
            "type": "Notes",
            "text": "      (ldb-test bytespec n) ==\n      (not (zerop (ldb bytespec n))) ==\n      (logtest (ldb bytespec -1) n)\n"
        }
    ],
    "_otext": "File: gcl.info,  Node: ldb-test,  Next: mask-field,  Prev: ldb,  Up: Numbers Dictionary\n\nldb-test                                                         [Function]\n---------------------------------------------------------------------------\n\n`ldb-test'  bytespec integer =>  generalized-boolean\n\nArguments and Values::\n......................\n\nbytespec--a byte specifier.\n\ninteger--an integer.\n\ngeneralized-boolean--a generalized boolean.\n\nDescription::\n.............\n\nReturns true if any of the bits of the byte in integer specified by\nbytespec is non-zero; otherwise returns false.\n\nExamples::\n..........\n\n      (ldb-test (byte 4 1) 16) =>  true\n      (ldb-test (byte 3 1) 16) =>  false\n      (ldb-test (byte 3 2) 16) =>  true\n\nSee Also::\n..........\n\n*Note byte; byte-size; byte-position:: , *Note ldb:: , *Note zerop::\n\nNotes::\n.......\n\n      (ldb-test bytespec n) ==\n      (not (zerop (ldb bytespec n))) ==\n      (logtest (ldb bytespec -1) n)\n\n"
}