{
    "name": "method-combination-error",
    "prev": "invalid-method-error",
    "next": "signal",
    "up": "Conditions Dictionary",
    "header": {
        "type": "Function",
        "text": "method-combination-error"
    },
    "sections": [
        {
            "type": "Syntax",
            "defs": [
                {
                    "name": "method-combination-error",
                    "text": " format-control &rest args =>implementation-dependent\n\n"
                }
            ],
            "text": ""
        },
        {
            "type": "Arguments and Values",
            "text": "",
            "values": [
                {
                    "name": "format-control",
                    "desc": "a format control."
                },
                {
                    "name": "args",
                    "desc": "format arguments for format-control."
                }
            ]
        },
        {
            "type": "Description",
            "text": "The function method-combination-error is used to signal an error in method\ncombination.\nThe error message is constructed by using a format-control suitable for\nformat and any args to it.  Because an implementation may need to add\nadditional contextual information to the error message,\nmethod-combination-error should be called only within the dynamic extent\nof a method combination function.\nWhether method-combination-error returns to its caller or exits via throw\nis implementation-dependent.\n"
        },
        {
            "type": "Side Effects",
            "text": "The debugger might be entered.\n"
        },
        {
            "type": "Affected By",
            "text": "*break-on-signals*\n"
        },
        {
            "type": "See Also",
            "text": "*Note define-method-combination::\n"
        }
    ],
    "_otext": "File: gcl.info,  Node: method-combination-error,  Next: signal,  Prev: invalid-method-error,  Up: Conditions Dictionary\n\nmethod-combination-error                                         [Function]\n---------------------------------------------------------------------------\n\n`method-combination-error'  format-control &rest args =>\nimplementation-dependent\n\nArguments and Values::\n......................\n\nformat-control--a format control.\n\nargs--format arguments for format-control.\n\nDescription::\n.............\n\nThe function method-combination-error is used to signal an error in method\ncombination.\n\nThe error message is constructed by using a format-control suitable for\nformat and any args to it.  Because an implementation may need to add\nadditional contextual information to the error message,\nmethod-combination-error should be called only within the dynamic extent\nof a method combination function.\n\nWhether method-combination-error returns to its caller or exits via throw\nis implementation-dependent.\n\nSide Effects::\n..............\n\nThe debugger might be entered.\n\nAffected By::\n.............\n\n*break-on-signals*\n\nSee Also::\n..........\n\n*Note define-method-combination::\n\n"
}