{
    "name": "remhash",
    "prev": "gethash",
    "next": "maphash",
    "up": "Hash Tables Dictionary",
    "header": {
        "type": "Function",
        "text": "remhash"
    },
    "sections": [
        {
            "type": "Syntax",
            "defs": [
                {
                    "name": "remhash",
                    "text": " key hash-table =>  generalized-boolean\n"
                }
            ],
            "text": ""
        },
        {
            "type": "Arguments and Values",
            "text": "",
            "values": [
                {
                    "name": "key",
                    "desc": "an object."
                },
                {
                    "name": "hash-table",
                    "desc": "a hash table."
                },
                {
                    "name": "generalized-boolean",
                    "desc": "a generalized boolean."
                }
            ]
        },
        {
            "type": "Description",
            "text": "Removes the entry for key in hash-table, if any.  Returns true if there\nwas such an entry, or false otherwise.\n"
        },
        {
            "type": "Examples",
            "text": "      (setq table (make-hash-table)) =>  #<HASH-TABLE EQL 0/120 32115666>\n      (setf (gethash 100 table) \"C\") =>  \"C\"\n      (gethash 100 table) =>  \"C\", true\n      (remhash 100 table) =>  true\n      (gethash 100 table) =>  NIL, false\n      (remhash 100 table) =>  false\n"
        },
        {
            "type": "Side Effects",
            "text": "The hash-table is modified.\n"
        }
    ],
    "_otext": "File: gcl.info,  Node: remhash,  Next: maphash,  Prev: gethash,  Up: Hash Tables Dictionary\n\nremhash                                                          [Function]\n---------------------------------------------------------------------------\n\n`remhash'  key hash-table =>  generalized-boolean\n\nArguments and Values::\n......................\n\nkey--an object.\n\nhash-table--a hash table.\n\ngeneralized-boolean--a generalized boolean.\n\nDescription::\n.............\n\nRemoves the entry for key in hash-table, if any.  Returns true if there\nwas such an entry, or false otherwise.\n\nExamples::\n..........\n\n      (setq table (make-hash-table)) =>  #<HASH-TABLE EQL 0/120 32115666>\n      (setf (gethash 100 table) \"C\") =>  \"C\"\n      (gethash 100 table) =>  \"C\", true\n      (remhash 100 table) =>  true\n      (gethash 100 table) =>  NIL, false\n      (remhash 100 table) =>  false\n\nSide Effects::\n..............\n\nThe hash-table is modified.\n\n"
}