{
    "name": "machine-instance",
    "prev": "short-site-name",
    "next": "machine-type",
    "up": "Environment Dictionary",
    "header": {
        "type": "Function",
        "text": "machine-instance"
    },
    "sections": [
        {
            "type": "Syntax",
            "defs": [
                {
                    "name": "machine-instance",
                    "text": " <no arguments> =>  description\n"
                }
            ],
            "text": ""
        },
        {
            "type": "Arguments and Values",
            "text": "",
            "values": [
                {
                    "name": "description",
                    "desc": "a string or nil."
                }
            ]
        },
        {
            "type": "Description",
            "text": "Returns a string that identifies the particular instance of the computer\nhardware on which Common Lisp is running, or nil if no such string can be\ncomputed.\n"
        },
        {
            "type": "Examples",
            "text": "      (machine-instance)\n     =>  \"ACME.COM\"\n     OR=> \"S/N 123231\"\n     OR=> \"18.26.0.179\"\n     OR=> \"AA-00-04-00-A7-A4\"\n"
        },
        {
            "type": "Affected By",
            "text": "The machine instance, and the implementation.\n"
        },
        {
            "type": "See Also",
            "text": "*Note machine-type:: , *Note machine-version::\n"
        }
    ],
    "_otext": "File: gcl.info,  Node: machine-instance,  Next: machine-type,  Prev: short-site-name,  Up: Environment Dictionary\n\nmachine-instance                                                 [Function]\n---------------------------------------------------------------------------\n\n`machine-instance'  <no arguments> =>  description\n\nArguments and Values::\n......................\n\ndescription--a string or nil.\n\nDescription::\n.............\n\nReturns a string that identifies the particular instance of the computer\nhardware on which Common Lisp is running, or nil if no such string can be\ncomputed.\n\nExamples::\n..........\n\n      (machine-instance)\n     =>  \"ACME.COM\"\n     OR=> \"S/N 123231\"\n     OR=> \"18.26.0.179\"\n     OR=> \"AA-00-04-00-A7-A4\"\n\nAffected By::\n.............\n\nThe machine instance, and the implementation.\n\nSee Also::\n..........\n\n*Note machine-type:: , *Note machine-version::\n\n"
}