{
    "name": "lcm",
    "prev": "incf",
    "next": "log",
    "up": "Numbers Dictionary",
    "header": {
        "type": "Function",
        "text": "lcm"
    },
    "sections": [
        {
            "type": "Syntax",
            "defs": [
                {
                    "name": "lcm",
                    "text": " &rest integers =>  least-common-multiple\n"
                }
            ],
            "text": ""
        },
        {
            "type": "Arguments and Values",
            "text": "",
            "values": [
                {
                    "name": "integer",
                    "desc": "an integer."
                },
                {
                    "name": "least-common-multiple",
                    "desc": "a non-negative integer."
                }
            ]
        },
        {
            "type": "Description",
            "text": "lcm returns the least common multiple of the integers.\nIf no integer is supplied, the integer 1 is returned.\nIf only one integer is supplied, the absolute value of that integer is\nreturned.\nFor two arguments that are not both zero,\n      (lcm a b) == (/ (abs (* a b)) (gcd a b))\nIf one or both arguments are zero,\n      (lcm a 0) == (lcm 0 a) == 0\nFor three or more arguments,\n      (lcm a b c ... z) == (lcm (lcm a b) c ... z)\n"
        },
        {
            "type": "Examples",
            "text": "      (lcm 10) =>  10\n      (lcm 25 30) =>  150\n      (lcm -24 18 10) =>  360\n      (lcm 14 35) =>  70\n      (lcm 0 5) =>  0\n      (lcm 1 2 3 4 5 6) =>  60\n"
        },
        {
            "type": "Exceptional Situations",
            "text": "Should signal type-error if any argument is not an integer.\n"
        },
        {
            "type": "See Also",
            "text": "*Note gcd::\n"
        }
    ],
    "_otext": "File: gcl.info,  Node: lcm,  Next: log,  Prev: incf,  Up: Numbers Dictionary\n\nlcm                                                              [Function]\n---------------------------------------------------------------------------\n\n`lcm'  &rest integers =>  least-common-multiple\n\nArguments and Values::\n......................\n\ninteger--an integer.\n\nleast-common-multiple--a non-negative integer.\n\nDescription::\n.............\n\nlcm returns the least common multiple of the integers.\n\nIf no integer is supplied, the integer 1 is returned.\n\nIf only one integer is supplied, the absolute value of that integer is\nreturned.\n\nFor two arguments that are not both zero,\n\n      (lcm a b) == (/ (abs (* a b)) (gcd a b))\n\nIf one or both arguments are zero,\n\n      (lcm a 0) == (lcm 0 a) == 0\n\nFor three or more arguments,\n\n      (lcm a b c ... z) == (lcm (lcm a b) c ... z)\n\nExamples::\n..........\n\n      (lcm 10) =>  10\n      (lcm 25 30) =>  150\n      (lcm -24 18 10) =>  360\n      (lcm 14 35) =>  70\n      (lcm 0 5) =>  0\n      (lcm 1 2 3 4 5 6) =>  60\n\nExceptional Situations::\n........................\n\nShould signal type-error if any argument is not an integer.\n\nSee Also::\n..........\n\n*Note gcd::\n\n"
}