{
    "name": "random-state-p",
    "prev": "random",
    "next": "*random-state*",
    "up": "Numbers Dictionary",
    "header": {
        "type": "Function",
        "text": "random-state-p"
    },
    "sections": [
        {
            "type": "Syntax",
            "defs": [
                {
                    "name": "random-state-p",
                    "text": " object =>  generalized-boolean\n"
                }
            ],
            "text": ""
        },
        {
            "type": "Arguments and Values",
            "text": "",
            "values": [
                {
                    "name": "object",
                    "desc": "an object."
                },
                {
                    "name": "generalized-boolean",
                    "desc": "a generalized boolean."
                }
            ]
        },
        {
            "type": "Description",
            "text": "Returns true if object is of type random-state; otherwise, returns false.\n"
        },
        {
            "type": "Examples",
            "text": "      (random-state-p *random-state*) =>  true\n      (random-state-p (make-random-state)) =>  true\n      (random-state-p 'test-function) =>  false\n"
        },
        {
            "type": "See Also",
            "text": "*Note make-random-state:: , *Note random-state::\n"
        },
        {
            "type": "Notes",
            "text": "      (random-state-p object) == (typep object 'random-state)\n"
        }
    ],
    "_otext": "File: gcl.info,  Node: random-state-p,  Next: *random-state*,  Prev: random,  Up: Numbers Dictionary\n\nrandom-state-p                                                   [Function]\n---------------------------------------------------------------------------\n\n`random-state-p'  object =>  generalized-boolean\n\nArguments and Values::\n......................\n\nobject--an object.\n\ngeneralized-boolean--a generalized boolean.\n\nDescription::\n.............\n\nReturns true if object is of type random-state; otherwise, returns false.\n\nExamples::\n..........\n\n      (random-state-p *random-state*) =>  true\n      (random-state-p (make-random-state)) =>  true\n      (random-state-p 'test-function) =>  false\n\nSee Also::\n..........\n\n*Note make-random-state:: , *Note random-state::\n\nNotes::\n.......\n\n      (random-state-p object) == (typep object 'random-state)\n\n"
}