{
    "name": "echo-stream-input-stream",
    "prev": "two-way-stream-input-stream",
    "next": "make-echo-stream",
    "up": "Streams Dictionary",
    "header": {
        "type": "Function",
        "text": "echo-stream-input-stream, echo-stream-output-stream"
    },
    "sections": [
        {
            "type": "Syntax",
            "defs": [
                {
                    "name": "echo-stream-input-stream",
                    "text": " echo-stream =>  input-stream\n"
                },
                {
                    "name": "echo-stream-output-stream",
                    "text": " echo-stream =>  output-stream\n\n"
                }
            ],
            "text": ""
        },
        {
            "type": "Arguments and Values",
            "text": "",
            "values": [
                {
                    "name": "echo-stream",
                    "desc": "an echo stream."
                },
                {
                    "name": "input-stream",
                    "desc": "an input stream."
                },
                {
                    "name": "output-stream",
                    "desc": "an output stream."
                }
            ]
        },
        {
            "type": "Description",
            "text": "echo-stream-input-stream returns the input stream from which echo-stream\nreceives input.\necho-stream-output-stream returns the output stream to which echo-stream\nsends output.\n"
        }
    ],
    "_otext": "File: gcl.info,  Node: echo-stream-input-stream,  Next: make-echo-stream,  Prev: two-way-stream-input-stream,  Up: Streams Dictionary\n\necho-stream-input-stream, echo-stream-output-stream              [Function]\n---------------------------------------------------------------------------\n\n`echo-stream-input-stream'  echo-stream =>  input-stream\n\n`echo-stream-output-stream'  echo-stream =>  output-stream\n\nArguments and Values::\n......................\n\necho-stream--an echo stream.\n\ninput-stream--an input stream.\n\noutput-stream--an output stream.\n\nDescription::\n.............\n\necho-stream-input-stream returns the input stream from which echo-stream\nreceives input.\n\necho-stream-output-stream returns the output stream to which echo-stream\nsends output.\n\n"
}