{
    "name": "special-operator-p",
    "prev": "the",
    "next": "constantp",
    "up": "Evaluation and Compilation Dictionary",
    "header": {
        "type": "Function",
        "text": "special-operator-p"
    },
    "sections": [
        {
            "type": "Syntax",
            "defs": [
                {
                    "name": "special-operator-p",
                    "text": " symbol =>  generalized-boolean\n"
                }
            ],
            "text": ""
        },
        {
            "type": "Arguments and Values",
            "text": "",
            "values": [
                {
                    "name": "symbol",
                    "desc": "a symbol."
                },
                {
                    "name": "generalized-boolean",
                    "desc": "a generalized boolean."
                }
            ]
        },
        {
            "type": "Description",
            "text": "Returns true if symbol is a special operator; otherwise, returns false.\n"
        },
        {
            "type": "Examples",
            "text": "      (special-operator-p 'if) =>  true\n      (special-operator-p 'car) =>  false\n      (special-operator-p 'one) =>  false\n"
        },
        {
            "type": "Exceptional Situations",
            "text": "Should signal type-error if its argument is not a symbol.\n"
        },
        {
            "type": "Notes",
            "text": "Historically, this function was called special-form-p.  The name was\nfinally declared a misnomer and changed, since it returned true for\nspecial operators, not special forms.\n"
        }
    ],
    "_otext": "File: gcl.info,  Node: special-operator-p,  Next: constantp,  Prev: the,  Up: Evaluation and Compilation Dictionary\n\nspecial-operator-p                                               [Function]\n---------------------------------------------------------------------------\n\n`special-operator-p'  symbol =>  generalized-boolean\n\nArguments and Values::\n......................\n\nsymbol--a symbol.\n\ngeneralized-boolean--a generalized boolean.\n\nDescription::\n.............\n\nReturns true if symbol is a special operator; otherwise, returns false.\n\nExamples::\n..........\n\n      (special-operator-p 'if) =>  true\n      (special-operator-p 'car) =>  false\n      (special-operator-p 'one) =>  false\n\nExceptional Situations::\n........................\n\nShould signal type-error if its argument is not a symbol.\n\nNotes::\n.......\n\nHistorically, this function was called special-form-p.  The name was\nfinally declared a misnomer and changed, since it returned true for\nspecial operators, not special forms.\n\n"
}