{
    "name": "numberp",
    "prev": "*random-state*",
    "next": "cis",
    "up": "Numbers Dictionary",
    "header": {
        "type": "Function",
        "text": "numberp"
    },
    "sections": [
        {
            "type": "Syntax",
            "defs": [
                {
                    "name": "numberp",
                    "text": " object =>  generalized-boolean\n"
                }
            ],
            "text": ""
        },
        {
            "type": "Arguments and Values",
            "text": "",
            "values": [
                {
                    "name": "object",
                    "desc": "an object."
                },
                {
                    "name": "generalized-boolean",
                    "desc": "a generalized boolean."
                }
            ]
        },
        {
            "type": "Description",
            "text": "Returns true if object is of type number; otherwise, returns false.\n"
        },
        {
            "type": "Examples",
            "text": "      (numberp 12) =>  true\n      (numberp (expt 2 130)) =>  true\n      (numberp #c(5/3 7.2)) =>  true\n      (numberp nil) =>  false\n      (numberp (cons 1 2)) =>  false\n"
        },
        {
            "type": "Notes",
            "text": "      (numberp object) == (typep object 'number)\n"
        }
    ],
    "_otext": "File: gcl.info,  Node: numberp,  Next: cis,  Prev: *random-state*,  Up: Numbers Dictionary\n\nnumberp                                                          [Function]\n---------------------------------------------------------------------------\n\n`numberp'  object =>  generalized-boolean\n\nArguments and Values::\n......................\n\nobject--an object.\n\ngeneralized-boolean--a generalized boolean.\n\nDescription::\n.............\n\nReturns true if object is of type number; otherwise, returns false.\n\nExamples::\n..........\n\n      (numberp 12) =>  true\n      (numberp (expt 2 130)) =>  true\n      (numberp #c(5/3 7.2)) =>  true\n      (numberp nil) =>  false\n      (numberp (cons 1 2)) =>  false\n\nNotes::\n.......\n\n      (numberp object) == (typep object 'number)\n\n"
}