{
    "name": "slot-unbound",
    "prev": "slot-missing",
    "next": "slot-value",
    "up": "Objects Dictionary",
    "header": {
        "type": "Standard Generic Function",
        "text": "slot-unbound"
    },
    "sections": [
        {
            "type": "",
            "text": ""
        },
        {
            "type": "Syntax",
            "defs": [
                {
                    "name": "slot-unbound",
                    "text": " class instance slot-name =>  {result}*\n"
                }
            ],
            "text": ""
        },
        {
            "type": "Syntax",
            "defs": [
                {
                    "name": "slot-unbound",
                    "text": " (class t) instance slot-name\n"
                }
            ],
            "text": ""
        },
        {
            "type": "Arguments and Values",
            "text": "",
            "values": [
                {
                    "name": "class",
                    "desc": "the class of the instance."
                },
                {
                    "name": "instance",
                    "desc": "the instance in which an attempt was made to read the unbound"
                },
                {
                    "name": "instance",
                    "desc": "the instance in which an attempt was made to read the unboundslot.\n"
                },
                {
                    "name": "slot-name",
                    "desc": "the name of the unbound slot."
                },
                {
                    "name": "result",
                    "desc": "an object."
                }
            ]
        },
        {
            "type": "Description",
            "text": "The generic function slot-unbound is called when an unbound slot is read in\nan instance whose metaclass is standard-class.  The default method signals\nan error\nof type unbound-slot.  The name slot of the unbound-slot condition is\ninitialized to the name of the offending variable, and the instance slot\nof the unbound-slot condition is initialized to the offending instance.\nThe generic function slot-unbound is not intended to be called by\nprogrammers.  Programmers may write methods for it.  The function\nslot-unbound is called only indirectly by slot-value.\nIf slot-unbound returns, only the primary value will be used by the caller,\nand all other values will be ignored.\n"
        },
        {
            "type": "Exceptional Situations",
            "text": "The default method on slot-unbound signals an error of type unbound-slot.\n"
        },
        {
            "type": "See Also",
            "text": "*Note slot-makunbound::\n"
        },
        {
            "type": "Notes",
            "text": "An unbound slot may occur if no :initform form was specified for the slot\nand the slot value has not been set, or if slot-makunbound has been called\non the slot.\n"
        }
    ],
    "_otext": "File: gcl.info,  Node: slot-unbound,  Next: slot-value,  Prev: slot-missing,  Up: Objects Dictionary\n\nslot-unbound                                    [Standard Generic Function]\n---------------------------------------------------------------------------\n\nSyntax::\n........\n\n`slot-unbound'  class instance slot-name =>  {result}*\n\nMethod Signatures::\n...................\n\n`slot-unbound'  (class t) instance slot-name\n\nArguments and Values::\n......................\n\nclass--the class of the instance.\n\ninstance--the instance in which an attempt was made to read the unbound\nslot.\n\nslot-name--the name of the unbound slot.\n\nresult--an object.\n\nDescription::\n.............\n\nThe generic function slot-unbound is called when an unbound slot is read in\nan instance whose metaclass is standard-class.  The default method signals\nan error\n\nof type unbound-slot.  The name slot of the unbound-slot condition is\ninitialized to the name of the offending variable, and the instance slot\nof the unbound-slot condition is initialized to the offending instance.\n\nThe generic function slot-unbound is not intended to be called by\nprogrammers.  Programmers may write methods for it.  The function\nslot-unbound is called only indirectly by slot-value.\n\nIf slot-unbound returns, only the primary value will be used by the caller,\nand all other values will be ignored.\n\nExceptional Situations::\n........................\n\nThe default method on slot-unbound signals an error of type unbound-slot.\n\nSee Also::\n..........\n\n*Note slot-makunbound::\n\nNotes::\n.......\n\nAn unbound slot may occur if no :initform form was specified for the slot\nand the slot value has not been set, or if slot-makunbound has been called\non the slot.\n\n"
}