{
    "name": "hash-table-size",
    "prev": "hash-table-rehash-threshold",
    "next": "hash-table-test",
    "up": "Hash Tables Dictionary",
    "header": {
        "type": "Function",
        "text": "hash-table-size"
    },
    "sections": [
        {
            "type": "Syntax",
            "defs": [
                {
                    "name": "hash-table-size",
                    "text": " hash-table =>  size\n"
                }
            ],
            "text": ""
        },
        {
            "type": "Arguments and Values",
            "text": "",
            "values": [
                {
                    "name": "hash-table",
                    "desc": "a hash table."
                },
                {
                    "name": "size",
                    "desc": "a non-negative integer."
                }
            ]
        },
        {
            "type": "Description",
            "text": "Returns the current size of hash-table, which is suitable for use in a\ncall to make-hash-table in order to produce a hash table with state\ncorresponding to the current state of the hash-table.\n"
        },
        {
            "type": "Exceptional Situations",
            "text": "Should signal an error of type type-error if hash-table is not a hash\ntable.\n"
        },
        {
            "type": "See Also",
            "text": "*Note hash-table-count:: , *Note make-hash-table::\n"
        }
    ],
    "_otext": "File: gcl.info,  Node: hash-table-size,  Next: hash-table-test,  Prev: hash-table-rehash-threshold,  Up: Hash Tables Dictionary\n\nhash-table-size                                                  [Function]\n---------------------------------------------------------------------------\n\n`hash-table-size'  hash-table =>  size\n\nArguments and Values::\n......................\n\nhash-table--a hash table.\n\nsize--a non-negative integer.\n\nDescription::\n.............\n\nReturns the current size of hash-table, which is suitable for use in a\ncall to make-hash-table in order to produce a hash table with state\ncorresponding to the current state of the hash-table.\n\nExceptional Situations::\n........................\n\nShould signal an error of type type-error if hash-table is not a hash\ntable.\n\nSee Also::\n..........\n\n*Note hash-table-count:: , *Note make-hash-table::\n\n"
}