{
    "name": "arithmetic-error-operands",
    "prev": "arithmetic-error",
    "next": "division-by-zero",
    "up": "Numbers Dictionary",
    "header": {
        "type": "Function",
        "text": "arithmetic-error-operands, arithmetic-error-operation"
    },
    "sections": [
        {
            "type": "Syntax",
            "defs": [
                {
                    "name": "arithmetic-error-operands",
                    "text": " condition =>  operands\n"
                },
                {
                    "name": "arithmetic-error-operation",
                    "text": " condition =>  operation\n\n"
                }
            ],
            "text": ""
        },
        {
            "type": "Arguments and Values",
            "text": "",
            "values": [
                {
                    "name": "condition",
                    "desc": "a condition of type arithmetic-error."
                },
                {
                    "name": "operands",
                    "desc": "a list."
                },
                {
                    "name": "operation",
                    "desc": "a function designator."
                }
            ]
        },
        {
            "type": "Description",
            "text": "arithmetic-error-operands returns a list of the operands which were used\nin the offending call to the operation that signaled the condition.\narithmetic-error-operation returns a list of the offending operation in\nthe offending call that signaled the condition.\n"
        },
        {
            "type": "See Also",
            "text": "arithmetic-error, *Note Conditions::\n"
        },
        {
            "type": "Notes",
            "text": ""
        }
    ],
    "_otext": "File: gcl.info,  Node: arithmetic-error-operands,  Next: division-by-zero,  Prev: arithmetic-error,  Up: Numbers Dictionary\n\narithmetic-error-operands, arithmetic-error-operation            [Function]\n---------------------------------------------------------------------------\n\n`arithmetic-error-operands'  condition =>  operands\n\n`arithmetic-error-operation'  condition =>  operation\n\nArguments and Values::\n......................\n\ncondition--a condition of type arithmetic-error.\n\noperands--a list.\n\noperation--a function designator.\n\nDescription::\n.............\n\narithmetic-error-operands returns a list of the operands which were used\nin the offending call to the operation that signaled the condition.\n\narithmetic-error-operation returns a list of the offending operation in\nthe offending call that signaled the condition.\n\nSee Also::\n..........\n\narithmetic-error, *Note Conditions::\n\nNotes::\n.......\n\n"
}