{
    "name": "in-package",
    "prev": "unintern",
    "next": "unuse-package",
    "up": "Packages Dictionary",
    "header": {
        "type": "Macro",
        "text": "in-package"
    },
    "sections": [
        {
            "type": "Syntax",
            "defs": [
                {
                    "name": "in-package",
                    "text": " name =>  package\n"
                }
            ],
            "text": ""
        },
        {
            "type": "Arguments and Values",
            "text": "",
            "values": [
                {
                    "name": "name",
                    "desc": "a string designator; not evaluated."
                },
                {
                    "name": "package",
                    "desc": "the package named by name."
                }
            ]
        },
        {
            "type": "Description",
            "text": "Causes the the package named by name to become the current package--that\nis, the value of *package*.  If no such package already exists, an error\nof type package-error is signaled.\nEverything in-package does is also performed at compile time if the call\nappears as a top level form.\n"
        },
        {
            "type": "Side Effects",
            "text": "The variable *package* is assigned.  If the in-package form is a top level\nform, this assignment also occurs at compile time.\n"
        },
        {
            "type": "Exceptional Situations",
            "text": "An error of type package-error is signaled if the specified package does\nnot exist.\n"
        },
        {
            "type": "See Also",
            "text": "*Note package::\n"
        }
    ],
    "_otext": "File: gcl.info,  Node: in-package,  Next: unuse-package,  Prev: unintern,  Up: Packages Dictionary\n\nin-package                                                          [Macro]\n---------------------------------------------------------------------------\n\n`in-package'  name =>  package\n\nArguments and Values::\n......................\n\nname--a string designator; not evaluated.\n\npackage--the package named by name.\n\nDescription::\n.............\n\nCauses the the package named by name to become the current package--that\nis, the value of *package*.  If no such package already exists, an error\nof type package-error is signaled.\n\nEverything in-package does is also performed at compile time if the call\nappears as a top level form.\n\nSide Effects::\n..............\n\nThe variable *package* is assigned.  If the in-package form is a top level\nform, this assignment also occurs at compile time.\n\nExceptional Situations::\n........................\n\nAn error of type package-error is signaled if the specified package does\nnot exist.\n\nSee Also::\n..........\n\n*Note package::\n\n"
}