{
    "name": "get-internal-real-time",
    "prev": "internal-time-units-per-second",
    "next": "get-internal-run-time",
    "up": "Environment Dictionary",
    "header": {
        "type": "Function",
        "text": "get-internal-real-time"
    },
    "sections": [
        {
            "type": "Syntax",
            "defs": [
                {
                    "name": "get-internal-real-time",
                    "text": " <no arguments> =>  internal-time\n"
                }
            ],
            "text": ""
        },
        {
            "type": "Arguments and Values",
            "text": "",
            "values": [
                {
                    "name": "internal-time",
                    "desc": "a non-negative integer."
                }
            ]
        },
        {
            "type": "Description",
            "text": "get-internal-real-time returns as an integer the current time in internal\ntime units, relative to an arbitrary time base.  The difference between\nthe values of two calls to this function is the amount of elapsed real\ntime (i.e., clock time) between the two calls.\n"
        },
        {
            "type": "Affected By",
            "text": "Time of day (i.e., the passage of time).  The time base affects the result\nmagnitude.\n"
        },
        {
            "type": "See Also",
            "text": "*Note internal-time-units-per-second::\n"
        }
    ],
    "_otext": "File: gcl.info,  Node: get-internal-real-time,  Next: get-internal-run-time,  Prev: internal-time-units-per-second,  Up: Environment Dictionary\n\nget-internal-real-time                                           [Function]\n---------------------------------------------------------------------------\n\n`get-internal-real-time'  <no arguments> =>  internal-time\n\nArguments and Values::\n......................\n\ninternal-time--a non-negative integer.\n\nDescription::\n.............\n\nget-internal-real-time returns as an integer the current time in internal\ntime units, relative to an arbitrary time base.  The difference between\nthe values of two calls to this function is the amount of elapsed real\ntime (i.e., clock time) between the two calls.\n\nAffected By::\n.............\n\nTime of day (i.e., the passage of time).  The time base affects the result\nmagnitude.\n\nSee Also::\n..........\n\n*Note internal-time-units-per-second::\n\n"
}