{
    "name": "hash-table-rehash-size",
    "prev": "hash-table-count",
    "next": "hash-table-rehash-threshold",
    "up": "Hash Tables Dictionary",
    "header": {
        "type": "Function",
        "text": "hash-table-rehash-size"
    },
    "sections": [
        {
            "type": "Syntax",
            "defs": [
                {
                    "name": "hash-table-rehash-size",
                    "text": " hash-table =>  rehash-size\n"
                }
            ],
            "text": ""
        },
        {
            "type": "Arguments and Values",
            "text": "",
            "values": [
                {
                    "name": "hash-table",
                    "desc": "a hash table."
                },
                {
                    "name": "rehash-size",
                    "desc": "a real of type (or (integer 1 *) (float (1.0) *))."
                }
            ]
        },
        {
            "type": "Description",
            "text": "Returns the current rehash size of hash-table, suitable for use in a call\nto make-hash-table in order to produce a hash table with state\ncorresponding to the current state of the hash-table.\n"
        },
        {
            "type": "Examples",
            "text": "      (setq table (make-hash-table :size 100 :rehash-size 1.4))\n     =>  #<HASH-TABLE EQL 0/100 2556371>\n      (hash-table-rehash-size table) =>  1.4\n"
        },
        {
            "type": "Exceptional Situations",
            "text": "Should signal an error of type type-error if hash-table is not a hash\ntable.\n"
        },
        {
            "type": "See Also",
            "text": "*Note make-hash-table:: , *Note hash-table-rehash-threshold::\n"
        },
        {
            "type": "Notes",
            "text": "If the hash table was created with an integer rehash size, the result is\nan integer, indicating that the rate of growth of the hash-table when\nrehashed is intended to be additive; otherwise, the result is a float,\nindicating that the rate of growth of the hash-table when rehashed is\nintended to be multiplicative.  However, this value is only advice to the\nimplementation; the actual amount by which the hash-table will grow upon\nrehash is implementation-dependent.\n"
        }
    ],
    "_otext": "File: gcl.info,  Node: hash-table-rehash-size,  Next: hash-table-rehash-threshold,  Prev: hash-table-count,  Up: Hash Tables Dictionary\n\nhash-table-rehash-size                                           [Function]\n---------------------------------------------------------------------------\n\n`hash-table-rehash-size'  hash-table =>  rehash-size\n\nArguments and Values::\n......................\n\nhash-table--a hash table.\n\nrehash-size--a real of type (or (integer 1 *) (float (1.0) *)).\n\nDescription::\n.............\n\nReturns the current rehash size of hash-table, suitable for use in a call\nto make-hash-table in order to produce a hash table with state\ncorresponding to the current state of the hash-table.\n\nExamples::\n..........\n\n      (setq table (make-hash-table :size 100 :rehash-size 1.4))\n     =>  #<HASH-TABLE EQL 0/100 2556371>\n      (hash-table-rehash-size table) =>  1.4\n\nExceptional Situations::\n........................\n\nShould signal an error of type type-error if hash-table is not a hash\ntable.\n\nSee Also::\n..........\n\n*Note make-hash-table:: , *Note hash-table-rehash-threshold::\n\nNotes::\n.......\n\nIf the hash table was created with an integer rehash size, the result is\nan integer, indicating that the rate of growth of the hash-table when\nrehashed is intended to be additive; otherwise, the result is a float,\nindicating that the rate of growth of the hash-table when rehashed is\nintended to be multiplicative.  However, this value is only advice to the\nimplementation; the actual amount by which the hash-table will grow upon\nrehash is implementation-dependent.\n\n"
}