{
    "name": "incf",
    "prev": "gcd",
    "next": "lcm",
    "up": "Numbers Dictionary",
    "header": {
        "type": "Macro",
        "text": "incf, decf"
    },
    "sections": [
        {
            "type": "Syntax",
            "defs": [
                {
                    "name": "incf",
                    "text": " place [delta-form] =>  new-value\n"
                },
                {
                    "name": "decf",
                    "text": " place [delta-form] =>  new-value\n\n"
                }
            ],
            "text": ""
        },
        {
            "type": "Arguments and Values",
            "text": "",
            "values": [
                {
                    "name": "place",
                    "desc": "a place."
                },
                {
                    "name": "delta-form",
                    "desc": "a form; evaluated to produce a delta.  The default is 1."
                },
                {
                    "name": "delta",
                    "desc": "a number."
                },
                {
                    "name": "new-value",
                    "desc": "a number."
                }
            ]
        },
        {
            "type": "Description",
            "text": "incf and decf are used for incrementing and decrementing the value of\nplace, respectively.\nThe delta is added to        (in the case of incf) or subtracted from (in\nthe case of decf) the number in place and the result is stored in place.\nAny necessary type conversions are performed automatically.\nFor information about the evaluation of subforms of places, see *Note\nEvaluation of Subforms to Places::.\n"
        },
        {
            "type": "Examples",
            "text": "      (setq n 0)\n      (incf n) =>  1\n      n =>  1\n      (decf n 3) =>  -2\n      n =>  -2\n      (decf n -5) =>  3\n      (decf n) =>  2\n      (incf n 0.5) =>  2.5\n      (decf n) =>  1.5\n      n =>  1.5\n"
        },
        {
            "type": "Side Effects",
            "text": "Place is modified.\n"
        },
        {
            "type": "See Also",
            "text": "+, *Note -:: , 1+, 1-, *Note setf; psetf::\n"
        }
    ],
    "_otext": "File: gcl.info,  Node: incf,  Next: lcm,  Prev: gcd,  Up: Numbers Dictionary\n\nincf, decf                                                          [Macro]\n---------------------------------------------------------------------------\n\n`incf'  place [delta-form] =>  new-value\n\n`decf'  place [delta-form] =>  new-value\n\nArguments and Values::\n......................\n\nplace--a place.\n\ndelta-form--a form; evaluated to produce a delta.  The default is 1.\n\ndelta--a number.\n\nnew-value--a number.\n\nDescription::\n.............\n\nincf and decf are used for incrementing and decrementing the value of\nplace, respectively.\n\nThe delta is added to        (in the case of incf) or subtracted from (in\nthe case of decf) the number in place and the result is stored in place.\n\nAny necessary type conversions are performed automatically.\n\nFor information about the evaluation of subforms of places, see *Note\nEvaluation of Subforms to Places::.\n\nExamples::\n..........\n\n      (setq n 0)\n      (incf n) =>  1\n      n =>  1\n      (decf n 3) =>  -2\n      n =>  -2\n      (decf n -5) =>  3\n      (decf n) =>  2\n      (incf n 0.5) =>  2.5\n      (decf n) =>  1.5\n      n =>  1.5\n\nSide Effects::\n..............\n\nPlace is modified.\n\nSee Also::\n..........\n\n+, *Note -:: , 1+, 1-, *Note setf; psetf::\n\n"
}