{
    "name": "get-output-stream-string",
    "prev": "make-concatenated-stream",
    "next": "make-string-input-stream",
    "up": "Streams Dictionary",
    "header": {
        "type": "Function",
        "text": "get-output-stream-string"
    },
    "sections": [
        {
            "type": "Syntax",
            "defs": [
                {
                    "name": "get-output-stream-string",
                    "text": " string-output-stream =>  string\n"
                }
            ],
            "text": ""
        },
        {
            "type": "Arguments and Values",
            "text": "",
            "values": [
                {
                    "name": "string-output-stream",
                    "desc": "a stream."
                },
                {
                    "name": "string",
                    "desc": "a string."
                }
            ]
        },
        {
            "type": "Description",
            "text": "Returns a string containing, in order, all the characters that have been\noutput to string-output-stream.  This operation clears any characters on\nstring-output-stream, so the string contains only those characters which\nhave been output since the last call to get-output-stream-string or since\nthe creation of the string-output-stream, whichever occurred most recently.\n"
        },
        {
            "type": "Examples",
            "text": "      (setq a-stream (make-string-output-stream)\n             a-string \"abcdefghijklm\") =>  \"abcdefghijklm\"\n      (write-string a-string a-stream) =>  \"abcdefghijklm\"\n      (get-output-stream-string a-stream) =>  \"abcdefghijklm\"\n      (get-output-stream-string a-stream) =>  \"\"\n"
        },
        {
            "type": "Side Effects",
            "text": "The string-output-stream is cleared.\n"
        },
        {
            "type": "Exceptional Situations",
            "text": "The consequences are undefined if stream-output-string is closed.\nThe consequences are undefined if string-output-stream is a stream that\nwas not produced by make-string-output-stream.\nThe consequences are undefined if string-output-stream was created\nimplicitly by with-output-to-string or format.\n"
        },
        {
            "type": "See Also",
            "text": "*Note make-string-output-stream::\n"
        }
    ],
    "_otext": "File: gcl.info,  Node: get-output-stream-string,  Next: make-string-input-stream,  Prev: make-concatenated-stream,  Up: Streams Dictionary\n\nget-output-stream-string                                         [Function]\n---------------------------------------------------------------------------\n\n`get-output-stream-string'  string-output-stream =>  string\n\nArguments and Values::\n......................\n\nstring-output-stream--a stream.\n\nstring--a string.\n\nDescription::\n.............\n\nReturns a string containing, in order, all the characters that have been\noutput to string-output-stream.  This operation clears any characters on\nstring-output-stream, so the string contains only those characters which\nhave been output since the last call to get-output-stream-string or since\nthe creation of the string-output-stream, whichever occurred most recently.\n\nExamples::\n..........\n\n      (setq a-stream (make-string-output-stream)\n             a-string \"abcdefghijklm\") =>  \"abcdefghijklm\"\n      (write-string a-string a-stream) =>  \"abcdefghijklm\"\n      (get-output-stream-string a-stream) =>  \"abcdefghijklm\"\n      (get-output-stream-string a-stream) =>  \"\"\n\nSide Effects::\n..............\n\nThe string-output-stream is cleared.\n\nExceptional Situations::\n........................\n\nThe consequences are undefined if stream-output-string is closed.\n\nThe consequences are undefined if string-output-stream is a stream that\nwas not produced by make-string-output-stream.\n\nThe consequences are undefined if string-output-stream was created\nimplicitly by with-output-to-string or format.\n\nSee Also::\n..........\n\n*Note make-string-output-stream::\n\n"
}