{
    "name": "vectorp",
    "prev": "vector-push",
    "next": "bit",
    "up": "Arrays Dictionary",
    "header": {
        "type": "Function",
        "text": "vectorp"
    },
    "sections": [
        {
            "type": "Syntax",
            "defs": [
                {
                    "name": "vectorp",
                    "text": " object =>  generalized-boolean\n"
                }
            ],
            "text": ""
        },
        {
            "type": "Arguments and Values",
            "text": "",
            "values": [
                {
                    "name": "object",
                    "desc": "an object."
                },
                {
                    "name": "generalized-boolean",
                    "desc": "a generalized boolean."
                }
            ]
        },
        {
            "type": "Description",
            "text": "Returns true if object is of type vector; otherwise, returns false.\n"
        },
        {
            "type": "Examples",
            "text": "      (vectorp \"aaaaaa\") =>  true\n      (vectorp (make-array 6 :fill-pointer t)) =>  true\n      (vectorp (make-array '(2 3 4))) =>  false\n      (vectorp #*11) =>  true\n      (vectorp #b11) =>  false\n"
        },
        {
            "type": "Notes",
            "text": "      (vectorp object) == (typep object 'vector)\n"
        }
    ],
    "_otext": "File: gcl.info,  Node: vectorp,  Next: bit,  Prev: vector-push,  Up: Arrays Dictionary\n\nvectorp                                                          [Function]\n---------------------------------------------------------------------------\n\n`vectorp'  object =>  generalized-boolean\n\nArguments and Values::\n......................\n\nobject--an object.\n\ngeneralized-boolean--a generalized boolean.\n\nDescription::\n.............\n\nReturns true if object is of type vector; otherwise, returns false.\n\nExamples::\n..........\n\n      (vectorp \"aaaaaa\") =>  true\n      (vectorp (make-array 6 :fill-pointer t)) =>  true\n      (vectorp (make-array '(2 3 4))) =>  false\n      (vectorp #*11) =>  true\n      (vectorp #b11) =>  false\n\nNotes::\n.......\n\n      (vectorp object) == (typep object 'vector)\n\n"
}