{
    "name": "pprint-tab",
    "prev": "pprint-pop",
    "next": "print-object",
    "up": "Printer Dictionary",
    "header": {
        "type": "Function",
        "text": "pprint-tab"
    },
    "sections": [
        {
            "type": "Syntax",
            "defs": [
                {
                    "name": "pprint-tab",
                    "text": " kind colnum colinc &optional stream =>  nil\n"
                }
            ],
            "text": ""
        },
        {
            "type": "Arguments and Values",
            "text": "",
            "values": [
                {
                    "name": "kind",
                    "desc": "one of :line, :section, :line-relative, or :section-relative."
                },
                {
                    "name": "colnum",
                    "desc": "a non-negative integer."
                },
                {
                    "name": "colinc",
                    "desc": "a non-negative integer."
                },
                {
                    "name": "stream",
                    "desc": "an output stream designator."
                }
            ]
        },
        {
            "type": "Description",
            "text": "Specifies tabbing to stream as performed by the standard ~T format\ndirective.\nIf stream is a pretty printing stream and the value of *print-pretty* is\ntrue,\ntabbing is performed; otherwise, pprint-tab has no effect.\nThe arguments colnum and colinc correspond to the two parameters to ~T and\nare in terms of ems.  The kind argument specifies the style of tabbing.\nIt must be one of :line (tab as by ~T), :section (tab as by ~:T, but\nmeasuring horizontal positions relative to the start of the dynamically\nenclosing section), :line-relative (tab as by ~@T), or :section-relative\n(tab as by ~:@T, but measuring horizontal positions relative to the start\nof the dynamically enclosing section).\n"
        },
        {
            "type": "Exceptional Situations",
            "text": "An error is signaled if kind is not one of :line, :section,\n:line-relative, or :section-relative.\n"
        },
        {
            "type": "See Also",
            "text": "*Note pprint-logical-block::\n"
        }
    ],
    "_otext": "File: gcl.info,  Node: pprint-tab,  Next: print-object,  Prev: pprint-pop,  Up: Printer Dictionary\n\npprint-tab                                                       [Function]\n---------------------------------------------------------------------------\n\n`pprint-tab'  kind colnum colinc &optional stream =>  nil\n\nArguments and Values::\n......................\n\nkind--one of :line, :section, :line-relative, or :section-relative.\n\ncolnum--a non-negative integer.\n\ncolinc--a non-negative integer.\n\nstream--an output stream designator.\n\nDescription::\n.............\n\nSpecifies tabbing to stream as performed by the standard ~T format\ndirective.\n\nIf stream is a pretty printing stream and the value of *print-pretty* is\ntrue,\n\ntabbing is performed; otherwise, pprint-tab has no effect.\n\nThe arguments colnum and colinc correspond to the two parameters to ~T and\nare in terms of ems.  The kind argument specifies the style of tabbing.\nIt must be one of :line (tab as by ~T), :section (tab as by ~:T, but\nmeasuring horizontal positions relative to the start of the dynamically\nenclosing section), :line-relative (tab as by ~@T), or :section-relative\n(tab as by ~:@T, but measuring horizontal positions relative to the start\nof the dynamically enclosing section).\n\nExceptional Situations::\n........................\n\nAn error is signaled if kind is not one of :line, :section,\n:line-relative, or :section-relative.\n\nSee Also::\n..........\n\n*Note pprint-logical-block::\n\n"
}