{
    "name": "truename",
    "prev": "ensure-directories-exist",
    "next": "file-author",
    "up": "Files Dictionary",
    "header": {
        "type": "Function",
        "text": "truename"
    },
    "sections": [
        {
            "type": "Syntax",
            "defs": [
                {
                    "name": "truename",
                    "text": " filespec =>  truename\n"
                }
            ],
            "text": ""
        },
        {
            "type": "Arguments and Values",
            "text": "",
            "values": [
                {
                    "name": "filespec",
                    "desc": "a pathname designator."
                },
                {
                    "name": "truename",
                    "desc": "a physical pathname."
                }
            ]
        },
        {
            "type": "Description",
            "text": "truename tries to find the file indicated by filespec and returns its\ntruename.  If the filespec designator is an open stream, its associated\nfile is used.\nIf filespec is a stream, truename can be used whether the stream is open\nor closed. It is permissible for truename to return more specific\ninformation after the stream is closed than when the stream was open.\nIf filespec is a pathname it represents the name used to open the file.\nThis may be, but is not required to be, the actual name of the file.\n"
        },
        {
            "type": "Examples",
            "text": "     ;; An example involving version numbers.  Note that the precise nature of\n     ;; the truename is implementation-dependent while the file is still open.\n      (with-open-file (stream \">vistor>test.text.newest\")\n        (values (pathname stream)\n                (truename stream)))\n     =>  #P\"S:>vistor>test.text.newest\", #P\"S:>vistor>test.text.1\"\n     OR=> #P\"S:>vistor>test.text.newest\", #P\"S:>vistor>test.text.newest\"\n     OR=> #P\"S:>vistor>test.text.newest\", #P\"S:>vistor>_temp_._temp_.1\"\n     ;; In this case, the file is closed when the truename is tried, so the\n     ;; truename information is reliable.\n      (with-open-file (stream \">vistor>test.text.newest\")\n        (close stream)\n        (values (pathname stream)\n                (truename stream)))\n     =>  #P\"S:>vistor>test.text.newest\", #P\"S:>vistor>test.text.1\"\n     ;; An example involving TOP-20's implementation-dependent concept\n     ;; of logical devices -- in this case, \"DOC:\" is shorthand for\n     ;; \"PS:<DOCUMENTATION>\" ...\n      (with-open-file (stream \"CMUC::DOC:DUMPER.HLP\")\n        (values (pathname stream)\n                (truename stream)))\n     =>  #P\"CMUC::DOC:DUMPER.HLP\", #P\"CMUC::PS:<DOCUMENTATION>DUMPER.HLP.13\"\n"
        },
        {
            "type": "Exceptional Situations",
            "text": "An error of type file-error is signaled if an appropriate file cannot be\nlocated within the file system for the given filespec,\nor if the file system cannot perform the requested operation.\nAn error of type file-error is signaled if pathname is wild.\n"
        },
        {
            "type": "See Also",
            "text": "pathname, logical-pathname, *Note File System Concepts::,\n*Note Pathnames as Filenames::\n"
        },
        {
            "type": "Notes",
            "text": "truename may be used to account for any filename translations performed by\nthe file system.\n"
        }
    ],
    "_otext": "File: gcl.info,  Node: truename,  Next: file-author,  Prev: ensure-directories-exist,  Up: Files Dictionary\n\ntruename                                                         [Function]\n---------------------------------------------------------------------------\n\n`truename'  filespec =>  truename\n\nArguments and Values::\n......................\n\nfilespec--a pathname designator.\n\ntruename--a physical pathname.\n\nDescription::\n.............\n\ntruename tries to find the file indicated by filespec and returns its\ntruename.  If the filespec designator is an open stream, its associated\nfile is used.\n\nIf filespec is a stream, truename can be used whether the stream is open\nor closed. It is permissible for truename to return more specific\ninformation after the stream is closed than when the stream was open.\n\nIf filespec is a pathname it represents the name used to open the file.\nThis may be, but is not required to be, the actual name of the file.\n\nExamples::\n..........\n\n     ;; An example involving version numbers.  Note that the precise nature of\n     ;; the truename is implementation-dependent while the file is still open.\n      (with-open-file (stream \">vistor>test.text.newest\")\n        (values (pathname stream)\n                (truename stream)))\n     =>  #P\"S:>vistor>test.text.newest\", #P\"S:>vistor>test.text.1\"\n     OR=> #P\"S:>vistor>test.text.newest\", #P\"S:>vistor>test.text.newest\"\n     OR=> #P\"S:>vistor>test.text.newest\", #P\"S:>vistor>_temp_._temp_.1\"\n     \n     ;; In this case, the file is closed when the truename is tried, so the\n     ;; truename information is reliable.\n      (with-open-file (stream \">vistor>test.text.newest\")\n        (close stream)\n        (values (pathname stream)\n                (truename stream)))\n     =>  #P\"S:>vistor>test.text.newest\", #P\"S:>vistor>test.text.1\"\n     \n     ;; An example involving TOP-20's implementation-dependent concept\n     ;; of logical devices -- in this case, \"DOC:\" is shorthand for\n     ;; \"PS:<DOCUMENTATION>\" ...\n      (with-open-file (stream \"CMUC::DOC:DUMPER.HLP\")\n        (values (pathname stream)\n                (truename stream)))\n     =>  #P\"CMUC::DOC:DUMPER.HLP\", #P\"CMUC::PS:<DOCUMENTATION>DUMPER.HLP.13\"\n\nExceptional Situations::\n........................\n\nAn error of type file-error is signaled if an appropriate file cannot be\nlocated within the file system for the given filespec,\n\nor if the file system cannot perform the requested operation.\n\nAn error of type file-error is signaled if pathname is wild.\n\nSee Also::\n..........\n\npathname, logical-pathname, *Note File System Concepts::,\n\n*Note Pathnames as Filenames::\n\nNotes::\n.......\n\ntruename may be used to account for any filename translations performed by\nthe file system.\n\n"
}