{
    "name": "broadcast-stream-streams",
    "prev": "synonym-stream-symbol",
    "next": "make-broadcast-stream",
    "up": "Streams Dictionary",
    "header": {
        "type": "Function",
        "text": "broadcast-stream-streams"
    },
    "sections": [
        {
            "type": "Syntax",
            "defs": [
                {
                    "name": "broadcast-stream-streams",
                    "text": " broadcast-stream =>  streams\n"
                }
            ],
            "text": ""
        },
        {
            "type": "Arguments and Values",
            "text": "",
            "values": [
                {
                    "name": "broadcast-stream",
                    "desc": "a broadcast stream."
                },
                {
                    "name": "streams",
                    "desc": "a list of streams."
                }
            ]
        },
        {
            "type": "Description",
            "text": "Returns a list of output streams that constitute all the streams to which\nthe broadcast-stream is broadcasting.\n"
        }
    ],
    "_otext": "File: gcl.info,  Node: broadcast-stream-streams,  Next: make-broadcast-stream,  Prev: synonym-stream-symbol,  Up: Streams Dictionary\n\nbroadcast-stream-streams                                         [Function]\n---------------------------------------------------------------------------\n\n`broadcast-stream-streams'  broadcast-stream =>  streams\n\nArguments and Values::\n......................\n\nbroadcast-stream--a broadcast stream.\n\nstreams--a list of streams.\n\nDescription::\n.............\n\nReturns a list of output streams that constitute all the streams to which\nthe broadcast-stream is broadcasting.\n\n"
}