{
    "name": "concatenated-stream-streams",
    "prev": "make-echo-stream",
    "next": "make-concatenated-stream",
    "up": "Streams Dictionary",
    "header": {
        "type": "Function",
        "text": "concatenated-stream-streams"
    },
    "sections": [
        {
            "type": "Syntax",
            "defs": [
                {
                    "name": "concatenated-stream-streams",
                    "text": " concatenated-stream =>  streams\n"
                }
            ],
            "text": ""
        },
        {
            "type": "Arguments and Values",
            "text": "",
            "values": [
                {
                    "name": "streams",
                    "desc": "a list of input streams."
                }
            ]
        },
        {
            "type": "Description",
            "text": "Returns a list of input streams that constitute the ordered set of streams\nthe concatenated-stream still has to read from, starting with the current\none it is reading from.  The list may be empty if no more streams remain\nto be read.\nThe consequences are undefined if the list structure of the streams is\never modified.\n"
        }
    ],
    "_otext": "File: gcl.info,  Node: concatenated-stream-streams,  Next: make-concatenated-stream,  Prev: make-echo-stream,  Up: Streams Dictionary\n\nconcatenated-stream-streams                                      [Function]\n---------------------------------------------------------------------------\n\n`concatenated-stream-streams'  concatenated-stream =>  streams\n\nArguments and Values::\n......................\n\nconcatenated-stream - a concatenated stream.\n\nstreams--a list of input streams.\n\nDescription::\n.............\n\nReturns a list of input streams that constitute the ordered set of streams\nthe concatenated-stream still has to read from, starting with the current\none it is reading from.  The list may be empty if no more streams remain\nto be read.\n\nThe consequences are undefined if the list structure of the streams is\never modified.\n\n"
}