{
    "name": "copy-pprint-dispatch",
    "prev": "Printer Dictionary",
    "next": "formatter",
    "up": "Printer Dictionary",
    "header": {
        "type": "Function",
        "text": "copy-pprint-dispatch"
    },
    "sections": [
        {
            "type": "Syntax",
            "defs": [
                {
                    "name": "copy-pprint-dispatch",
                    "text": " &optional table =>  new-table\n"
                }
            ],
            "text": ""
        },
        {
            "type": "Arguments and Values",
            "text": "",
            "values": [
                {
                    "name": "table",
                    "desc": "a pprint dispatch table, or nil."
                },
                {
                    "name": "new-table",
                    "desc": "a fresh pprint dispatch table."
                }
            ]
        },
        {
            "type": "Description",
            "text": "Creates and returns a copy of the specified table, or of the value of\n*print-pprint-dispatch* if no table is specified, or of the initial value\nof *print-pprint-dispatch* if nil is specified.\n"
        },
        {
            "type": "Exceptional Situations",
            "text": "Should signal an error of type type-error if table is not a pprint\ndispatch table.\n"
        }
    ],
    "_otext": "File: gcl.info,  Node: copy-pprint-dispatch,  Next: formatter,  Prev: Printer Dictionary,  Up: Printer Dictionary\n\ncopy-pprint-dispatch                                             [Function]\n---------------------------------------------------------------------------\n\n`copy-pprint-dispatch'  &optional table =>  new-table\n\nArguments and Values::\n......................\n\ntable--a pprint dispatch table, or nil.\n\nnew-table--a fresh pprint dispatch table.\n\nDescription::\n.............\n\nCreates and returns a copy of the specified table, or of the value of\n*print-pprint-dispatch* if no table is specified, or of the initial value\nof *print-pprint-dispatch* if nil is specified.\n\nExceptional Situations::\n........................\n\nShould signal an error of type type-error if table is not a pprint\ndispatch table.\n\n"
}