{
    "name": "alpha-char-p",
    "prev": "characterp",
    "next": "alphanumericp",
    "up": "Characters Dictionary",
    "header": {
        "type": "Function",
        "text": "alpha-char-p"
    },
    "sections": [
        {
            "type": "Syntax",
            "defs": [
                {
                    "name": "alpha-char-p",
                    "text": " character =>  generalized-boolean\n"
                }
            ],
            "text": ""
        },
        {
            "type": "Arguments and Values",
            "text": "",
            "values": [
                {
                    "name": "character",
                    "desc": "a character."
                },
                {
                    "name": "generalized-boolean",
                    "desc": "a generalized boolean."
                }
            ]
        },
        {
            "type": "Description",
            "text": "Returns true if character is an alphabetic_1 character; otherwise, returns\nfalse.\n"
        },
        {
            "type": "Examples",
            "text": "      (alpha-char-p #\\a) =>  true\n      (alpha-char-p #\\5) =>  false\n      (alpha-char-p #\\Newline) =>  false\n      ;; This next example presupposes an implementation\n      ;; in which #\\\\alpha is a defined character.\n      (alpha-char-p #\\\\alpha) =>  implementation-dependent\n"
        },
        {
            "type": "Affected By",
            "text": "None.  (In particular, the results of this predicate are independent of\nany special syntax which might have been enabled in the current readtable.)\n"
        },
        {
            "type": "Exceptional Situations",
            "text": "Should signal an error of type type-error if character is not a character.\n"
        },
        {
            "type": "See Also",
            "text": "*Note alphanumericp:: , *Note Documentation of Implementation-Defined\nScripts::\n"
        }
    ],
    "_otext": "File: gcl.info,  Node: alpha-char-p,  Next: alphanumericp,  Prev: characterp,  Up: Characters Dictionary\n\nalpha-char-p                                                     [Function]\n---------------------------------------------------------------------------\n\n`alpha-char-p'  character =>  generalized-boolean\n\nArguments and Values::\n......................\n\ncharacter--a character.\n\ngeneralized-boolean--a generalized boolean.\n\nDescription::\n.............\n\nReturns true if character is an alphabetic_1 character; otherwise, returns\nfalse.\n\nExamples::\n..........\n\n      (alpha-char-p #\\a) =>  true\n      (alpha-char-p #\\5) =>  false\n      (alpha-char-p #\\Newline) =>  false\n      ;; This next example presupposes an implementation\n      ;; in which #\\\\alpha is a defined character.\n      (alpha-char-p #\\\\alpha) =>  implementation-dependent\n\nAffected By::\n.............\n\nNone.  (In particular, the results of this predicate are independent of\nany special syntax which might have been enabled in the current readtable.)\n\nExceptional Situations::\n........................\n\nShould signal an error of type type-error if character is not a character.\n\nSee Also::\n..........\n\n*Note alphanumericp:: , *Note Documentation of Implementation-Defined\nScripts::\n\n"
}