{
    "name": "integerp",
    "prev": "integer-length",
    "next": "parse-integer",
    "up": "Numbers Dictionary",
    "header": {
        "type": "Function",
        "text": "integerp"
    },
    "sections": [
        {
            "type": "Syntax",
            "defs": [
                {
                    "name": "integerp",
                    "text": " object =>  generalized-boolean\n"
                }
            ],
            "text": ""
        },
        {
            "type": "Arguments and Values",
            "text": "",
            "values": [
                {
                    "name": "object",
                    "desc": "an object."
                },
                {
                    "name": "generalized-boolean",
                    "desc": "a generalized boolean."
                }
            ]
        },
        {
            "type": "Description",
            "text": "Returns true if object is of type integer; otherwise, returns false.\n"
        },
        {
            "type": "Examples",
            "text": "      (integerp 1) =>  true\n      (integerp (expt 2 130)) =>  true\n      (integerp 6/5) =>  false\n      (integerp nil) =>  false\n"
        },
        {
            "type": "Notes",
            "text": "      (integerp object) == (typep object 'integer)\n"
        }
    ],
    "_otext": "File: gcl.info,  Node: integerp,  Next: parse-integer,  Prev: integer-length,  Up: Numbers Dictionary\n\nintegerp                                                         [Function]\n---------------------------------------------------------------------------\n\n`integerp'  object =>  generalized-boolean\n\nArguments and Values::\n......................\n\nobject--an object.\n\ngeneralized-boolean--a generalized boolean.\n\nDescription::\n.............\n\nReturns true if object is of type integer; otherwise, returns false.\n\nExamples::\n..........\n\n      (integerp 1) =>  true\n      (integerp (expt 2 130)) =>  true\n      (integerp 6/5) =>  false\n      (integerp nil) =>  false\n\nNotes::\n.......\n\n      (integerp object) == (typep object 'integer)\n\n"
}