{
    "name": "find-all-symbols",
    "prev": "find-package",
    "next": "import",
    "up": "Packages Dictionary",
    "header": {
        "type": "Function",
        "text": "find-all-symbols"
    },
    "sections": [
        {
            "type": "Syntax",
            "defs": [
                {
                    "name": "find-all-symbols",
                    "text": " string =>  symbols\n"
                }
            ],
            "text": ""
        },
        {
            "type": "Arguments and Values",
            "text": "",
            "values": [
                {
                    "name": "string",
                    "desc": "a string designator."
                },
                {
                    "name": "symbols",
                    "desc": "a list of symbols."
                }
            ]
        },
        {
            "type": "Description",
            "text": "find-all-symbols searches every registered package for symbols that have a\nname that is the same (under string=) as string.  A list of all such\nsymbols is returned.  Whether or how the list is ordered is\nimplementation-dependent.\n"
        },
        {
            "type": "Examples",
            "text": "      (find-all-symbols 'car)\n     =>  (CAR)\n     OR=> (CAR VEHICLES:CAR)\n     OR=> (VEHICLES:CAR CAR)\n      (intern \"CAR\" (make-package 'temp :use nil)) =>  TEMP::CAR, NIL\n      (find-all-symbols 'car)\n     =>  (TEMP::CAR CAR)\n     OR=> (CAR TEMP::CAR)\n     OR=> (TEMP::CAR CAR VEHICLES:CAR)\n     OR=> (CAR TEMP::CAR VEHICLES:CAR)\n"
        },
        {
            "type": "See Also",
            "text": "*Note find-symbol::\n"
        }
    ],
    "_otext": "File: gcl.info,  Node: find-all-symbols,  Next: import,  Prev: find-package,  Up: Packages Dictionary\n\nfind-all-symbols                                                 [Function]\n---------------------------------------------------------------------------\n\n`find-all-symbols'  string =>  symbols\n\nArguments and Values::\n......................\n\nstring--a string designator.\n\nsymbols--a list of symbols.\n\nDescription::\n.............\n\nfind-all-symbols searches every registered package for symbols that have a\nname that is the same (under string=) as string.  A list of all such\nsymbols is returned.  Whether or how the list is ordered is\nimplementation-dependent.\n\nExamples::\n..........\n\n      (find-all-symbols 'car)\n     =>  (CAR)\n     OR=> (CAR VEHICLES:CAR)\n     OR=> (VEHICLES:CAR CAR)\n      (intern \"CAR\" (make-package 'temp :use nil)) =>  TEMP::CAR, NIL\n      (find-all-symbols 'car)\n     =>  (TEMP::CAR CAR)\n     OR=> (CAR TEMP::CAR)\n     OR=> (TEMP::CAR CAR VEHICLES:CAR)\n     OR=> (CAR TEMP::CAR VEHICLES:CAR)\n\nSee Also::\n..........\n\n*Note find-symbol::\n\n"
}