{
    "name": "realpart",
    "prev": "phase",
    "next": "upgraded-complex-part-type",
    "up": "Numbers Dictionary",
    "header": {
        "type": "Function",
        "text": "realpart, imagpart"
    },
    "sections": [
        {
            "type": "Syntax",
            "defs": [
                {
                    "name": "realpart",
                    "text": " number =>  real\n"
                },
                {
                    "name": "imagpart",
                    "text": " number =>  real\n\n"
                }
            ],
            "text": ""
        },
        {
            "type": "Arguments and Values",
            "text": "",
            "values": [
                {
                    "name": "number",
                    "desc": "a number."
                },
                {
                    "name": "real",
                    "desc": "a real."
                }
            ]
        },
        {
            "type": "Description",
            "text": "realpart and imagpart return the real and imaginary parts of number\nrespectively.  If number is\nreal,\nthen realpart returns number and imagpart returns (* 0 number), which has\nthe effect that the imaginary part of a rational is 0 and that of a float\nis a floating-point zero of the same format.\n"
        },
        {
            "type": "Examples",
            "text": "      (realpart #c(23 41)) =>  23\n      (imagpart #c(23 41.0)) =>  41.0\n      (realpart #c(23 41.0)) =>  23.0\n      (imagpart 23.0) =>  0.0\n"
        },
        {
            "type": "Exceptional Situations",
            "text": "Should signal an error of type type-error if number is not a number.\n"
        },
        {
            "type": "See Also",
            "text": "*Note complex::\n"
        }
    ],
    "_otext": "File: gcl.info,  Node: realpart,  Next: upgraded-complex-part-type,  Prev: phase,  Up: Numbers Dictionary\n\nrealpart, imagpart                                               [Function]\n---------------------------------------------------------------------------\n\n`realpart'  number =>  real\n\n`imagpart'  number =>  real\n\nArguments and Values::\n......................\n\nnumber--a number.\n\nreal--a real.\n\nDescription::\n.............\n\nrealpart and imagpart return the real and imaginary parts of number\nrespectively.  If number is\n\nreal,\n\nthen realpart returns number and imagpart returns (* 0 number), which has\nthe effect that the imaginary part of a rational is 0 and that of a float\nis a floating-point zero of the same format.\n\nExamples::\n..........\n\n      (realpart #c(23 41)) =>  23\n      (imagpart #c(23 41.0)) =>  41.0\n      (realpart #c(23 41.0)) =>  23.0\n      (imagpart 23.0) =>  0.0\n\nExceptional Situations::\n........................\n\nShould signal an error of type type-error if number is not a number.\n\nSee Also::\n..........\n\n*Note complex::\n\n"
}