{
    "name": "characterp",
    "prev": "character",
    "next": "alpha-char-p",
    "up": "Characters Dictionary",
    "header": {
        "type": "Function",
        "text": "characterp"
    },
    "sections": [
        {
            "type": "Syntax",
            "defs": [
                {
                    "name": "characterp",
                    "text": " object =>  generalized-boolean\n"
                }
            ],
            "text": ""
        },
        {
            "type": "Arguments and Values",
            "text": "",
            "values": [
                {
                    "name": "object",
                    "desc": "an object."
                },
                {
                    "name": "generalized-boolean",
                    "desc": "a generalized boolean."
                }
            ]
        },
        {
            "type": "Description",
            "text": "Returns true if object is of type character; otherwise, returns false.\n"
        },
        {
            "type": "Examples",
            "text": "      (characterp #\\a) =>  true\n      (characterp 'a) =>  false\n      (characterp \"a\") =>  false\n      (characterp 65.) =>  false\n      (characterp #\\Newline) =>  true\n      ;; This next example presupposes an implementation\n      ;; in which #\\Rubout is an implementation-defined character.\n      (characterp #\\Rubout) =>  true\n"
        },
        {
            "type": "See Also",
            "text": "*Note character:: (type and function), *Note typep::\n"
        },
        {
            "type": "Notes",
            "text": "      (characterp object) == (typep object 'character)\n"
        }
    ],
    "_otext": "File: gcl.info,  Node: characterp,  Next: alpha-char-p,  Prev: character,  Up: Characters Dictionary\n\ncharacterp                                                       [Function]\n---------------------------------------------------------------------------\n\n`characterp'  object =>  generalized-boolean\n\nArguments and Values::\n......................\n\nobject--an object.\n\ngeneralized-boolean--a generalized boolean.\n\nDescription::\n.............\n\nReturns true if object is of type character; otherwise, returns false.\n\nExamples::\n..........\n\n      (characterp #\\a) =>  true\n      (characterp 'a) =>  false\n      (characterp \"a\") =>  false\n      (characterp 65.) =>  false\n      (characterp #\\Newline) =>  true\n      ;; This next example presupposes an implementation\n      ;; in which #\\Rubout is an implementation-defined character.\n      (characterp #\\Rubout) =>  true\n\nSee Also::\n..........\n\n*Note character:: (type and function), *Note typep::\n\nNotes::\n.......\n\n      (characterp object) == (typep object 'character)\n\n"
}