{
    "name": "encode-universal-time",
    "prev": "decode-universal-time",
    "next": "get-universal-time",
    "up": "Environment Dictionary",
    "header": {
        "type": "function",
        "text": "encode-universal-time"
    },
    "sections": [
        {
            "type": "",
            "text": ""
        },
        {
            "type": "Syntax",
            "defs": [
                {
                    "name": "encode-universal-time",
                    "text": " second minute hour date month year &optionaltime-zone\n=>  universal-time\n\n"
                }
            ],
            "text": ""
        },
        {
            "type": "Arguments and Values",
            "text": "",
            "values": [
                {
                    "name": "second, minute, hour, date, month, year, time-zone",
                    "desc": "the correspondingparts of a decoded time.  (Note that some of the nine values in a full\ndecoded time are redundant, and so are not used as inputs to this\nfunction.)\n"
                },
                {
                    "name": "universal-time",
                    "desc": "a universal time."
                }
            ]
        },
        {
            "type": "Description",
            "text": "encode-universal-time converts a time from Decoded Time format to a\nuniversal time.\nIf time-zone is supplied, no adjustment for daylight savings time is\nperformed.\n"
        },
        {
            "type": "Examples",
            "text": "      (encode-universal-time 0 0 0 1 1 1900 0) =>  0\n      (encode-universal-time 0 0 1 4 7 1976 5) =>  2414296800\n     ;; The next example assumes Eastern Daylight Time.\n      (encode-universal-time 0 0 1 4 7 1976) =>  2414293200\n"
        },
        {
            "type": "See Also",
            "text": "*Note decode-universal-time:: , get-decoded-time\n"
        }
    ],
    "_otext": "File: gcl.info,  Node: encode-universal-time,  Next: get-universal-time,  Prev: decode-universal-time,  Up: Environment Dictionary\n\nencode-universal-time                                            [function]\n---------------------------------------------------------------------------\n\nSyntax::\n........\n\n`encode-universal-time'  second minute hour date month year &optional\ntime-zone\n=>  universal-time\n\nArguments and Values::\n......................\n\nsecond, minute, hour, date, month, year, time-zone--the corresponding\nparts of a decoded time.  (Note that some of the nine values in a full\ndecoded time are redundant, and so are not used as inputs to this\nfunction.)\n\nuniversal-time--a universal time.\n\nDescription::\n.............\n\nencode-universal-time converts a time from Decoded Time format to a\nuniversal time.\n\nIf time-zone is supplied, no adjustment for daylight savings time is\nperformed.\n\nExamples::\n..........\n\n      (encode-universal-time 0 0 0 1 1 1900 0) =>  0\n      (encode-universal-time 0 0 1 4 7 1976 5) =>  2414296800\n     ;; The next example assumes Eastern Daylight Time.\n      (encode-universal-time 0 0 1 4 7 1976) =>  2414293200\n\nSee Also::\n..........\n\n*Note decode-universal-time:: , get-decoded-time\n\n"
}