{
    "name": "file-write-date",
    "prev": "file-author",
    "next": "rename-file",
    "up": "Files Dictionary",
    "header": {
        "type": "Function",
        "text": "file-write-date"
    },
    "sections": [
        {
            "type": "Syntax",
            "defs": [
                {
                    "name": "file-write-date",
                    "text": " pathspec =>  date\n"
                }
            ],
            "text": ""
        },
        {
            "type": "Arguments and Values",
            "text": "",
            "values": [
                {
                    "name": "pathspec",
                    "desc": "a pathname designator."
                },
                {
                    "name": "date",
                    "desc": "a universal time or nil."
                }
            ]
        },
        {
            "type": "Description",
            "text": "Returns a universal time representing the time at which the file specified\nby pathspec was last written (or created), or returns nil if such a time\ncannot be determined.\n"
        },
        {
            "type": "Examples",
            "text": "      (with-open-file (s \"noel.text\"\n                         :direction :output :if-exists :error)\n        (format s \"~&Dear Santa,~2\n                     Please leave lots of toys.~2\n                  ~2\n        (truename s))\n     =>  #P\"CUPID:/susan/noel.text\"\n      (with-open-file (s \"noel.text\")\n        (file-write-date s))\n     =>  2902600800\n"
        },
        {
            "type": "Affected By",
            "text": "The host computer's file system.\n"
        },
        {
            "type": "Exceptional Situations",
            "text": "An error of type file-error is signaled if pathspec is wild.\nAn error of type file-error is signaled if the file system cannot perform\nthe requested operation.\n"
        },
        {
            "type": "See Also",
            "text": "*Note Universal Time::,\n*Note Pathnames as Filenames::\n"
        }
    ],
    "_otext": "File: gcl.info,  Node: file-write-date,  Next: rename-file,  Prev: file-author,  Up: Files Dictionary\n\nfile-write-date                                                  [Function]\n---------------------------------------------------------------------------\n\n`file-write-date'  pathspec =>  date\n\nArguments and Values::\n......................\n\npathspec--a pathname designator.\n\ndate--a universal time or nil.\n\nDescription::\n.............\n\nReturns a universal time representing the time at which the file specified\nby pathspec was last written (or created), or returns nil if such a time\ncannot be determined.\n\nExamples::\n..........\n\n      (with-open-file (s \"noel.text\"\n                         :direction :output :if-exists :error)\n        (format s \"~&Dear Santa,~2\n                     Please leave lots of toys.~2\n                  ~2\n        (truename s))\n     =>  #P\"CUPID:/susan/noel.text\"\n      (with-open-file (s \"noel.text\")\n        (file-write-date s))\n     =>  2902600800\n\nAffected By::\n.............\n\nThe host computer's file system.\n\nExceptional Situations::\n........................\n\nAn error of type file-error is signaled if pathspec is wild.\n\nAn error of type file-error is signaled if the file system cannot perform\nthe requested operation.\n\nSee Also::\n..........\n\n*Note Universal Time::,\n\n*Note Pathnames as Filenames::\n\n"
}