{
    "name": "method-qualifiers",
    "prev": "slot-value",
    "next": "no-applicable-method",
    "up": "Objects Dictionary",
    "header": {
        "type": "Standard Generic Function",
        "text": "method-qualifiers"
    },
    "sections": [
        {
            "type": "",
            "text": ""
        },
        {
            "type": "Syntax",
            "defs": [
                {
                    "name": "method-qualifiers",
                    "text": " method =>  qualifiers\n"
                }
            ],
            "text": ""
        },
        {
            "type": "Syntax",
            "defs": [
                {
                    "name": "method-qualifiers",
                    "text": " (method standard-method)\n"
                }
            ],
            "text": ""
        },
        {
            "type": "Arguments and Values",
            "text": "",
            "values": [
                {
                    "name": "method",
                    "desc": "a method."
                },
                {
                    "name": "qualifiers",
                    "desc": "a proper list."
                }
            ]
        },
        {
            "type": "Description",
            "text": "Returns a list of the qualifiers of the method.\n"
        },
        {
            "type": "Examples",
            "text": "      (defmethod some-gf :before ((a integer)) a)\n     =>  #<STANDARD-METHOD SOME-GF (:BEFORE) (INTEGER) 42736540>\n      (method-qualifiers *) =>  (:BEFORE)\n"
        },
        {
            "type": "See Also",
            "text": "*Note define-method-combination::\n"
        }
    ],
    "_otext": "File: gcl.info,  Node: method-qualifiers,  Next: no-applicable-method,  Prev: slot-value,  Up: Objects Dictionary\n\nmethod-qualifiers                               [Standard Generic Function]\n---------------------------------------------------------------------------\n\nSyntax::\n........\n\n`method-qualifiers'  method =>  qualifiers\n\nMethod Signatures::\n...................\n\n`method-qualifiers'  (method standard-method)\n\nArguments and Values::\n......................\n\nmethod--a method.\n\nqualifiers--a proper list.\n\nDescription::\n.............\n\nReturns a list of the qualifiers of the method.\n\nExamples::\n..........\n\n      (defmethod some-gf :before ((a integer)) a)\n     =>  #<STANDARD-METHOD SOME-GF (:BEFORE) (INTEGER) 42736540>\n      (method-qualifiers *) =>  (:BEFORE)\n\nSee Also::\n..........\n\n*Note define-method-combination::\n\n"
}