{
    "name": "digit-char",
    "prev": "alphanumericp",
    "next": "digit-char-p",
    "up": "Characters Dictionary",
    "header": {
        "type": "Function",
        "text": "digit-char"
    },
    "sections": [
        {
            "type": "Syntax",
            "defs": [
                {
                    "name": "digit-char",
                    "text": " weight &optional radix =>  char\n"
                }
            ],
            "text": ""
        },
        {
            "type": "Arguments and Values",
            "text": "",
            "values": [
                {
                    "name": "weight",
                    "desc": "a non-negative integer."
                },
                {
                    "name": "radix",
                    "desc": "a radix.  The default is 10."
                },
                {
                    "name": "char",
                    "desc": "a character or false."
                }
            ]
        },
        {
            "type": "Description",
            "text": "If weight is less than radix, digit-char returns a character which has\nthat weight when considered as a digit in the specified radix.  If the\nresulting character is to be an alphabetic_1 character, it will be an\nuppercase character.\nIf weight is greater than or equal to radix, digit-char returns false.\n"
        },
        {
            "type": "Examples",
            "text": "      (digit-char 0) =>  #\\0\n      (digit-char 10 11) =>  #\\A\n      (digit-char 10 10) =>  false\n      (digit-char 7) =>  #\\7\n      (digit-char 12) =>  false\n      (digit-char 12 16) =>  #\\C  ;not #\\c\n      (digit-char 6 2) =>  false\n      (digit-char 1 2) =>  #\\1\n"
        },
        {
            "type": "See Also",
            "text": "*Note digit-char-p:: , *Note graphic-char-p:: , *Note Character Syntax::\n"
        },
        {
            "type": "Notes",
            "text": ""
        }
    ],
    "_otext": "File: gcl.info,  Node: digit-char,  Next: digit-char-p,  Prev: alphanumericp,  Up: Characters Dictionary\n\ndigit-char                                                       [Function]\n---------------------------------------------------------------------------\n\n`digit-char'  weight &optional radix =>  char\n\nArguments and Values::\n......................\n\nweight--a non-negative integer.\n\nradix--a radix.  The default is 10.\n\nchar--a character or false.\n\nDescription::\n.............\n\nIf weight is less than radix, digit-char returns a character which has\nthat weight when considered as a digit in the specified radix.  If the\nresulting character is to be an alphabetic_1 character, it will be an\nuppercase character.\n\nIf weight is greater than or equal to radix, digit-char returns false.\n\nExamples::\n..........\n\n      (digit-char 0) =>  #\\0\n      (digit-char 10 11) =>  #\\A\n      (digit-char 10 10) =>  false\n      (digit-char 7) =>  #\\7\n      (digit-char 12) =>  false\n      (digit-char 12 16) =>  #\\C  ;not #\\c\n      (digit-char 6 2) =>  false\n      (digit-char 1 2) =>  #\\1\n\nSee Also::\n..........\n\n*Note digit-char-p:: , *Note graphic-char-p:: , *Note Character Syntax::\n\nNotes::\n.......\n\n"
}