{
    "name": "logbitp",
    "prev": "logand",
    "next": "logcount",
    "up": "Numbers Dictionary",
    "header": {
        "type": "Function",
        "text": "logbitp"
    },
    "sections": [
        {
            "type": "Syntax",
            "defs": [
                {
                    "name": "logbitp",
                    "text": " index integer =>  generalized-boolean\n"
                }
            ],
            "text": ""
        },
        {
            "type": "Arguments and Values",
            "text": "",
            "values": [
                {
                    "name": "index",
                    "desc": "a non-negative integer."
                },
                {
                    "name": "integer",
                    "desc": "an integer."
                },
                {
                    "name": "generalized-boolean",
                    "desc": "a generalized boolean."
                }
            ]
        },
        {
            "type": "Description",
            "text": "logbitp is used to test the value of a particular bit in integer, that is\ntreated as if it were binary.  The value of logbitp is true if the bit in\ninteger whose index is index (that is, its weight is 2^index) is a\none-bit; otherwise it is false.\nNegative integers are treated as if they were in two's-complement notation.\n"
        },
        {
            "type": "Examples",
            "text": "      (logbitp 1 1) =>  false\n      (logbitp 0 1) =>  true\n      (logbitp 3 10) =>  true\n      (logbitp 1000000 -1) =>  true\n      (logbitp 2 6) =>  true\n      (logbitp 0 6) =>  false\n"
        },
        {
            "type": "Exceptional Situations",
            "text": "Should signal an error of type type-error if index is not a non-negative\ninteger.  Should signal an error of type type-error if integer is not an\ninteger.\n"
        },
        {
            "type": "Notes",
            "text": "      (logbitp k n) == (ldb-test (byte 1 k) n)\n"
        }
    ],
    "_otext": "File: gcl.info,  Node: logbitp,  Next: logcount,  Prev: logand,  Up: Numbers Dictionary\n\nlogbitp                                                          [Function]\n---------------------------------------------------------------------------\n\n`logbitp'  index integer =>  generalized-boolean\n\nArguments and Values::\n......................\n\nindex--a non-negative integer.\n\ninteger--an integer.\n\ngeneralized-boolean--a generalized boolean.\n\nDescription::\n.............\n\nlogbitp is used to test the value of a particular bit in integer, that is\ntreated as if it were binary.  The value of logbitp is true if the bit in\ninteger whose index is index (that is, its weight is 2^index) is a\none-bit; otherwise it is false.\n\nNegative integers are treated as if they were in two's-complement notation.\n\nExamples::\n..........\n\n      (logbitp 1 1) =>  false\n      (logbitp 0 1) =>  true\n      (logbitp 3 10) =>  true\n      (logbitp 1000000 -1) =>  true\n      (logbitp 2 6) =>  true\n      (logbitp 0 6) =>  false\n\nExceptional Situations::\n........................\n\nShould signal an error of type type-error if index is not a non-negative\ninteger.  Should signal an error of type type-error if integer is not an\ninteger.\n\nNotes::\n.......\n\n      (logbitp k n) == (ldb-test (byte 1 k) n)\n\n"
}