{
    "name": "package-use-list",
    "prev": "package-shadowing-symbols",
    "next": "package-used-by-list",
    "up": "Packages Dictionary",
    "header": {
        "type": "Function",
        "text": "package-use-list"
    },
    "sections": [
        {
            "type": "Syntax",
            "defs": [
                {
                    "name": "package-use-list",
                    "text": " package =>  use-list\n"
                }
            ],
            "text": ""
        },
        {
            "type": "Arguments and Values",
            "text": "",
            "values": [
                {
                    "name": "package",
                    "desc": "a package designator."
                },
                {
                    "name": "use-list",
                    "desc": "a list of package objects."
                }
            ]
        },
        {
            "type": "Description",
            "text": "Returns a list of other packages used by package.\n"
        },
        {
            "type": "Examples",
            "text": "      (package-use-list (make-package 'temp)) =>  (#<PACKAGE \"COMMON-LISP\">)\n      (use-package 'common-lisp-user 'temp) =>  T\n      (package-use-list 'temp) =>  (#<PACKAGE \"COMMON-LISP\"> #<PACKAGE \"COMMON-LISP-USER\">)\n"
        },
        {
            "type": "Exceptional Situations",
            "text": "Should signal an error of type type-error if package is not a package\ndesignator.\n"
        },
        {
            "type": "See Also",
            "text": "*Note use-package:: , *Note unuse-package::\n"
        }
    ],
    "_otext": "File: gcl.info,  Node: package-use-list,  Next: package-used-by-list,  Prev: package-shadowing-symbols,  Up: Packages Dictionary\n\npackage-use-list                                                 [Function]\n---------------------------------------------------------------------------\n\n`package-use-list'  package =>  use-list\n\nArguments and Values::\n......................\n\npackage--a package designator.\n\nuse-list--a list of package objects.\n\nDescription::\n.............\n\nReturns a list of other packages used by package.\n\nExamples::\n..........\n\n      (package-use-list (make-package 'temp)) =>  (#<PACKAGE \"COMMON-LISP\">)\n      (use-package 'common-lisp-user 'temp) =>  T\n      (package-use-list 'temp) =>  (#<PACKAGE \"COMMON-LISP\"> #<PACKAGE \"COMMON-LISP-USER\">)\n\nExceptional Situations::\n........................\n\nShould signal an error of type type-error if package is not a package\ndesignator.\n\nSee Also::\n..........\n\n*Note use-package:: , *Note unuse-package::\n\n"
}