{
    "name": "minusp",
    "prev": "max",
    "next": "zerop",
    "up": "Numbers Dictionary",
    "header": {
        "type": "Function",
        "text": "minusp, plusp"
    },
    "sections": [
        {
            "type": "Syntax",
            "defs": [
                {
                    "name": "minusp",
                    "text": " real =>  generalized-boolean\n"
                },
                {
                    "name": "plusp",
                    "text": " real =>  generalized-boolean\n\n"
                }
            ],
            "text": ""
        },
        {
            "type": "Arguments and Values",
            "text": "",
            "values": [
                {
                    "name": "real",
                    "desc": "a real."
                },
                {
                    "name": "generalized-boolean",
                    "desc": "a generalized boolean."
                }
            ]
        },
        {
            "type": "Description",
            "text": "minusp returns true if real is less than zero; otherwise, returns false.\nplusp returns true if real is greater than zero; otherwise, returns false.\nRegardless of whether an implementation provides distinct representations\nfor positive and negative float zeros, (minusp -0.0) always returns false.\n"
        },
        {
            "type": "Examples",
            "text": "      (minusp -1) =>  true\n      (plusp 0) =>  false\n      (plusp least-positive-single-float) =>  true\n"
        },
        {
            "type": "Exceptional Situations",
            "text": "Should signal an error of type type-error if real is not a real.\n"
        }
    ],
    "_otext": "File: gcl.info,  Node: minusp,  Next: zerop,  Prev: max,  Up: Numbers Dictionary\n\nminusp, plusp                                                    [Function]\n---------------------------------------------------------------------------\n\n`minusp'  real =>  generalized-boolean\n\n`plusp'  real =>  generalized-boolean\n\nArguments and Values::\n......................\n\nreal--a real.\n\ngeneralized-boolean--a generalized boolean.\n\nDescription::\n.............\n\nminusp returns true if real is less than zero; otherwise, returns false.\n\nplusp returns true if real is greater than zero; otherwise, returns false.\n\nRegardless of whether an implementation provides distinct representations\nfor positive and negative float zeros, (minusp -0.0) always returns false.\n\nExamples::\n..........\n\n      (minusp -1) =>  true\n      (plusp 0) =>  false\n      (plusp least-positive-single-float) =>  true\n\nExceptional Situations::\n........................\n\nShould signal an error of type type-error if real is not a real.\n\n"
}