{
    "name": "array-dimension",
    "prev": "aref",
    "next": "array-dimensions",
    "up": "Arrays Dictionary",
    "header": {
        "type": "Function",
        "text": "array-dimension"
    },
    "sections": [
        {
            "type": "Syntax",
            "defs": [
                {
                    "name": "array-dimension",
                    "text": " array axis-number =>  dimension\n"
                }
            ],
            "text": ""
        },
        {
            "type": "Arguments and Values",
            "text": "",
            "values": [
                {
                    "name": "array",
                    "desc": "an array."
                },
                {
                    "name": "axis-number",
                    "desc": "an integer greater than or equal to zero and less than the"
                },
                {
                    "name": "axis-number",
                    "desc": "an integer greater than or equal to zero and less than therank of the array.\n"
                },
                {
                    "name": "dimension",
                    "desc": "a non-negative integer."
                }
            ]
        },
        {
            "type": "Description",
            "text": "array-dimension returns the axis-number dimension_1 of array.  (Any fill\npointer is ignored.)\n"
        },
        {
            "type": "Examples",
            "text": "      (array-dimension (make-array 4) 0) =>  4\n      (array-dimension (make-array '(2 3)) 1) =>  3\n"
        },
        {
            "type": "Affected By",
            "text": "None.\n"
        },
        {
            "type": "See Also",
            "text": "*Note array-dimensions:: , *Note length::\n"
        },
        {
            "type": "Notes",
            "text": "      (array-dimension array n) == (nth n (array-dimensions array))\n"
        }
    ],
    "_otext": "File: gcl.info,  Node: array-dimension,  Next: array-dimensions,  Prev: aref,  Up: Arrays Dictionary\n\narray-dimension                                                  [Function]\n---------------------------------------------------------------------------\n\n`array-dimension'  array axis-number =>  dimension\n\nArguments and Values::\n......................\n\narray--an array.\n\naxis-number--an integer greater than or equal to zero and less than the\nrank of the array.\n\ndimension--a non-negative integer.\n\nDescription::\n.............\n\narray-dimension returns the axis-number dimension_1 of array.  (Any fill\npointer is ignored.)\n\nExamples::\n..........\n\n      (array-dimension (make-array 4) 0) =>  4\n      (array-dimension (make-array '(2 3)) 1) =>  3\n\nAffected By::\n.............\n\nNone.\n\nSee Also::\n..........\n\n*Note array-dimensions:: , *Note length::\n\nNotes::\n.......\n\n      (array-dimension array n) == (nth n (array-dimensions array))\n\n"
}