{
    "name": "adjustable-array-p",
    "prev": "adjust-array",
    "next": "aref",
    "up": "Arrays Dictionary",
    "header": {
        "type": "Function",
        "text": "adjustable-array-p"
    },
    "sections": [
        {
            "type": "Syntax",
            "defs": [
                {
                    "name": "adjustable-array-p",
                    "text": " array =>  generalized-boolean\n"
                }
            ],
            "text": ""
        },
        {
            "type": "Arguments and Values",
            "text": "",
            "values": [
                {
                    "name": "array",
                    "desc": "an array."
                },
                {
                    "name": "generalized-boolean",
                    "desc": "a generalized boolean."
                }
            ]
        },
        {
            "type": "Description",
            "text": "Returns true if and only if adjust-array could return a value which is\nidentical to array when given that array as its first argument.\n"
        },
        {
            "type": "Examples",
            "text": "      (adjustable-array-p\n        (make-array 5\n                    :element-type 'character\n                    :adjustable t\n                    :fill-pointer 3)) =>  true\n      (adjustable-array-p (make-array 4)) =>  implementation-dependent\n"
        },
        {
            "type": "Exceptional Situations",
            "text": "Should signal an error of type type-error if its argument is not an array.\n"
        },
        {
            "type": "See Also",
            "text": "*Note adjust-array:: , *Note make-array::\n"
        }
    ],
    "_otext": "File: gcl.info,  Node: adjustable-array-p,  Next: aref,  Prev: adjust-array,  Up: Arrays Dictionary\n\nadjustable-array-p                                               [Function]\n---------------------------------------------------------------------------\n\n`adjustable-array-p'  array =>  generalized-boolean\n\nArguments and Values::\n......................\n\narray--an array.\n\ngeneralized-boolean--a generalized boolean.\n\nDescription::\n.............\n\nReturns true if and only if adjust-array could return a value which is\nidentical to array when given that array as its first argument.\n\nExamples::\n..........\n\n      (adjustable-array-p\n        (make-array 5\n                    :element-type 'character\n                    :adjustable t\n                    :fill-pointer 3)) =>  true\n      (adjustable-array-p (make-array 4)) =>  implementation-dependent\n\nExceptional Situations::\n........................\n\nShould signal an error of type type-error if its argument is not an array.\n\nSee Also::\n..........\n\n*Note adjust-array:: , *Note make-array::\n\n"
}