{
    "name": "alphanumericp",
    "prev": "alpha-char-p",
    "next": "digit-char",
    "up": "Characters Dictionary",
    "header": {
        "type": "Function",
        "text": "alphanumericp"
    },
    "sections": [
        {
            "type": "Syntax",
            "defs": [
                {
                    "name": "alphanumericp",
                    "text": " character =>  generalized-boolean\n"
                }
            ],
            "text": ""
        },
        {
            "type": "Arguments and Values",
            "text": "",
            "values": [
                {
                    "name": "character",
                    "desc": "a character."
                },
                {
                    "name": "generalized-boolean",
                    "desc": "a generalized boolean."
                }
            ]
        },
        {
            "type": "Description",
            "text": "Returns true if character is an alphabetic_1 character or a  numeric\ncharacter; otherwise, returns false.\n"
        },
        {
            "type": "Examples",
            "text": "      (alphanumericp #\\Z) =>  true\n      (alphanumericp #\\9) =>  true\n      (alphanumericp #\\Newline) =>  false\n      (alphanumericp #\\#) =>  false\n"
        },
        {
            "type": "Affected By",
            "text": "None.  (In particular, the results of this predicate are independent of\nany special syntax which might have been enabled in the current readtable.)\n"
        },
        {
            "type": "Exceptional Situations",
            "text": "Should signal an error of type type-error if character is not a character.\n"
        },
        {
            "type": "See Also",
            "text": "*Note alpha-char-p:: , *Note graphic-char-p:: , *Note digit-char-p::\n"
        },
        {
            "type": "Notes",
            "text": "Alphanumeric characters are graphic as defined by graphic-char-p.  The\nalphanumeric characters are a subset of the graphic characters.  The\nstandard characters A through Z, a through z, and 0 through 9 are\nalphanumeric characters.\n      (alphanumericp x)\n        == (or (alpha-char-p x) (not (null (digit-char-p x))))\n"
        }
    ],
    "_otext": "File: gcl.info,  Node: alphanumericp,  Next: digit-char,  Prev: alpha-char-p,  Up: Characters Dictionary\n\nalphanumericp                                                    [Function]\n---------------------------------------------------------------------------\n\n`alphanumericp'  character =>  generalized-boolean\n\nArguments and Values::\n......................\n\ncharacter--a character.\n\ngeneralized-boolean--a generalized boolean.\n\nDescription::\n.............\n\nReturns true if character is an alphabetic_1 character or a  numeric\ncharacter; otherwise, returns false.\n\nExamples::\n..........\n\n      (alphanumericp #\\Z) =>  true\n      (alphanumericp #\\9) =>  true\n      (alphanumericp #\\Newline) =>  false\n      (alphanumericp #\\#) =>  false\n\nAffected By::\n.............\n\nNone.  (In particular, the results of this predicate are independent of\nany special syntax which might have been enabled in the current readtable.)\n\nExceptional Situations::\n........................\n\nShould signal an error of type type-error if character is not a character.\n\nSee Also::\n..........\n\n*Note alpha-char-p:: , *Note graphic-char-p:: , *Note digit-char-p::\n\nNotes::\n.......\n\nAlphanumeric characters are graphic as defined by graphic-char-p.  The\nalphanumeric characters are a subset of the graphic characters.  The\nstandard characters A through Z, a through z, and 0 through 9 are\nalphanumeric characters.\n\n      (alphanumericp x)\n        == (or (alpha-char-p x) (not (null (digit-char-p x))))\n\n"
}