{
    "name": "arithmetic-error",
    "prev": "short-float-epsilon",
    "next": "arithmetic-error-operands",
    "up": "Numbers Dictionary",
    "header": {
        "type": "Condition Type",
        "text": "arithmetic-error"
    },
    "sections": [
        {
            "type": "",
            "text": ""
        },
        {
            "type": "Class Precedence List",
            "text": "",
            "items": [
                {
                    "name": "arithmetic-error",
                    "link": "arithmetic-error"
                },
                {
                    "name": " error",
                    "link": null
                },
                {
                    "name": " serious-condition",
                    "link": null
                },
                {
                    "name": " condition",
                    "link": null
                },
                {
                    "name": " t",
                    "link": null
                }
            ]
        },
        {
            "type": "Description",
            "text": "The type arithmetic-error consists of error conditions that occur during\narithmetic operations.  The operation and operands are initialized with\nthe initialization arguments named :operation and :operands to\nmake-condition, and are accessed by the functions\narithmetic-error-operation and arithmetic-error-operands.\n"
        },
        {
            "type": "See Also",
            "text": "arithmetic-error-operation, *Note arithmetic-error-operands;\narithmetic-error-operation::\n"
        }
    ],
    "_otext": "File: gcl.info,  Node: arithmetic-error,  Next: arithmetic-error-operands,  Prev: short-float-epsilon,  Up: Numbers Dictionary\n\narithmetic-error                                           [Condition Type]\n---------------------------------------------------------------------------\n\nClass Precedence List::\n.......................\n\narithmetic-error, error, serious-condition, condition, t\n\nDescription::\n.............\n\nThe type arithmetic-error consists of error conditions that occur during\narithmetic operations.  The operation and operands are initialized with\nthe initialization arguments named :operation and :operands to\nmake-condition, and are accessed by the functions\narithmetic-error-operation and arithmetic-error-operands.\n\nSee Also::\n..........\n\narithmetic-error-operation, *Note arithmetic-error-operands;\narithmetic-error-operation::\n\n"
}