{
    "name": "array-has-fill-pointer-p",
    "prev": "array-element-type",
    "next": "array-displacement",
    "up": "Arrays Dictionary",
    "header": {
        "type": "Function",
        "text": "array-has-fill-pointer-p"
    },
    "sections": [
        {
            "type": "Syntax",
            "defs": [
                {
                    "name": "array-has-fill-pointer-p",
                    "text": " array =>  generalized-boolean\n"
                }
            ],
            "text": ""
        },
        {
            "type": "Arguments and Values",
            "text": "",
            "values": [
                {
                    "name": "array",
                    "desc": "an array."
                },
                {
                    "name": "generalized-boolean",
                    "desc": "a generalized boolean."
                }
            ]
        },
        {
            "type": "Description",
            "text": "Returns true if array has a fill pointer; otherwise returns false.\n"
        },
        {
            "type": "Examples",
            "text": "      (array-has-fill-pointer-p (make-array 4)) =>  implementation-dependent\n      (array-has-fill-pointer-p (make-array '(2 3))) =>  false\n      (array-has-fill-pointer-p\n        (make-array 8\n                    :fill-pointer 2\n                    :initial-element 'filler)) =>  true\n"
        },
        {
            "type": "Exceptional Situations",
            "text": "Should signal an error of type type-error if its argument is not an array.\n"
        },
        {
            "type": "See Also",
            "text": "*Note make-array:: , *Note fill-pointer::\n"
        },
        {
            "type": "Notes",
            "text": "Since arrays of rank other than one cannot have a fill pointer,\narray-has-fill-pointer-p always returns nil when its argument is such an\narray.\n"
        }
    ],
    "_otext": "File: gcl.info,  Node: array-has-fill-pointer-p,  Next: array-displacement,  Prev: array-element-type,  Up: Arrays Dictionary\n\narray-has-fill-pointer-p                                         [Function]\n---------------------------------------------------------------------------\n\n`array-has-fill-pointer-p'  array =>  generalized-boolean\n\nArguments and Values::\n......................\n\narray--an array.\n\ngeneralized-boolean--a generalized boolean.\n\nDescription::\n.............\n\nReturns true if array has a fill pointer; otherwise returns false.\n\nExamples::\n..........\n\n      (array-has-fill-pointer-p (make-array 4)) =>  implementation-dependent\n      (array-has-fill-pointer-p (make-array '(2 3))) =>  false\n      (array-has-fill-pointer-p\n        (make-array 8\n                    :fill-pointer 2\n                    :initial-element 'filler)) =>  true\n\nExceptional Situations::\n........................\n\nShould signal an error of type type-error if its argument is not an array.\n\nSee Also::\n..........\n\n*Note make-array:: , *Note fill-pointer::\n\nNotes::\n.......\n\nSince arrays of rank other than one cannot have a fill pointer,\narray-has-fill-pointer-p always returns nil when its argument is such an\narray.\n\n"
}