{
    "name": "bit-vector",
    "prev": "simple-vector",
    "next": "simple-bit-vector",
    "up": "Arrays Dictionary",
    "header": {
        "type": "System Class",
        "text": "bit-vector"
    },
    "sections": [
        {
            "type": "",
            "text": ""
        },
        {
            "type": "Class Precedence List",
            "text": "",
            "items": [
                {
                    "name": "bit-vector",
                    "link": "bit-vector"
                },
                {
                    "name": " vector",
                    "link": null
                },
                {
                    "name": " array",
                    "link": null
                },
                {
                    "name": " sequence",
                    "link": null
                },
                {
                    "name": " t",
                    "link": null
                }
            ]
        },
        {
            "type": "Description",
            "text": "A bit vector is a vector the element type of which is bit.\nThe type bit-vector is a subtype of type vector, for bit-vector means\n(vector bit).\n"
        },
        {
            "type": "Compound Type Specifier Kind",
            "text": "Abbreviating.\n"
        },
        {
            "type": "Compound Type Specifier Syntax",
            "text": "(`bit-vector'{[size]})\n"
        },
        {
            "type": "Compound Type Specifier Arguments",
            "text": "size--a non-negative fixnum, or the symbol *.\n"
        },
        {
            "type": "Compound Type Specifier Description",
            "text": "This denotes the same type as the type (array bit (size)); that is, the\nset of bit vectors of size size.\n"
        },
        {
            "type": "See Also",
            "text": "*Note Sharpsign Asterisk::, *Note Printing Bit Vectors::, *Note Required\nKinds of Specialized Arrays::\n"
        }
    ],
    "_otext": "File: gcl.info,  Node: bit-vector,  Next: simple-bit-vector,  Prev: simple-vector,  Up: Arrays Dictionary\n\nbit-vector                                                   [System Class]\n---------------------------------------------------------------------------\n\nClass Precedence List::\n.......................\n\nbit-vector, vector, array, sequence, t\n\nDescription::\n.............\n\nA bit vector is a vector the element type of which is bit.\n\nThe type bit-vector is a subtype of type vector, for bit-vector means\n(vector bit).\n\nCompound Type Specifier Kind::\n..............................\n\nAbbreviating.\n\nCompound Type Specifier Syntax::\n................................\n\n(`bit-vector'{[size]})\n\nCompound Type Specifier Arguments::\n...................................\n\nsize--a non-negative fixnum, or the symbol *.\n\nCompound Type Specifier Description::\n.....................................\n\nThis denotes the same type as the type (array bit (size)); that is, the\nset of bit vectors of size size.\n\nSee Also::\n..........\n\n*Note Sharpsign Asterisk::, *Note Printing Bit Vectors::, *Note Required\nKinds of Specialized Arrays::\n\n"
}