{
    "name": "bit-vector-p",
    "prev": "bit-and",
    "next": "simple-bit-vector-p",
    "up": "Arrays Dictionary",
    "header": {
        "type": "Function",
        "text": "bit-vector-p"
    },
    "sections": [
        {
            "type": "Syntax",
            "defs": [
                {
                    "name": "bit-vector-p",
                    "text": " object =>  generalized-boolean\n"
                }
            ],
            "text": ""
        },
        {
            "type": "Arguments and Values",
            "text": "",
            "values": [
                {
                    "name": "object",
                    "desc": "an object."
                },
                {
                    "name": "generalized-boolean",
                    "desc": "a generalized boolean."
                }
            ]
        },
        {
            "type": "Description",
            "text": "Returns true if object is of type bit-vector; otherwise, returns false.\n"
        },
        {
            "type": "Examples",
            "text": "      (bit-vector-p (make-array 6\n                                :element-type 'bit\n                                :fill-pointer t)) =>  true\n      (bit-vector-p #*) =>  true\n      (bit-vector-p (make-array 6)) =>  false\n"
        },
        {
            "type": "See Also",
            "text": "*Note typep::\n"
        },
        {
            "type": "Notes",
            "text": "      (bit-vector-p object) == (typep object 'bit-vector)\n"
        }
    ],
    "_otext": "File: gcl.info,  Node: bit-vector-p,  Next: simple-bit-vector-p,  Prev: bit-and,  Up: Arrays Dictionary\n\nbit-vector-p                                                     [Function]\n---------------------------------------------------------------------------\n\n`bit-vector-p'  object =>  generalized-boolean\n\nArguments and Values::\n......................\n\nobject--an object.\n\ngeneralized-boolean--a generalized boolean.\n\nDescription::\n.............\n\nReturns true if object is of type bit-vector; otherwise, returns false.\n\nExamples::\n..........\n\n      (bit-vector-p (make-array 6\n                                :element-type 'bit\n                                :fill-pointer t)) =>  true\n      (bit-vector-p #*) =>  true\n      (bit-vector-p (make-array 6)) =>  false\n\nSee Also::\n..........\n\n*Note typep::\n\nNotes::\n.......\n\n      (bit-vector-p object) == (typep object 'bit-vector)\n\n"
}