{
    "name": "cell-error",
    "prev": "error (Condition Type)",
    "next": "cell-error-name",
    "up": "Conditions Dictionary",
    "header": {
        "type": "Condition Type",
        "text": "cell-error"
    },
    "sections": [
        {
            "type": "",
            "text": ""
        },
        {
            "type": "Class Precedence List",
            "text": "",
            "items": [
                {
                    "name": "cell-error",
                    "link": "cell-error"
                },
                {
                    "name": " error",
                    "link": null
                },
                {
                    "name": " serious-condition",
                    "link": null
                },
                {
                    "name": " condition",
                    "link": null
                },
                {
                    "name": " t",
                    "link": null
                }
            ]
        },
        {
            "type": "Description",
            "text": "The type cell-error consists of error conditions that occur during a\nlocation access.   The name of the offending cell is initialized by the\n:name initialization argument to make-condition, and is accessed by the\nfunction cell-error-name.\n"
        },
        {
            "type": "See Also",
            "text": "*Note cell-error-name::\n"
        }
    ],
    "_otext": "File: gcl.info,  Node: cell-error,  Next: cell-error-name,  Prev: error (Condition Type),  Up: Conditions Dictionary\n\ncell-error                                                 [Condition Type]\n---------------------------------------------------------------------------\n\nClass Precedence List::\n.......................\n\ncell-error, error, serious-condition, condition, t\n\nDescription::\n.............\n\nThe type cell-error consists of error conditions that occur during a\nlocation access.   The name of the offending cell is initialized by the\n:name initialization argument to make-condition, and is accessed by the\nfunction cell-error-name.\n\nSee Also::\n..........\n\n*Note cell-error-name::\n\n"
}