{
    "name": "character (System Class)",
    "prev": "Characters Dictionary",
    "next": "base-char",
    "up": "Characters Dictionary",
    "header": {
        "type": "System Class",
        "text": "character"
    },
    "sections": [
        {
            "type": "",
            "text": ""
        },
        {
            "type": "Class Precedence List",
            "text": "",
            "items": [
                {
                    "name": "character",
                    "link": "character"
                },
                {
                    "name": " t",
                    "link": null
                }
            ]
        },
        {
            "type": "Description",
            "text": "A character is an object that represents a unitary token in an aggregate\nquantity of text; see *Note Character Concepts::.\nThe types base-char and extended-char form an exhaustive partition of the\ntype character.\n"
        },
        {
            "type": "See Also",
            "text": "*Note Character Concepts::, *Note Sharpsign Backslash::, *Note Printing\nCharacters::\n"
        }
    ],
    "_otext": "File: gcl.info,  Node: character (System Class),  Next: base-char,  Prev: Characters Dictionary,  Up: Characters Dictionary\n\ncharacter                                                    [System Class]\n---------------------------------------------------------------------------\n\nClass Precedence List::\n.......................\n\ncharacter, t\n\nDescription::\n.............\n\nA character is an object that represents a unitary token in an aggregate\nquantity of text; see *Note Character Concepts::.\n\nThe types base-char and extended-char form an exhaustive partition of the\ntype character.\n\nSee Also::\n..........\n\n*Note Character Concepts::, *Note Sharpsign Backslash::, *Note Printing\nCharacters::\n\n"
}