{
    "name": "cis",
    "prev": "numberp",
    "next": "complex",
    "up": "Numbers Dictionary",
    "header": {
        "type": "Function",
        "text": "cis"
    },
    "sections": [
        {
            "type": "Syntax",
            "defs": [
                {
                    "name": "cis",
                    "text": " radians =>  number\n"
                }
            ],
            "text": ""
        },
        {
            "type": "Arguments and Values",
            "text": "",
            "values": [
                {
                    "name": "radians",
                    "desc": "a real."
                },
                {
                    "name": "number",
                    "desc": "a complex."
                }
            ]
        },
        {
            "type": "Description",
            "text": "cis returns the value of~e^i\\cdot radians, which is a complex in which the\nreal part is equal to the cosine of radians, and the imaginary part is\nequal to the sine of radians.\n"
        },
        {
            "type": "Examples",
            "text": "      (cis 0) =>  #C(1.0 0.0)\n"
        },
        {
            "type": "See Also",
            "text": "*Note Rule of Float Substitutability::\n"
        }
    ],
    "_otext": "File: gcl.info,  Node: cis,  Next: complex,  Prev: numberp,  Up: Numbers Dictionary\n\ncis                                                              [Function]\n---------------------------------------------------------------------------\n\n`cis'  radians =>  number\n\nArguments and Values::\n......................\n\nradians--a real.\n\nnumber--a complex.\n\nDescription::\n.............\n\ncis returns the value of~e^i\\cdot radians, which is a complex in which the\nreal part is equal to the cosine of radians, and the imaginary part is\nequal to the sine of radians.\n\nExamples::\n..........\n\n      (cis 0) =>  #C(1.0 0.0)\n\nSee Also::\n..........\n\n*Note Rule of Float Substitutability::\n\n"
}