{
    "name": "compute-applicable-methods",
    "prev": "call-next-method",
    "next": "define-method-combination",
    "up": "Objects Dictionary",
    "header": {
        "type": "Standard Generic Function",
        "text": "compute-applicable-methods"
    },
    "sections": [
        {
            "type": "",
            "text": ""
        },
        {
            "type": "Syntax",
            "defs": [
                {
                    "name": "compute-applicable-methods",
                    "text": " generic-function function-arguments =>methods\n\n"
                }
            ],
            "text": ""
        },
        {
            "type": "Syntax",
            "defs": [
                {
                    "name": "compute-applicable-methods",
                    "text": " (generic-function standard-generic-function)\n"
                }
            ],
            "text": ""
        },
        {
            "type": "Arguments and Values",
            "text": "",
            "values": [
                {
                    "name": "generic-function",
                    "desc": "a generic function."
                },
                {
                    "name": "function-arguments",
                    "desc": "a list of arguments for the generic-function."
                },
                {
                    "name": "methods",
                    "desc": "a list of method objects."
                }
            ]
        },
        {
            "type": "Description",
            "text": "Given a generic-function and a set of function-arguments, the function\ncompute-applicable-methods returns the set of methods that are applicable\nfor those arguments sorted according to precedence order.  See *Note\nMethod Selection and Combination::.\n"
        },
        {
            "type": "Affected By",
            "text": "defmethod\n"
        },
        {
            "type": "See Also",
            "text": "*Note Method Selection and Combination::\n"
        }
    ],
    "_otext": "File: gcl.info,  Node: compute-applicable-methods,  Next: define-method-combination,  Prev: call-next-method,  Up: Objects Dictionary\n\ncompute-applicable-methods                      [Standard Generic Function]\n---------------------------------------------------------------------------\n\nSyntax::\n........\n\n`compute-applicable-methods'  generic-function function-arguments =>\nmethods\n\nMethod Signatures::\n...................\n\n`compute-applicable-methods'  (generic-function standard-generic-function)\n\nArguments and Values::\n......................\n\ngeneric-function--a generic function.\n\nfunction-arguments--a list of arguments for the generic-function.\n\nmethods--a list of method objects.\n\nDescription::\n.............\n\nGiven a generic-function and a set of function-arguments, the function\ncompute-applicable-methods returns the set of methods that are applicable\nfor those arguments sorted according to precedence order.  See *Note\nMethod Selection and Combination::.\n\nAffected By::\n.............\n\ndefmethod\n\nSee Also::\n..........\n\n*Note Method Selection and Combination::\n\n"
}