{
    "name": "consp",
    "prev": "cons",
    "next": "atom",
    "up": "Conses Dictionary",
    "header": {
        "type": "Function",
        "text": "consp"
    },
    "sections": [
        {
            "type": "Syntax",
            "defs": [
                {
                    "name": "consp",
                    "text": " object =>  generalized-boolean\n"
                }
            ],
            "text": ""
        },
        {
            "type": "Arguments and Values",
            "text": "",
            "values": [
                {
                    "name": "object",
                    "desc": "an object."
                },
                {
                    "name": "generalized-boolean",
                    "desc": "a generalized boolean."
                }
            ]
        },
        {
            "type": "Description",
            "text": "Returns true if object is of type cons; otherwise, returns false.\n"
        },
        {
            "type": "Examples",
            "text": "      (consp nil) =>  false\n      (consp (cons 1 2)) =>  true\nThe empty list is not a cons, so\n      (consp '()) == (consp 'nil) =>  false\n"
        },
        {
            "type": "See Also",
            "text": "*Note listp::\n"
        },
        {
            "type": "Notes",
            "text": "      (consp object) == (typep object 'cons) == (not (typep object 'atom)) == (typep object '(not atom))\n"
        }
    ],
    "_otext": "File: gcl.info,  Node: consp,  Next: atom,  Prev: cons,  Up: Conses Dictionary\n\nconsp                                                            [Function]\n---------------------------------------------------------------------------\n\n`consp'  object =>  generalized-boolean\n\nArguments and Values::\n......................\n\nobject--an object.\n\ngeneralized-boolean--a generalized boolean.\n\nDescription::\n.............\n\nReturns true if object is of type cons; otherwise, returns false.\n\nExamples::\n..........\n\n      (consp nil) =>  false\n      (consp (cons 1 2)) =>  true\n\nThe empty list is not a cons, so\n\n      (consp '()) == (consp 'nil) =>  false\n\nSee Also::\n..........\n\n*Note listp::\n\nNotes::\n.......\n\n      (consp object) == (typep object 'cons) == (not (typep object 'atom)) == (typep object '(not atom))\n\n"
}