{
    "name": "control-error",
    "prev": "rotatef",
    "next": "program-error",
    "up": "Data and Control Flow Dictionary",
    "header": {
        "type": "Condition Type",
        "text": "control-error"
    },
    "sections": [
        {
            "type": "",
            "text": ""
        },
        {
            "type": "Class Precedence List",
            "text": "",
            "items": [
                {
                    "name": "control-error",
                    "link": "control-error"
                },
                {
                    "name": " error",
                    "link": null
                },
                {
                    "name": " serious-condition",
                    "link": null
                },
                {
                    "name": " condition",
                    "link": null
                },
                {
                    "name": " t",
                    "link": null
                }
            ]
        },
        {
            "type": "Description",
            "text": "The type control-error consists of error conditions that result from\ninvalid dynamic transfers of control in a program.  The errors that result\nfrom giving throw a tag that is not active or from giving go or\nreturn-from a tag that is no longer dynamically available are of type\ncontrol-error.\n"
        }
    ],
    "_otext": "File: gcl.info,  Node: control-error,  Next: program-error,  Prev: rotatef,  Up: Data and Control Flow Dictionary\n\ncontrol-error                                              [Condition Type]\n---------------------------------------------------------------------------\n\nClass Precedence List::\n.......................\n\ncontrol-error, error, serious-condition, condition, t\n\nDescription::\n.............\n\nThe type control-error consists of error conditions that result from\ninvalid dynamic transfers of control in a program.  The errors that result\nfrom giving throw a tag that is not active or from giving go or\nreturn-from a tag that is no longer dynamically available are of type\ncontrol-error.\n\n"
}