{
    "name": "declaim",
    "prev": "proclaim",
    "next": "declare",
    "up": "Evaluation and Compilation Dictionary",
    "header": {
        "type": "Macro",
        "text": "declaim"
    },
    "sections": [
        {
            "type": "Syntax",
            "defs": [
                {
                    "name": "declaim",
                    "text": " {declaration-specifier}* =>  implementation-dependent\n"
                }
            ],
            "text": ""
        },
        {
            "type": "Arguments and Values",
            "text": "",
            "values": [
                {
                    "name": "declaration-specifier",
                    "desc": "a declaration specifier; not evaluated."
                }
            ]
        },
        {
            "type": "Description",
            "text": "Establishes the declarations specified by the declaration-specifiers.\nIf a use of this macro appears as a top level form in a file being\nprocessed by the file compiler, the proclamations are also made at\ncompile-time.  As with other defining macros, it is unspecified whether or\nnot the compile-time side-effects of a declaim persist after the file has\nbeen compiled.\n"
        },
        {
            "type": "Examples",
            "text": ""
        },
        {
            "type": "See Also",
            "text": "declare, *Note proclaim::\n"
        }
    ],
    "_otext": "File: gcl.info,  Node: declaim,  Next: declare,  Prev: proclaim,  Up: Evaluation and Compilation Dictionary\n\ndeclaim                                                             [Macro]\n---------------------------------------------------------------------------\n\n`declaim'  {declaration-specifier}* =>  implementation-dependent\n\nArguments and Values::\n......................\n\ndeclaration-specifier--a declaration specifier; not evaluated.\n\nDescription::\n.............\n\nEstablishes the declarations specified by the declaration-specifiers.\n\nIf a use of this macro appears as a top level form in a file being\nprocessed by the file compiler, the proclamations are also made at\ncompile-time.  As with other defining macros, it is unspecified whether or\nnot the compile-time side-effects of a declaim persist after the file has\nbeen compiled.\n\nExamples::\n..........\n\nSee Also::\n..........\n\ndeclare, *Note proclaim::\n\n"
}