{
    "name": "ensure-directories-exist",
    "prev": "probe-file",
    "next": "truename",
    "up": "Files Dictionary",
    "header": {
        "type": "Function",
        "text": "ensure-directories-exist"
    },
    "sections": [
        {
            "type": "Syntax",
            "defs": [
                {
                    "name": "ensure-directories-exist",
                    "text": " pathspec &key verbose =>  pathspec, created\n"
                }
            ],
            "text": ""
        },
        {
            "type": "Arguments and Values",
            "text": "",
            "values": [
                {
                    "name": "pathspec",
                    "desc": "a pathname designator."
                },
                {
                    "name": "verbose",
                    "desc": "a generalized boolean."
                },
                {
                    "name": "created",
                    "desc": "a generalized boolean."
                }
            ]
        },
        {
            "type": "Description",
            "text": "Tests whether the directories containing the specified file actually exist,\nand attempts to create them if they do not.\nIf the containing directories do not exist and if verbose is true, then\nthe implementation is permitted (but not required) to perform output to\nstandard output saying what directories were created.  If the containing\ndirectories exist, or if verbose is false, this function performs no\noutput.\nThe primary value is the given pathspec so that this operation can be\nstraightforwardly composed with other file manipulation expressions.  The\nsecondary value, created, is true if any directories were created.\n"
        },
        {
            "type": "Affected By",
            "text": "The host computer's file system.\n"
        },
        {
            "type": "Exceptional Situations",
            "text": "An error of type file-error is signaled if the host, device, or directory\npart of pathspec is wild.\nIf the directory creation attempt is not successful, an error of type\nfile-error is signaled; if this occurs, it might be the case that none,\nsome, or all of the requested creations have actually occurred within the\nfile system.\n"
        },
        {
            "type": "See Also",
            "text": "*Note probe-file:: , *Note open:: ,\n*Note Pathnames as Filenames::\n"
        }
    ],
    "_otext": "File: gcl.info,  Node: ensure-directories-exist,  Next: truename,  Prev: probe-file,  Up: Files Dictionary\n\nensure-directories-exist                                         [Function]\n---------------------------------------------------------------------------\n\n`ensure-directories-exist'  pathspec &key verbose =>  pathspec, created\n\nArguments and Values::\n......................\n\npathspec--a pathname designator.\n\nverbose--a generalized boolean.\n\ncreated--a generalized boolean.\n\nDescription::\n.............\n\nTests whether the directories containing the specified file actually exist,\nand attempts to create them if they do not.\n\nIf the containing directories do not exist and if verbose is true, then\nthe implementation is permitted (but not required) to perform output to\nstandard output saying what directories were created.  If the containing\ndirectories exist, or if verbose is false, this function performs no\noutput.\n\nThe primary value is the given pathspec so that this operation can be\nstraightforwardly composed with other file manipulation expressions.  The\nsecondary value, created, is true if any directories were created.\n\nAffected By::\n.............\n\nThe host computer's file system.\n\nExceptional Situations::\n........................\n\nAn error of type file-error is signaled if the host, device, or directory\npart of pathspec is wild.\n\nIf the directory creation attempt is not successful, an error of type\nfile-error is signaled; if this occurs, it might be the case that none,\nsome, or all of the requested creations have actually occurred within the\nfile system.\n\nSee Also::\n..........\n\n*Note probe-file:: , *Note open:: ,\n\n*Note Pathnames as Filenames::\n\n"
}