{
    "name": "evenp",
    "prev": "abs",
    "next": "exp",
    "up": "Numbers Dictionary",
    "header": {
        "type": "Function",
        "text": "evenp, oddp"
    },
    "sections": [
        {
            "type": "Syntax",
            "defs": [
                {
                    "name": "evenp",
                    "text": " integer =>  generalized-boolean\n"
                },
                {
                    "name": "oddp",
                    "text": " integer =>  generalized-boolean\n\n"
                }
            ],
            "text": ""
        },
        {
            "type": "Arguments and Values",
            "text": "",
            "values": [
                {
                    "name": "integer",
                    "desc": "an integer."
                },
                {
                    "name": "generalized-boolean",
                    "desc": "a generalized boolean."
                }
            ]
        },
        {
            "type": "Description",
            "text": "evenp returns true if integer is even (divisible by two); otherwise,\nreturns false.\noddp returns true if integer is odd (not divisible by two); otherwise,\nreturns false.\n"
        },
        {
            "type": "Examples",
            "text": "      (evenp 0) =>  true\n      (oddp 10000000000000000000000) =>  false\n      (oddp -1) =>  true\n"
        },
        {
            "type": "Exceptional Situations",
            "text": "Should signal an error of type type-error if integer is not an integer.\n"
        },
        {
            "type": "Notes",
            "text": "      (evenp integer) == (not (oddp integer))\n      (oddp integer)  == (not (evenp integer))\n"
        }
    ],
    "_otext": "File: gcl.info,  Node: evenp,  Next: exp,  Prev: abs,  Up: Numbers Dictionary\n\nevenp, oddp                                                      [Function]\n---------------------------------------------------------------------------\n\n`evenp'  integer =>  generalized-boolean\n\n`oddp'  integer =>  generalized-boolean\n\nArguments and Values::\n......................\n\ninteger--an integer.\n\ngeneralized-boolean--a generalized boolean.\n\nDescription::\n.............\n\nevenp returns true if integer is even (divisible by two); otherwise,\nreturns false.\n\noddp returns true if integer is odd (not divisible by two); otherwise,\nreturns false.\n\nExamples::\n..........\n\n      (evenp 0) =>  true\n      (oddp 10000000000000000000000) =>  false\n      (oddp -1) =>  true\n\nExceptional Situations::\n........................\n\nShould signal an error of type type-error if integer is not an integer.\n\nNotes::\n.......\n\n      (evenp integer) == (not (oddp integer))\n      (oddp integer)  == (not (evenp integer))\n\n"
}