{
    "name": "file-author",
    "prev": "truename",
    "next": "file-write-date",
    "up": "Files Dictionary",
    "header": {
        "type": "Function",
        "text": "file-author"
    },
    "sections": [
        {
            "type": "Syntax",
            "defs": [
                {
                    "name": "file-author",
                    "text": " pathspec =>  author\n"
                }
            ],
            "text": ""
        },
        {
            "type": "Arguments and Values",
            "text": "",
            "values": [
                {
                    "name": "pathspec",
                    "desc": "a pathname designator."
                },
                {
                    "name": "author",
                    "desc": "a string or nil."
                }
            ]
        },
        {
            "type": "Description",
            "text": "Returns a string naming the author of the file specified by pathspec, or\nnil if the author's name cannot be determined.\n"
        },
        {
            "type": "Examples",
            "text": "      (with-open-file (stream \">relativity>general.text\")\n        (file-author s))\n     =>  \"albert\"\n"
        },
        {
            "type": "Affected By",
            "text": "The host computer's file system.\nOther users of the file named by pathspec.\n"
        },
        {
            "type": "Exceptional Situations",
            "text": "An error of type file-error is signaled if pathspec is wild.\nAn error of type file-error is signaled if the file system cannot perform\nthe requested operation.\n"
        },
        {
            "type": "See Also",
            "text": "pathname, logical-pathname, *Note File System Concepts::,\n*Note Pathnames as Filenames::\n"
        }
    ],
    "_otext": "File: gcl.info,  Node: file-author,  Next: file-write-date,  Prev: truename,  Up: Files Dictionary\n\nfile-author                                                      [Function]\n---------------------------------------------------------------------------\n\n`file-author'  pathspec =>  author\n\nArguments and Values::\n......................\n\npathspec--a pathname designator.\n\nauthor--a string or nil.\n\nDescription::\n.............\n\nReturns a string naming the author of the file specified by pathspec, or\nnil if the author's name cannot be determined.\n\nExamples::\n..........\n\n      (with-open-file (stream \">relativity>general.text\")\n        (file-author s))\n     =>  \"albert\"\n\nAffected By::\n.............\n\nThe host computer's file system.\n\nOther users of the file named by pathspec.\n\nExceptional Situations::\n........................\n\nAn error of type file-error is signaled if pathspec is wild.\n\nAn error of type file-error is signaled if the file system cannot perform\nthe requested operation.\n\nSee Also::\n..........\n\npathname, logical-pathname, *Note File System Concepts::,\n\n*Note Pathnames as Filenames::\n\n"
}