{
    "name": "floatp",
    "prev": "float",
    "next": "most-positive-short-float",
    "up": "Numbers Dictionary",
    "header": {
        "type": "Function",
        "text": "floatp"
    },
    "sections": [
        {
            "type": "Syntax",
            "defs": [
                {
                    "name": "floatp",
                    "text": " object generalized-boolean\n"
                }
            ],
            "text": ""
        },
        {
            "type": "Arguments and Values",
            "text": "",
            "values": [
                {
                    "name": "object",
                    "desc": "an object."
                },
                {
                    "name": "generalized-boolean",
                    "desc": "a generalized boolean."
                }
            ]
        },
        {
            "type": "Description",
            "text": "Returns true if object is of type float; otherwise, returns false.\n"
        },
        {
            "type": "Examples",
            "text": "      (floatp 1.2d2) =>  true\n      (floatp 1.212) =>  true\n      (floatp 1.2s2) =>  true\n      (floatp (expt 2 130)) =>  false\n"
        },
        {
            "type": "Notes",
            "text": "      (floatp object) == (typep object 'float)\n"
        }
    ],
    "_otext": "File: gcl.info,  Node: floatp,  Next: most-positive-short-float,  Prev: float,  Up: Numbers Dictionary\n\nfloatp                                                           [Function]\n---------------------------------------------------------------------------\n\n`floatp'  object generalized-boolean\n\nArguments and Values::\n......................\n\nobject--an object.\n\ngeneralized-boolean--a generalized boolean.\n\nDescription::\n.............\n\nReturns true if object is of type float; otherwise, returns false.\n\nExamples::\n..........\n\n      (floatp 1.2d2) =>  true\n      (floatp 1.212) =>  true\n      (floatp 1.2s2) =>  true\n      (floatp (expt 2 130)) =>  false\n\nNotes::\n.......\n\n      (floatp object) == (typep object 'float)\n\n"
}