{
    "name": "floating-point-inexact",
    "prev": "floating-point-invalid-operation",
    "next": "floating-point-overflow",
    "up": "Numbers Dictionary",
    "header": {
        "type": "Condition Type",
        "text": "floating-point-inexact"
    },
    "sections": [
        {
            "type": "",
            "text": ""
        },
        {
            "type": "Class Precedence List",
            "text": "",
            "items": [
                {
                    "name": "condition",
                    "link": "condition"
                },
                {
                    "name": " t",
                    "link": null
                }
            ]
        },
        {
            "type": "Description",
            "text": "The type floating-point-inexact consists of error conditions that occur\nbecause of certain floating point traps.\nIt is implementation-dependent whether floating point traps occur, and\nwhether or how they may be enabled or disabled.  Therefore, conforming\ncode may establish handlers for this condition, but must not depend on its\nbeing signaled.\n"
        }
    ],
    "_otext": "File: gcl.info,  Node: floating-point-inexact,  Next: floating-point-overflow,  Prev: floating-point-invalid-operation,  Up: Numbers Dictionary\n\nfloating-point-inexact                                     [Condition Type]\n---------------------------------------------------------------------------\n\nClass Precedence List::\n.......................\n\nfloating-point-inexact, arithmetic-error, error, serious-condition,\ncondition, t\n\nDescription::\n.............\n\nThe type floating-point-inexact consists of error conditions that occur\nbecause of certain floating point traps.\n\nIt is implementation-dependent whether floating point traps occur, and\nwhether or how they may be enabled or disabled.  Therefore, conforming\ncode may establish handlers for this condition, but must not depend on its\nbeing signaled.\n\n"
}