{
    "name": "gcd",
    "prev": "exp",
    "next": "incf",
    "up": "Numbers Dictionary",
    "header": {
        "type": "Function",
        "text": "gcd"
    },
    "sections": [
        {
            "type": "Syntax",
            "defs": [
                {
                    "name": "gcd",
                    "text": " &rest integers =>  greatest-common-denominator\n"
                }
            ],
            "text": ""
        },
        {
            "type": "Arguments and Values",
            "text": "",
            "values": [
                {
                    "name": "integer",
                    "desc": "an integer."
                },
                {
                    "name": "greatest-common-denominator",
                    "desc": "a non-negative integer."
                }
            ]
        },
        {
            "type": "Description",
            "text": "Returns the greatest common divisor of integers.  If only one integer is\nsupplied, its absolute value is returned.  If no integers are given, gcd\nreturns 0, which is an identity for this operation.\n"
        },
        {
            "type": "Examples",
            "text": "      (gcd) =>  0\n      (gcd 60 42) =>  6\n      (gcd 3333 -33 101) =>  1\n      (gcd 3333 -33 1002001) =>  11\n      (gcd 91 -49) =>  7\n      (gcd 63 -42 35) =>  7\n      (gcd 5) =>  5\n      (gcd -4) =>  4\n"
        },
        {
            "type": "Exceptional Situations",
            "text": "Should signal an error of type type-error if any integer is not an integer.\n"
        },
        {
            "type": "See Also",
            "text": "*Note lcm::\n"
        },
        {
            "type": "Notes",
            "text": "For three or more arguments,\n      (gcd b c ... z) == (gcd (gcd a b) c ... z)\n"
        }
    ],
    "_otext": "File: gcl.info,  Node: gcd,  Next: incf,  Prev: exp,  Up: Numbers Dictionary\n\ngcd                                                              [Function]\n---------------------------------------------------------------------------\n\n`gcd'  &rest integers =>  greatest-common-denominator\n\nArguments and Values::\n......................\n\ninteger--an integer.\n\ngreatest-common-denominator--a non-negative integer.\n\nDescription::\n.............\n\nReturns the greatest common divisor of integers.  If only one integer is\nsupplied, its absolute value is returned.  If no integers are given, gcd\nreturns 0, which is an identity for this operation.\n\nExamples::\n..........\n\n      (gcd) =>  0\n      (gcd 60 42) =>  6\n      (gcd 3333 -33 101) =>  1\n      (gcd 3333 -33 1002001) =>  11\n      (gcd 91 -49) =>  7\n      (gcd 63 -42 35) =>  7\n      (gcd 5) =>  5\n      (gcd -4) =>  4\n\nExceptional Situations::\n........................\n\nShould signal an error of type type-error if any integer is not an integer.\n\nSee Also::\n..........\n\n*Note lcm::\n\nNotes::\n.......\n\nFor three or more arguments,\n\n      (gcd b c ... z) == (gcd (gcd a b) c ... z)\n\n"
}