{
    "name": "generic-function",
    "prev": "compiled-function",
    "next": "standard-generic-function",
    "up": "Types and Classes Dictionary",
    "header": {
        "type": "System Class",
        "text": "generic-function"
    },
    "sections": [
        {
            "type": "",
            "text": ""
        },
        {
            "type": "Class Precedence List",
            "text": "",
            "items": [
                {
                    "name": "generic-function",
                    "link": "generic-function"
                },
                {
                    "name": " function",
                    "link": null
                },
                {
                    "name": " t",
                    "link": null
                }
            ]
        },
        {
            "type": "Description",
            "text": "A generic function is a function whose behavior depends on the classes or\nidentities of the arguments supplied to it.  A generic function object\ncontains a set of methods, a lambda list, a method combination type, and\nother information.  The methods define the class-specific behavior and\noperations of the generic function; a method is said to specialize a\ngeneric function.  When invoked, a generic function executes a subset of\nits methods based on the classes or identities of its arguments.\nA generic function can be used in the same ways that an ordinary function\ncan be used; specifically, a generic function can be used as an argument\nto funcall and apply, and can be given a global or a local name.\n"
        }
    ],
    "_otext": "File: gcl.info,  Node: generic-function,  Next: standard-generic-function,  Prev: compiled-function,  Up: Types and Classes Dictionary\n\ngeneric-function                                             [System Class]\n---------------------------------------------------------------------------\n\nClass Precedence List::\n.......................\n\ngeneric-function, function, t\n\nDescription::\n.............\n\nA generic function is a function whose behavior depends on the classes or\nidentities of the arguments supplied to it.  A generic function object\ncontains a set of methods, a lambda list, a method combination type, and\nother information.  The methods define the class-specific behavior and\noperations of the generic function; a method is said to specialize a\ngeneric function.  When invoked, a generic function executes a subset of\nits methods based on the classes or identities of its arguments.\n\nA generic function can be used in the same ways that an ordinary function\ncan be used; specifically, a generic function can be used as an argument\nto funcall and apply, and can be given a global or a local name.\n\n"
}