{
    "name": "get-internal-run-time",
    "prev": "get-internal-real-time",
    "next": "disassemble",
    "up": "Environment Dictionary",
    "header": {
        "type": "Function",
        "text": "get-internal-run-time"
    },
    "sections": [
        {
            "type": "Syntax",
            "defs": [
                {
                    "name": "get-internal-run-time",
                    "text": " <no arguments> =>  internal-time\n"
                }
            ],
            "text": ""
        },
        {
            "type": "Arguments and Values",
            "text": "",
            "values": [
                {
                    "name": "internal-time",
                    "desc": "a non-negative integer."
                }
            ]
        },
        {
            "type": "Description",
            "text": "Returns as an integer the current run time in internal time units.  The\nprecise meaning of this quantity is implementation-defined;  it may\nmeasure real time, run time, CPU cycles, or some other quantity.  The\nintent is that the difference between the values of two calls to this\nfunction be the amount of time between the two calls during which\ncomputational effort was expended on behalf of the executing program.\n"
        },
        {
            "type": "Affected By",
            "text": "The implementation, the time of day (i.e., the passage of time).\n"
        },
        {
            "type": "See Also",
            "text": "*Note internal-time-units-per-second::\n"
        },
        {
            "type": "Notes",
            "text": "Depending on the implementation, paging time and garbage collection time\nmight be included in this measurement.  Also, in a multitasking\nenvironment, it might not be possible to show the time for just the\nrunning process, so in some implementations, time taken by other processes\nduring the same time interval might be included in this measurement as\nwell.\n"
        }
    ],
    "_otext": "File: gcl.info,  Node: get-internal-run-time,  Next: disassemble,  Prev: get-internal-real-time,  Up: Environment Dictionary\n\nget-internal-run-time                                            [Function]\n---------------------------------------------------------------------------\n\n`get-internal-run-time'  <no arguments> =>  internal-time\n\nArguments and Values::\n......................\n\ninternal-time--a non-negative integer.\n\nDescription::\n.............\n\nReturns as an integer the current run time in internal time units.  The\nprecise meaning of this quantity is implementation-defined;  it may\nmeasure real time, run time, CPU cycles, or some other quantity.  The\nintent is that the difference between the values of two calls to this\nfunction be the amount of time between the two calls during which\ncomputational effort was expended on behalf of the executing program.\n\nAffected By::\n.............\n\nThe implementation, the time of day (i.e., the passage of time).\n\nSee Also::\n..........\n\n*Note internal-time-units-per-second::\n\nNotes::\n.......\n\nDepending on the implementation, paging time and garbage collection time\nmight be included in this measurement.  Also, in a multitasking\nenvironment, it might not be possible to show the time for just the\nrunning process, so in some implementations, time taken by other processes\nduring the same time interval might be included in this measurement as\nwell.\n\n"
}