{
    "name": "hash-table",
    "prev": "Hash Tables Dictionary",
    "next": "make-hash-table",
    "up": "Hash Tables Dictionary",
    "header": {
        "type": "System Class",
        "text": "hash-table"
    },
    "sections": [
        {
            "type": "",
            "text": ""
        },
        {
            "type": "Class Precedence List",
            "text": "",
            "items": [
                {
                    "name": "hash-table",
                    "link": "hash-table"
                },
                {
                    "name": " t",
                    "link": null
                }
            ]
        },
        {
            "type": "Description",
            "text": "Hash tables provide a way of mapping any object (a key) to an associated\nobject (a value).\n"
        },
        {
            "type": "See Also",
            "text": "*Note Hash Table Concepts::, *Note Printing Other Objects::\n"
        },
        {
            "type": "Notes",
            "text": "The intent is that this mapping be implemented by a hashing mechanism,\nsuch as that described in Section 6.4 \"Hashing\" of The Art of Computer\nProgramming, Volume 3 (pp506-549).  In spite of this intent, no conforming\nimplementation is required to use any particular technique to implement\nthe mapping.\n"
        }
    ],
    "_otext": "File: gcl.info,  Node: hash-table,  Next: make-hash-table,  Prev: Hash Tables Dictionary,  Up: Hash Tables Dictionary\n\nhash-table                                                   [System Class]\n---------------------------------------------------------------------------\n\nClass Precedence List::\n.......................\n\nhash-table, t\n\nDescription::\n.............\n\nHash tables provide a way of mapping any object (a key) to an associated\nobject (a value).\n\nSee Also::\n..........\n\n*Note Hash Table Concepts::, *Note Printing Other Objects::\n\nNotes::\n.......\n\nThe intent is that this mapping be implemented by a hashing mechanism,\nsuch as that described in Section 6.4 \"Hashing\" of The Art of Computer\nProgramming, Volume 3 (pp506-549).  In spite of this intent, no conforming\nimplementation is required to use any particular technique to implement\nthe mapping.\n\n"
}