{
    "name": "hash-table-rehash-threshold",
    "prev": "hash-table-rehash-size",
    "next": "hash-table-size",
    "up": "Hash Tables Dictionary",
    "header": {
        "type": "Function",
        "text": "hash-table-rehash-threshold"
    },
    "sections": [
        {
            "type": "Syntax",
            "defs": [
                {
                    "name": "hash-table-rehash-threshold",
                    "text": " hash-table =>  rehash-threshold\n"
                }
            ],
            "text": ""
        },
        {
            "type": "Arguments and Values",
            "text": "",
            "values": [
                {
                    "name": "hash-table",
                    "desc": "a hash table."
                },
                {
                    "name": "rehash-threshold",
                    "desc": "a real of type (real 0 1)."
                }
            ]
        },
        {
            "type": "Description",
            "text": "Returns the current rehash threshold of hash-table, which is suitable for\nuse in a call to make-hash-table in order to produce a hash table with\nstate corresponding to the current state of the hash-table.\n"
        },
        {
            "type": "Examples",
            "text": "      (setq table (make-hash-table :size 100 :rehash-threshold 0.5))\n     =>  #<HASH-TABLE EQL 0/100 2562446>\n      (hash-table-rehash-threshold table) =>  0.5\n"
        },
        {
            "type": "Exceptional Situations",
            "text": "Should signal an error of type type-error if hash-table is not a hash\ntable.\n"
        },
        {
            "type": "See Also",
            "text": "*Note make-hash-table:: , *Note hash-table-rehash-size::\n"
        }
    ],
    "_otext": "File: gcl.info,  Node: hash-table-rehash-threshold,  Next: hash-table-size,  Prev: hash-table-rehash-size,  Up: Hash Tables Dictionary\n\nhash-table-rehash-threshold                                      [Function]\n---------------------------------------------------------------------------\n\n`hash-table-rehash-threshold'  hash-table =>  rehash-threshold\n\nArguments and Values::\n......................\n\nhash-table--a hash table.\n\nrehash-threshold--a real of type (real 0 1).\n\nDescription::\n.............\n\nReturns the current rehash threshold of hash-table, which is suitable for\nuse in a call to make-hash-table in order to produce a hash table with\nstate corresponding to the current state of the hash-table.\n\nExamples::\n..........\n\n      (setq table (make-hash-table :size 100 :rehash-threshold 0.5))\n     =>  #<HASH-TABLE EQL 0/100 2562446>\n      (hash-table-rehash-threshold table) =>  0.5\n\nExceptional Situations::\n........................\n\nShould signal an error of type type-error if hash-table is not a hash\ntable.\n\nSee Also::\n..........\n\n*Note make-hash-table:: , *Note hash-table-rehash-size::\n\n"
}