{
    "name": "input-stream-p",
    "prev": "two-way-stream",
    "next": "interactive-stream-p",
    "up": "Streams Dictionary",
    "header": {
        "type": "Function",
        "text": "input-stream-p, output-stream-p"
    },
    "sections": [
        {
            "type": "Syntax",
            "defs": [
                {
                    "name": "input-stream-p",
                    "text": " stream =>  generalized-boolean\n"
                },
                {
                    "name": "output-stream-p",
                    "text": " stream =>  generalized-boolean\n\n"
                }
            ],
            "text": ""
        },
        {
            "type": "Arguments and Values",
            "text": "",
            "values": [
                {
                    "name": "stream",
                    "desc": "a stream."
                },
                {
                    "name": "generalized-boolean",
                    "desc": "a generalized boolean."
                }
            ]
        },
        {
            "type": "Description",
            "text": "input-stream-p returns true if stream is an input stream; otherwise,\nreturns false.\noutput-stream-p returns true if stream is an output stream; otherwise,\nreturns false.\n"
        },
        {
            "type": "Examples",
            "text": "      (input-stream-p *standard-input*) =>  true\n      (input-stream-p *terminal-io*) =>  true\n      (input-stream-p (make-string-output-stream)) =>  false\n      (output-stream-p *standard-output*) =>  true\n      (output-stream-p *terminal-io*) =>  true\n      (output-stream-p (make-string-input-stream \"jr\")) =>  false\n"
        },
        {
            "type": "Exceptional Situations",
            "text": "Should signal an error of type type-error if stream is not a stream.\n"
        }
    ],
    "_otext": "File: gcl.info,  Node: input-stream-p,  Next: interactive-stream-p,  Prev: two-way-stream,  Up: Streams Dictionary\n\ninput-stream-p, output-stream-p                                  [Function]\n---------------------------------------------------------------------------\n\n`input-stream-p'  stream =>  generalized-boolean\n\n`output-stream-p'  stream =>  generalized-boolean\n\nArguments and Values::\n......................\n\nstream--a stream.\n\ngeneralized-boolean--a generalized boolean.\n\nDescription::\n.............\n\ninput-stream-p returns true if stream is an input stream; otherwise,\nreturns false.\n\noutput-stream-p returns true if stream is an output stream; otherwise,\nreturns false.\n\nExamples::\n..........\n\n      (input-stream-p *standard-input*) =>  true\n      (input-stream-p *terminal-io*) =>  true\n      (input-stream-p (make-string-output-stream)) =>  false\n     \n      (output-stream-p *standard-output*) =>  true\n      (output-stream-p *terminal-io*) =>  true\n      (output-stream-p (make-string-input-stream \"jr\")) =>  false\n\nExceptional Situations::\n........................\n\nShould signal an error of type type-error if stream is not a stream.\n\n"
}