{
    "name": "integer",
    "prev": "ratio",
    "next": "signed-byte",
    "up": "Numbers Dictionary",
    "header": {
        "type": "System Class",
        "text": "integer"
    },
    "sections": [
        {
            "type": "",
            "text": ""
        },
        {
            "type": "Class Precedence List",
            "text": "",
            "items": [
                {
                    "name": "number",
                    "link": "number"
                },
                {
                    "name": " t",
                    "link": null
                }
            ]
        },
        {
            "type": "Description",
            "text": "An integer is a mathematical integer. There is no limit on the magnitude\nof an integer.\nThe types fixnum and bignum form an exhaustive partition of type integer.\n"
        },
        {
            "type": "Compound Type Specifier Kind",
            "text": "Abbreviating.\n"
        },
        {
            "type": "Compound Type Specifier Syntax",
            "text": "(`integer'{[lower-limit [upper-limit]]})\n"
        },
        {
            "type": "Compound Type Specifier Arguments",
            "text": "lower-limit, upper-limit--interval designators for type integer.  The\ndefaults for each of lower-limit and upper-limit is the symbol *.\n"
        },
        {
            "type": "Compound Type Specifier Description",
            "text": "This denotes the integers on the interval described by lower-limit and\nupper-limit.\n"
        },
        {
            "type": "See Also",
            "text": "Figure~2-9, *Note Constructing Numbers from Tokens::, *Note Printing\nIntegers::\n"
        },
        {
            "type": "Notes",
            "text": "The type (integer lower upper), where lower and upper are\nmost-negative-fixnum and most-positive-fixnum, respectively, is also\ncalled fixnum.\nThe type (integer 0 1) is also called bit.  The type (integer 0 *) is also\ncalled unsigned-byte.\n"
        }
    ],
    "_otext": "File: gcl.info,  Node: integer,  Next: signed-byte,  Prev: ratio,  Up: Numbers Dictionary\n\ninteger                                                      [System Class]\n---------------------------------------------------------------------------\n\nClass Precedence List::\n.......................\n\ninteger, rational,\n\nreal,\n\nnumber, t\n\nDescription::\n.............\n\nAn integer is a mathematical integer. There is no limit on the magnitude\nof an integer.\n\nThe types fixnum and bignum form an exhaustive partition of type integer.\n\nCompound Type Specifier Kind::\n..............................\n\nAbbreviating.\n\nCompound Type Specifier Syntax::\n................................\n\n(`integer'{[lower-limit [upper-limit]]})\n\nCompound Type Specifier Arguments::\n...................................\n\nlower-limit, upper-limit--interval designators for type integer.  The\ndefaults for each of lower-limit and upper-limit is the symbol *.\n\nCompound Type Specifier Description::\n.....................................\n\nThis denotes the integers on the interval described by lower-limit and\nupper-limit.\n\nSee Also::\n..........\n\nFigure~2-9, *Note Constructing Numbers from Tokens::, *Note Printing\nIntegers::\n\nNotes::\n.......\n\nThe type (integer lower upper), where lower and upper are\nmost-negative-fixnum and most-positive-fixnum, respectively, is also\ncalled fixnum.\n\nThe type (integer 0 1) is also called bit.  The type (integer 0 *) is also\ncalled unsigned-byte.\n\n"
}