{
    "name": "keywordp",
    "prev": "symbolp",
    "next": "make-symbol",
    "up": "Symbols Dictionary",
    "header": {
        "type": "Function",
        "text": "keywordp"
    },
    "sections": [
        {
            "type": "Syntax",
            "defs": [
                {
                    "name": "keywordp",
                    "text": " object =>  generalized-boolean\n"
                }
            ],
            "text": ""
        },
        {
            "type": "Arguments and Values",
            "text": "",
            "values": [
                {
                    "name": "object",
                    "desc": "an object."
                },
                {
                    "name": "generalized-boolean",
                    "desc": "a generalized boolean."
                }
            ]
        },
        {
            "type": "Description",
            "text": "Returns true if object is a keyword_1; otherwise, returns false.\n"
        },
        {
            "type": "Examples",
            "text": "      (keywordp 'elephant) =>  false\n      (keywordp 12) =>  false\n      (keywordp :test) =>  true\n      (keywordp ':test) =>  true\n      (keywordp nil) =>  false\n      (keywordp :nil) =>  true\n      (keywordp '(:test)) =>  false\n      (keywordp \"hello\") =>  false\n      (keywordp \":hello\") =>  false\n      (keywordp '&optional) =>  false\n"
        },
        {
            "type": "See Also",
            "text": "*Note constantp:: , *Note keyword:: , *Note symbolp:: , *Note\nsymbol-package::\n"
        }
    ],
    "_otext": "File: gcl.info,  Node: keywordp,  Next: make-symbol,  Prev: symbolp,  Up: Symbols Dictionary\n\nkeywordp                                                         [Function]\n---------------------------------------------------------------------------\n\n`keywordp'  object =>  generalized-boolean\n\nArguments and Values::\n......................\n\nobject--an object.\n\ngeneralized-boolean--a generalized boolean.\n\nDescription::\n.............\n\nReturns true if object is a keyword_1; otherwise, returns false.\n\nExamples::\n..........\n\n      (keywordp 'elephant) =>  false\n      (keywordp 12) =>  false\n      (keywordp :test) =>  true\n      (keywordp ':test) =>  true\n      (keywordp nil) =>  false\n      (keywordp :nil) =>  true\n      (keywordp '(:test)) =>  false\n      (keywordp \"hello\") =>  false\n      (keywordp \":hello\") =>  false\n      (keywordp '&optional) =>  false\n\nSee Also::\n..........\n\n*Note constantp:: , *Note keyword:: , *Note symbolp:: , *Note\nsymbol-package::\n\n"
}