{
    "name": "log",
    "prev": "lcm",
    "next": "mod",
    "up": "Numbers Dictionary",
    "header": {
        "type": "Function",
        "text": "log"
    },
    "sections": [
        {
            "type": "Syntax",
            "defs": [
                {
                    "name": "log",
                    "text": " number &optional base =>  logarithm\n"
                }
            ],
            "text": ""
        },
        {
            "type": "Arguments and Values",
            "text": "",
            "values": [
                {
                    "name": "number",
                    "desc": "a non-zero number."
                },
                {
                    "name": "base",
                    "desc": "a number."
                },
                {
                    "name": "logarithm",
                    "desc": "a number."
                }
            ]
        },
        {
            "type": "Description",
            "text": "log returns the logarithm of number in base base.  If base is not supplied\nits value is e, the base of the natural logarithms.\nlog may return a complex when given a\nreal\nnegative number.\n      (log -1.0) == (complex 0.0 (float pi 0.0))\nIf base is zero, log returns zero.\nThe result of (log 8 2) may be either 3 or 3.0, depending on the\nimplementation. An implementation can use floating-point calculations even\nif an exact integer result is possible.\nThe branch cut for the logarithm function of one argument (natural\nlogarithm) lies along the negative real axis, continuous with quadrant II.\nThe domain excludes the origin.\nThe mathematical definition of a complex logarithm is as follows, whether\nor not minus zero is supported by the implementation:\n     (log x) == (complex (log (abs x)) (phase x))\nTherefore the range of the one-argument logarithm function is that strip\nof the complex plane containing numbers with imaginary parts between\n-\\pi (exclusive) and~\\pi (inclusive) if minus zero is not supported, or\n-\\pi (inclusive) and~\\pi (inclusive) if minus zero is supported.\nThe two-argument logarithm function is defined as\n      (log base number)\n      == (/ (log number) (log base))\nThis defines the principal values precisely.  The range of the\ntwo-argument logarithm function is the entire complex plane.\n"
        },
        {
            "type": "Examples",
            "text": "      (log 100 10)\n     =>  2.0\n     =>  2\n      (log 100.0 10) =>  2.0\n      (log #c(0 1) #c(0 -1))\n     =>  #C(-1.0 0.0)\n     OR=> #C(-1 0)\n      (log 8.0 2) =>  3.0\n      (log #c(-16 16) #c(2 2)) =>  3 or approximately #c(3.0 0.0)\n                                    or approximately 3.0 (unlikely)\n"
        },
        {
            "type": "Affected By",
            "text": "The implementation.\n"
        },
        {
            "type": "See Also",
            "text": "*Note exp; expt:: , expt, *Note Rule of Float Substitutability::\n"
        }
    ],
    "_otext": "File: gcl.info,  Node: log,  Next: mod,  Prev: lcm,  Up: Numbers Dictionary\n\nlog                                                              [Function]\n---------------------------------------------------------------------------\n\n`log'  number &optional base =>  logarithm\n\nArguments and Values::\n......................\n\nnumber--a non-zero number.\n\nbase--a number.\n\nlogarithm--a number.\n\nDescription::\n.............\n\nlog returns the logarithm of number in base base.  If base is not supplied\nits value is e, the base of the natural logarithms.\n\nlog may return a complex when given a\n\nreal\n\nnegative number.\n\n      (log -1.0) == (complex 0.0 (float pi 0.0))\n\nIf base is zero, log returns zero.\n\nThe result of (log 8 2) may be either 3 or 3.0, depending on the\nimplementation. An implementation can use floating-point calculations even\nif an exact integer result is possible.\n\nThe branch cut for the logarithm function of one argument (natural\nlogarithm) lies along the negative real axis, continuous with quadrant II.\nThe domain excludes the origin.\n\nThe mathematical definition of a complex logarithm is as follows, whether\nor not minus zero is supported by the implementation:\n\n     (log x) == (complex (log (abs x)) (phase x))\n\nTherefore the range of the one-argument logarithm function is that strip\nof the complex plane containing numbers with imaginary parts between\n\n-\\pi (exclusive) and~\\pi (inclusive) if minus zero is not supported, or\n-\\pi (inclusive) and~\\pi (inclusive) if minus zero is supported.\n\nThe two-argument logarithm function is defined as\n\n      (log base number)\n      == (/ (log number) (log base))\n\nThis defines the principal values precisely.  The range of the\ntwo-argument logarithm function is the entire complex plane.\n\nExamples::\n..........\n\n      (log 100 10)\n     =>  2.0\n     =>  2\n      (log 100.0 10) =>  2.0\n      (log #c(0 1) #c(0 -1))\n     =>  #C(-1.0 0.0)\n     OR=> #C(-1 0)\n      (log 8.0 2) =>  3.0\n\n      (log #c(-16 16) #c(2 2)) =>  3 or approximately #c(3.0 0.0)\n                                    or approximately 3.0 (unlikely)\n\nAffected By::\n.............\n\nThe implementation.\n\nSee Also::\n..........\n\n*Note exp; expt:: , expt, *Note Rule of Float Substitutability::\n\n"
}