{
    "name": "logical-pathname",
    "prev": "logical-pathname-translations",
    "next": "*default-pathname-defaults*",
    "up": "Filenames Dictionary",
    "header": {
        "type": "Function",
        "text": "logical-pathname"
    },
    "sections": [
        {
            "type": "Syntax",
            "defs": [
                {
                    "name": "logical-pathname",
                    "text": " pathspec =>  logical-pathname\n"
                }
            ],
            "text": ""
        },
        {
            "type": "Arguments and Values",
            "text": "",
            "values": [
                {
                    "name": "pathspec",
                    "desc": "a logical pathname, a logical pathname namestring, or a stream."
                },
                {
                    "name": "logical-pathname",
                    "desc": "a logical pathname."
                }
            ]
        },
        {
            "type": "Description",
            "text": "logical-pathname converts pathspec to a logical pathname and returns the\nnew logical pathname.  If pathspec is a logical pathname namestring, it\nshould contain a host component and its following colon.  If pathspec is a\nstream, it should be one for which pathname returns a logical pathname.\nIf pathspec is a stream, the stream can be either open or closed.\nlogical-pathname returns the same logical pathname after a file is closed\nas it did when the file was open.\nIt is an error if pathspec is a stream that is created with\nmake-two-way-stream, make-echo-stream, make-broadcast-stream,\nmake-concatenated-stream, make-string-input-stream, or\nmake-string-output-stream.\n"
        },
        {
            "type": "Exceptional Situations",
            "text": "Signals an error of type type-error if pathspec isn't supplied correctly.\n"
        },
        {
            "type": "See Also",
            "text": "logical-pathname, *Note translate-logical-pathname:: , *Note Logical\nPathnames::\n"
        }
    ],
    "_otext": "File: gcl.info,  Node: logical-pathname,  Next: *default-pathname-defaults*,  Prev: logical-pathname-translations,  Up: Filenames Dictionary\n\nlogical-pathname                                                 [Function]\n---------------------------------------------------------------------------\n\n`logical-pathname'  pathspec =>  logical-pathname\n\nArguments and Values::\n......................\n\npathspec--a logical pathname, a logical pathname namestring, or a stream.\n\nlogical-pathname--a logical pathname.\n\nDescription::\n.............\n\nlogical-pathname converts pathspec to a logical pathname and returns the\nnew logical pathname.  If pathspec is a logical pathname namestring, it\nshould contain a host component and its following colon.  If pathspec is a\nstream, it should be one for which pathname returns a logical pathname.\n\nIf pathspec is a stream, the stream can be either open or closed.\nlogical-pathname returns the same logical pathname after a file is closed\nas it did when the file was open.\n\nIt is an error if pathspec is a stream that is created with\nmake-two-way-stream, make-echo-stream, make-broadcast-stream,\nmake-concatenated-stream, make-string-input-stream, or\nmake-string-output-stream.\n\nExceptional Situations::\n........................\n\nSignals an error of type type-error if pathspec isn't supplied correctly.\n\nSee Also::\n..........\n\nlogical-pathname, *Note translate-logical-pathname:: , *Note Logical\nPathnames::\n\n"
}