{
    "name": "machine-type",
    "prev": "machine-instance",
    "next": "machine-version",
    "up": "Environment Dictionary",
    "header": {
        "type": "Function",
        "text": "machine-type"
    },
    "sections": [
        {
            "type": "Syntax",
            "defs": [
                {
                    "name": "machine-type",
                    "text": " <no arguments> =>  description\n"
                }
            ],
            "text": ""
        },
        {
            "type": "Arguments and Values",
            "text": "",
            "values": [
                {
                    "name": "description",
                    "desc": "a string or nil."
                }
            ]
        },
        {
            "type": "Description",
            "text": "Returns a string that identifies the generic name of the computer hardware\non which Common Lisp is running.\n"
        },
        {
            "type": "Examples",
            "text": "      (machine-type)\n     =>  \"DEC PDP-10\"\n     OR=> \"Symbolics LM-2\"\n"
        },
        {
            "type": "Affected By",
            "text": "The machine type.  The implementation.\n"
        },
        {
            "type": "See Also",
            "text": "*Note machine-version::\n"
        }
    ],
    "_otext": "File: gcl.info,  Node: machine-type,  Next: machine-version,  Prev: machine-instance,  Up: Environment Dictionary\n\nmachine-type                                                     [Function]\n---------------------------------------------------------------------------\n\n`machine-type'  <no arguments> =>  description\n\nArguments and Values::\n......................\n\ndescription--a string or nil.\n\nDescription::\n.............\n\nReturns a string that identifies the generic name of the computer hardware\non which Common Lisp is running.\n\nExamples::\n..........\n\n      (machine-type)\n     =>  \"DEC PDP-10\"\n     OR=> \"Symbolics LM-2\"\n\nAffected By::\n.............\n\nThe machine type.  The implementation.\n\nSee Also::\n..........\n\n*Note machine-version::\n\n"
}