{
    "name": "machine-version",
    "prev": "machine-type",
    "next": "software-type",
    "up": "Environment Dictionary",
    "header": {
        "type": "Function",
        "text": "machine-version"
    },
    "sections": [
        {
            "type": "Syntax",
            "defs": [
                {
                    "name": "machine-version",
                    "text": " <no arguments> =>  description\n"
                }
            ],
            "text": ""
        },
        {
            "type": "Arguments and Values",
            "text": "",
            "values": [
                {
                    "name": "description",
                    "desc": "a string or nil."
                }
            ]
        },
        {
            "type": "Description",
            "text": "Returns a string that identifies the version of the computer hardware on\nwhich Common Lisp is running, or nil if no such value can be computed.\n"
        },
        {
            "type": "Examples",
            "text": "      (machine-version) =>  \"KL-10, microcode 9\"\n"
        },
        {
            "type": "Affected By",
            "text": "The machine version, and the implementation.\n"
        },
        {
            "type": "See Also",
            "text": "*Note machine-type:: , *Note machine-instance::\n"
        }
    ],
    "_otext": "File: gcl.info,  Node: machine-version,  Next: software-type,  Prev: machine-type,  Up: Environment Dictionary\n\nmachine-version                                                  [Function]\n---------------------------------------------------------------------------\n\n`machine-version'  <no arguments> =>  description\n\nArguments and Values::\n......................\n\ndescription--a string or nil.\n\nDescription::\n.............\n\nReturns a string that identifies the version of the computer hardware on\nwhich Common Lisp is running, or nil if no such value can be computed.\n\nExamples::\n..........\n\n      (machine-version) =>  \"KL-10, microcode 9\"\n\nAffected By::\n.............\n\nThe machine version, and the implementation.\n\nSee Also::\n..........\n\n*Note machine-type:: , *Note machine-instance::\n\n"
}