{
    "name": "make-dispatch-macro-character",
    "prev": "copy-readtable",
    "next": "read",
    "up": "Reader Dictionary",
    "header": {
        "type": "Function",
        "text": "make-dispatch-macro-character"
    },
    "sections": [
        {
            "type": "Syntax",
            "defs": [
                {
                    "name": "make-dispatch-macro-character",
                    "text": " char &optional non-terminating-preadtable =>  t\n\n"
                }
            ],
            "text": ""
        },
        {
            "type": "Arguments and Values",
            "text": "",
            "values": [
                {
                    "name": "char",
                    "desc": "a character."
                },
                {
                    "name": "non-terminating-p",
                    "desc": "a generalized boolean.  The default is false."
                },
                {
                    "name": "readtable",
                    "desc": "a readtable.  The default is the current readtable."
                }
            ]
        },
        {
            "type": "Description",
            "text": "make-dispatch-macro-character makes char be a dispatching macro character\nin readtable.\nInitially, every character in the dispatch table associated with the char\nhas an associated function that signals an error of type reader-error.\nIf non-terminating-p is true, the dispatching macro character is made a\nnon-terminating macro character; if non-terminating-p is false, the\ndispatching macro character is made a terminating macro character.\n"
        },
        {
            "type": "Examples",
            "text": "      (get-macro-character #\\{) =>  NIL, false\n      (make-dispatch-macro-character #\\{) =>  T\n      (not (get-macro-character #\\{)) =>  false\nThe readtable is altered.\n"
        },
        {
            "type": "See Also",
            "text": "*Note readtable:: , *Note set-dispatch-macro-character;\nget-dispatch-macro-character::\n"
        }
    ],
    "_otext": "File: gcl.info,  Node: make-dispatch-macro-character,  Next: read,  Prev: copy-readtable,  Up: Reader Dictionary\n\nmake-dispatch-macro-character                                    [Function]\n---------------------------------------------------------------------------\n\n`make-dispatch-macro-character'  char &optional non-terminating-p\nreadtable =>  t\n\nArguments and Values::\n......................\n\nchar--a character.\n\nnon-terminating-p--a generalized boolean.  The default is false.\n\nreadtable--a readtable.  The default is the current readtable.\n\nDescription::\n.............\n\nmake-dispatch-macro-character makes char be a dispatching macro character\nin readtable.\n\nInitially, every character in the dispatch table associated with the char\nhas an associated function that signals an error of type reader-error.\n\nIf non-terminating-p is true, the dispatching macro character is made a\nnon-terminating macro character; if non-terminating-p is false, the\ndispatching macro character is made a terminating macro character.\n\nExamples::\n..........\n\n      (get-macro-character #\\{) =>  NIL, false\n      (make-dispatch-macro-character #\\{) =>  T\n      (not (get-macro-character #\\{)) =>  false\n\nThe readtable is altered.\n\nSee Also::\n..........\n\n*Note readtable:: , *Note set-dispatch-macro-character;\nget-dispatch-macro-character::\n\n"
}