{
    "name": "mod",
    "prev": "log",
    "next": "signum",
    "up": "Numbers Dictionary",
    "header": {
        "type": "Function",
        "text": "mod, rem"
    },
    "sections": [
        {
            "type": "Syntax",
            "defs": [
                {
                    "name": "mod",
                    "text": " number divisor =>  modulus\n"
                },
                {
                    "name": "rem",
                    "text": " number divisor =>  remainder\n\n"
                }
            ],
            "text": ""
        },
        {
            "type": "Arguments and Values",
            "text": "",
            "values": [
                {
                    "name": "number",
                    "desc": "a real."
                },
                {
                    "name": "divisor",
                    "desc": "a real."
                },
                {
                    "name": "modulus, remainder",
                    "desc": "a real."
                }
            ]
        },
        {
            "type": "Description",
            "text": "mod and rem are generalizations of the modulus and remainder functions\nrespectively.\nmod performs the operation floor on number and divisor and returns the\nremainder of the floor operation.\nrem performs the operation truncate on number and divisor and returns the\nremainder of the truncate operation.\nmod and rem are the modulus and remainder functions when number and\ndivisor are integers.\n"
        },
        {
            "type": "Examples",
            "text": "      (rem -1 5) =>  -1\n      (mod -1 5) =>  4\n      (mod 13 4) =>  1\n      (rem 13 4) =>  1\n      (mod -13 4) =>  3\n      (rem -13 4) =>  -1\n      (mod 13 -4) =>  -3\n      (rem 13 -4) =>  1\n      (mod -13 -4) =>  -1\n      (rem -13 -4) =>  -1\n      (mod 13.4 1) =>  0.4\n      (rem 13.4 1) =>  0.4\n      (mod -13.4 1) =>  0.6\n      (rem -13.4 1) =>  -0.4\n"
        },
        {
            "type": "See Also",
            "text": "*Note floor; ffloor; ceiling; fceiling; truncate; ftruncate; round;\nfround:: , truncate\n"
        },
        {
            "type": "Notes",
            "text": "The result of mod is either zero or a\nreal\nwith the same sign as divisor.\n"
        }
    ],
    "_otext": "File: gcl.info,  Node: mod,  Next: signum,  Prev: log,  Up: Numbers Dictionary\n\nmod, rem                                                         [Function]\n---------------------------------------------------------------------------\n\n`mod'  number divisor =>  modulus\n\n`rem'  number divisor =>  remainder\n\nArguments and Values::\n......................\n\nnumber--a real.\n\ndivisor--a real.\n\nmodulus, remainder--a real.\n\nDescription::\n.............\n\nmod and rem are generalizations of the modulus and remainder functions\nrespectively.\n\nmod performs the operation floor on number and divisor and returns the\nremainder of the floor operation.\n\nrem performs the operation truncate on number and divisor and returns the\nremainder of the truncate operation.\n\nmod and rem are the modulus and remainder functions when number and\ndivisor are integers.\n\nExamples::\n..........\n\n      (rem -1 5) =>  -1\n      (mod -1 5) =>  4\n      (mod 13 4) =>  1\n      (rem 13 4) =>  1\n      (mod -13 4) =>  3\n      (rem -13 4) =>  -1\n      (mod 13 -4) =>  -3\n      (rem 13 -4) =>  1\n      (mod -13 -4) =>  -1\n      (rem -13 -4) =>  -1\n      (mod 13.4 1) =>  0.4\n      (rem 13.4 1) =>  0.4\n      (mod -13.4 1) =>  0.6\n      (rem -13.4 1) =>  -0.4\n\nSee Also::\n..........\n\n*Note floor; ffloor; ceiling; fceiling; truncate; ftruncate; round;\nfround:: , truncate\n\nNotes::\n.......\n\nThe result of mod is either zero or a\n\nreal\n\nwith the same sign as divisor.\n\n"
}