{
    "name": "no-applicable-method",
    "prev": "method-qualifiers",
    "next": "no-next-method",
    "up": "Objects Dictionary",
    "header": {
        "type": "Standard Generic Function",
        "text": "no-applicable-method"
    },
    "sections": [
        {
            "type": "",
            "text": ""
        },
        {
            "type": "Syntax",
            "defs": [
                {
                    "name": "no-applicable-method",
                    "text": " generic-function &rest function-arguments =>{result}*\n\n"
                }
            ],
            "text": ""
        },
        {
            "type": "Syntax",
            "defs": [
                {
                    "name": "no-applicable-method",
                    "text": " (generic-function t) &rest function-arguments\n"
                }
            ],
            "text": ""
        },
        {
            "type": "Arguments and Values",
            "text": "",
            "values": [
                {
                    "name": "generic-function",
                    "desc": "a generic function on which no applicable method was"
                },
                {
                    "name": "generic-function",
                    "desc": "a generic function on which no applicable method wasfound.\n"
                },
                {
                    "name": "function-arguments",
                    "desc": "arguments to the generic-function."
                },
                {
                    "name": "result",
                    "desc": "an object."
                }
            ]
        },
        {
            "type": "Description",
            "text": "The generic function no-applicable-method is called when a generic function\nis invoked and no method on that generic function is applicable.  The\ndefault method signals an error.\nThe generic function no-applicable-method is not intended to be called by\nprogrammers.  Programmers may write methods for it.\n"
        },
        {
            "type": "Exceptional Situations",
            "text": "The default method signals an error of type error.\n"
        },
        {
            "type": "See Also",
            "text": ""
        }
    ],
    "_otext": "File: gcl.info,  Node: no-applicable-method,  Next: no-next-method,  Prev: method-qualifiers,  Up: Objects Dictionary\n\nno-applicable-method                            [Standard Generic Function]\n---------------------------------------------------------------------------\n\nSyntax::\n........\n\n`no-applicable-method'  generic-function &rest function-arguments =>\n{result}*\n\nMethod Signatures::\n...................\n\n`no-applicable-method'  (generic-function t) &rest function-arguments\n\nArguments and Values::\n......................\n\ngeneric-function--a generic function on which no applicable method was\nfound.\n\nfunction-arguments--arguments to the generic-function.\n\nresult--an object.\n\nDescription::\n.............\n\nThe generic function no-applicable-method is called when a generic function\nis invoked and no method on that generic function is applicable.  The\ndefault method signals an error.\n\nThe generic function no-applicable-method is not intended to be called by\nprogrammers.  Programmers may write methods for it.\n\nExceptional Situations::\n........................\n\nThe default method signals an error of type error.\n\nSee Also::\n..........\n\n"
}