{
    "name": "no-next-method",
    "prev": "no-applicable-method",
    "next": "remove-method",
    "up": "Objects Dictionary",
    "header": {
        "type": "Standard Generic Function",
        "text": "no-next-method"
    },
    "sections": [
        {
            "type": "",
            "text": ""
        },
        {
            "type": "Syntax",
            "defs": [
                {
                    "name": "no-next-method",
                    "text": " generic-function method &rest args =>  {result}*\n"
                }
            ],
            "text": ""
        },
        {
            "type": "Syntax",
            "defs": [
                {
                    "name": "no-next-method",
                    "text": " (generic-function standard-generic-function) (methodstandard-method) &rest args\n\n"
                }
            ],
            "text": ""
        },
        {
            "type": "Arguments and Values",
            "text": "",
            "values": [
                {
                    "name": "result",
                    "desc": "an object."
                }
            ]
        },
        {
            "type": "Description",
            "text": "The generic function no-next-method is called by call-next-method when\nthere is no next method.\nThe generic function no-next-method is not intended to be called by\nprogrammers.  Programmers may write methods for it.\n"
        },
        {
            "type": "Exceptional Situations",
            "text": "The system-supplied method on no-next-method signals an error of type\nerror.  [Editorial Note by KMP: perhaps control-error??]\n"
        },
        {
            "type": "See Also",
            "text": "*Note call-next-method::\n"
        }
    ],
    "_otext": "File: gcl.info,  Node: no-next-method,  Next: remove-method,  Prev: no-applicable-method,  Up: Objects Dictionary\n\nno-next-method                                  [Standard Generic Function]\n---------------------------------------------------------------------------\n\nSyntax::\n........\n\n`no-next-method'  generic-function method &rest args =>  {result}*\n\nMethod Signatures::\n...................\n\n`no-next-method'  (generic-function standard-generic-function) (method\nstandard-method) &rest args\n\nArguments and Values::\n......................\n\ngeneric-function - generic function to which method belongs.\n\nmethod - method that contained the call to call-next-method for which\nthere is no next method.\n\nargs - arguments to call-next-method.\n\nresult--an object.\n\nDescription::\n.............\n\nThe generic function no-next-method is called by call-next-method when\nthere is no next method.\n\nThe generic function no-next-method is not intended to be called by\nprogrammers.  Programmers may write methods for it.\n\nExceptional Situations::\n........................\n\nThe system-supplied method on no-next-method signals an error of type\nerror.  [Editorial Note by KMP: perhaps control-error??]\n\nSee Also::\n..........\n\n*Note call-next-method::\n\n"
}