{
    "name": "numerator",
    "prev": "realp",
    "next": "rational",
    "up": "Numbers Dictionary",
    "header": {
        "type": "Function",
        "text": "numerator, denominator"
    },
    "sections": [
        {
            "type": "Syntax",
            "defs": [
                {
                    "name": "numerator",
                    "text": " rational =>  numerator\n"
                },
                {
                    "name": "denominator",
                    "text": " rational =>  denominator\n\n"
                }
            ],
            "text": ""
        },
        {
            "type": "Arguments and Values",
            "text": "",
            "values": [
                {
                    "name": "rational",
                    "desc": "a rational."
                },
                {
                    "name": "numerator",
                    "desc": "an integer."
                },
                {
                    "name": "denominator",
                    "desc": "a positive integer."
                }
            ]
        },
        {
            "type": "Description",
            "text": "numerator and denominator reduce rational to canonical form and compute\nthe numerator or denominator of that number.\nnumerator and denominator return the numerator or denominator of the\ncanonical form of rational.\nIf rational is an integer, numerator returns rational and denominator\nreturns 1.\n"
        },
        {
            "type": "Examples",
            "text": "      (numerator 1/2) =>  1\n      (denominator 12/36) =>  3\n      (numerator -1) =>  -1\n      (denominator (/ -33)) =>  33\n      (numerator (/ 8 -6)) =>  -4\n      (denominator (/ 8 -6)) =>  3\n"
        },
        {
            "type": "See Also",
            "text": "*Note /::\n"
        },
        {
            "type": "Notes",
            "text": "      (gcd (numerator x) (denominator x)) =>  1\n"
        }
    ],
    "_otext": "File: gcl.info,  Node: numerator,  Next: rational,  Prev: realp,  Up: Numbers Dictionary\n\nnumerator, denominator                                           [Function]\n---------------------------------------------------------------------------\n\n`numerator'  rational =>  numerator\n\n`denominator'  rational =>  denominator\n\nArguments and Values::\n......................\n\nrational--a rational.\n\nnumerator--an integer.\n\ndenominator--a positive integer.\n\nDescription::\n.............\n\nnumerator and denominator reduce rational to canonical form and compute\nthe numerator or denominator of that number.\n\nnumerator and denominator return the numerator or denominator of the\ncanonical form of rational.\n\nIf rational is an integer, numerator returns rational and denominator\nreturns 1.\n\nExamples::\n..........\n\n      (numerator 1/2) =>  1\n      (denominator 12/36) =>  3\n      (numerator -1) =>  -1\n      (denominator (/ -33)) =>  33\n      (numerator (/ 8 -6)) =>  -4\n      (denominator (/ 8 -6)) =>  3\n\nSee Also::\n..........\n\n*Note /::\n\nNotes::\n.......\n\n      (gcd (numerator x) (denominator x)) =>  1\n\n"
}