{
    "name": "open-stream-p",
    "prev": "interactive-stream-p",
    "next": "stream-element-type",
    "up": "Streams Dictionary",
    "header": {
        "type": "Function",
        "text": "open-stream-p"
    },
    "sections": [
        {
            "type": "Syntax",
            "defs": [
                {
                    "name": "open-stream-p",
                    "text": " stream =>  generalized-boolean\n"
                }
            ],
            "text": ""
        },
        {
            "type": "Arguments and Values",
            "text": "",
            "values": [
                {
                    "name": "stream",
                    "desc": "a stream."
                },
                {
                    "name": "generalized-boolean",
                    "desc": "a generalized boolean."
                }
            ]
        },
        {
            "type": "Description",
            "text": "Returns true if stream is an open stream; otherwise, returns false.\nStreams are open until they have been explicitly closed with close, or\nuntil they are implicitly closed due to exit from a with-output-to-string,\nwith-open-file, with-input-from-string,  or with-open-stream form.\n"
        },
        {
            "type": "Examples",
            "text": "      (open-stream-p *standard-input*) =>  true\n"
        },
        {
            "type": "Affected By",
            "text": "close.\n"
        },
        {
            "type": "Exceptional Situations",
            "text": "Should signal an error of type type-error if stream is not a stream.\n"
        }
    ],
    "_otext": "File: gcl.info,  Node: open-stream-p,  Next: stream-element-type,  Prev: interactive-stream-p,  Up: Streams Dictionary\n\nopen-stream-p                                                    [Function]\n---------------------------------------------------------------------------\n\n`open-stream-p'  stream =>  generalized-boolean\n\nArguments and Values::\n......................\n\nstream--a stream.\n\ngeneralized-boolean--a generalized boolean.\n\nDescription::\n.............\n\nReturns true if stream is an open stream; otherwise, returns false.\n\nStreams are open until they have been explicitly closed with close, or\nuntil they are implicitly closed due to exit from a with-output-to-string,\nwith-open-file, with-input-from-string,  or with-open-stream form.\n\nExamples::\n..........\n\n      (open-stream-p *standard-input*) =>  true\n\nAffected By::\n.............\n\nclose.\n\nExceptional Situations::\n........................\n\nShould signal an error of type type-error if stream is not a stream.\n\n"
}