{
    "name": "package-error",
    "prev": "*package*",
    "next": "package-error-package",
    "up": "Packages Dictionary",
    "header": {
        "type": "Condition Type",
        "text": "package-error"
    },
    "sections": [
        {
            "type": "",
            "text": ""
        },
        {
            "type": "Class Precedence List",
            "text": "",
            "items": [
                {
                    "name": "package-error",
                    "link": "package-error"
                },
                {
                    "name": " error",
                    "link": null
                },
                {
                    "name": " serious-condition",
                    "link": null
                },
                {
                    "name": " condition",
                    "link": null
                },
                {
                    "name": " t",
                    "link": null
                }
            ]
        },
        {
            "type": "Description",
            "text": "The type package-error consists of error conditions related to operations\non packages.  The offending package (or package name) is initialized by\nthe :package initialization argument to make-condition, and is accessed by\nthe function package-error-package.\n"
        },
        {
            "type": "See Also",
            "text": "*Note package-error-package:: , *Note Conditions::\n"
        }
    ],
    "_otext": "File: gcl.info,  Node: package-error,  Next: package-error-package,  Prev: *package*,  Up: Packages Dictionary\n\npackage-error                                              [Condition Type]\n---------------------------------------------------------------------------\n\nClass Precedence List::\n.......................\n\npackage-error, error, serious-condition, condition, t\n\nDescription::\n.............\n\nThe type package-error consists of error conditions related to operations\non packages.  The offending package (or package name) is initialized by\nthe :package initialization argument to make-condition, and is accessed by\nthe function package-error-package.\n\nSee Also::\n..........\n\n*Note package-error-package:: , *Note Conditions::\n\n"
}