{
    "name": "package-nicknames",
    "prev": "package-name",
    "next": "package-shadowing-symbols",
    "up": "Packages Dictionary",
    "header": {
        "type": "Function",
        "text": "package-nicknames"
    },
    "sections": [
        {
            "type": "Syntax",
            "defs": [
                {
                    "name": "package-nicknames",
                    "text": " package =>  nicknames\n"
                }
            ],
            "text": ""
        },
        {
            "type": "Arguments and Values",
            "text": "",
            "values": [
                {
                    "name": "package",
                    "desc": "a package designator."
                },
                {
                    "name": "nicknames",
                    "desc": "a list of strings."
                }
            ]
        },
        {
            "type": "Description",
            "text": "Returns the list of nickname strings for package, not including the name\nof package.\n"
        },
        {
            "type": "Examples",
            "text": "      (package-nicknames (make-package 'temporary\n                                        :nicknames '(\"TEMP\" \"temp\")))\n     =>  (\"temp\" \"TEMP\")\n"
        },
        {
            "type": "Exceptional Situations",
            "text": "Should signal an error of type type-error if package is not a package\ndesignator.\n"
        }
    ],
    "_otext": "File: gcl.info,  Node: package-nicknames,  Next: package-shadowing-symbols,  Prev: package-name,  Up: Packages Dictionary\n\npackage-nicknames                                                [Function]\n---------------------------------------------------------------------------\n\n`package-nicknames'  package =>  nicknames\n\nArguments and Values::\n......................\n\npackage--a package designator.\n\nnicknames--a list of strings.\n\nDescription::\n.............\n\nReturns the list of nickname strings for package, not including the name\nof package.\n\nExamples::\n..........\n\n      (package-nicknames (make-package 'temporary\n                                        :nicknames '(\"TEMP\" \"temp\")))\n     =>  (\"temp\" \"TEMP\")\n\nExceptional Situations::\n........................\n\nShould signal an error of type type-error if package is not a package\ndesignator.\n\n"
}