{
    "name": "package-used-by-list",
    "prev": "package-use-list",
    "next": "packagep",
    "up": "Packages Dictionary",
    "header": {
        "type": "Function",
        "text": "package-used-by-list"
    },
    "sections": [
        {
            "type": "Syntax",
            "defs": [
                {
                    "name": "package-used-by-list",
                    "text": " package =>  used-by-list\n"
                }
            ],
            "text": ""
        },
        {
            "type": "Arguments and Values",
            "text": "",
            "values": [
                {
                    "name": "package",
                    "desc": "a package designator."
                },
                {
                    "name": "used-by-list",
                    "desc": "a list of package objects."
                }
            ]
        },
        {
            "type": "Description",
            "text": "package-used-by-list returns a list of other packages that use package.\n"
        },
        {
            "type": "Examples",
            "text": "      (package-used-by-list (make-package 'temp)) =>  ()\n      (make-package 'trash :use '(temp)) =>  #<PACKAGE \"TRASH\">\n      (package-used-by-list 'temp) =>  (#<PACKAGE \"TRASH\">)\n"
        },
        {
            "type": "Exceptional Situations",
            "text": "Should signal an error of type type-error if package is not a package.\n"
        },
        {
            "type": "See Also",
            "text": "*Note use-package:: , *Note unuse-package::\n"
        }
    ],
    "_otext": "File: gcl.info,  Node: package-used-by-list,  Next: packagep,  Prev: package-use-list,  Up: Packages Dictionary\n\npackage-used-by-list                                             [Function]\n---------------------------------------------------------------------------\n\n`package-used-by-list'  package =>  used-by-list\n\nArguments and Values::\n......................\n\npackage--a package designator.\n\nused-by-list--a list of package objects.\n\nDescription::\n.............\n\npackage-used-by-list returns a list of other packages that use package.\n\nExamples::\n..........\n\n      (package-used-by-list (make-package 'temp)) =>  ()\n      (make-package 'trash :use '(temp)) =>  #<PACKAGE \"TRASH\">\n      (package-used-by-list 'temp) =>  (#<PACKAGE \"TRASH\">)\n\nExceptional Situations::\n........................\n\nShould signal an error of type type-error if package is not a package.\n\nSee Also::\n..........\n\n*Note use-package:: , *Note unuse-package::\n\n"
}