{
    "name": "packagep",
    "prev": "package-used-by-list",
    "next": "*package*",
    "up": "Packages Dictionary",
    "header": {
        "type": "Function",
        "text": "packagep"
    },
    "sections": [
        {
            "type": "Syntax",
            "defs": [
                {
                    "name": "packagep",
                    "text": " object =>  generalized-boolean\n"
                }
            ],
            "text": ""
        },
        {
            "type": "Arguments and Values",
            "text": "",
            "values": [
                {
                    "name": "object",
                    "desc": "an object."
                },
                {
                    "name": "generalized-boolean",
                    "desc": "a generalized boolean."
                }
            ]
        },
        {
            "type": "Description",
            "text": "Returns true if object is of type package; otherwise, returns false.\n"
        },
        {
            "type": "Examples",
            "text": "      (packagep *package*) =>  true\n      (packagep 'common-lisp) =>  false\n      (packagep (find-package 'common-lisp)) =>  true\n"
        },
        {
            "type": "Notes",
            "text": "      (packagep object) == (typep object 'package)\n"
        }
    ],
    "_otext": "File: gcl.info,  Node: packagep,  Next: *package*,  Prev: package-used-by-list,  Up: Packages Dictionary\n\npackagep                                                         [Function]\n---------------------------------------------------------------------------\n\n`packagep'  object =>  generalized-boolean\n\nArguments and Values::\n......................\n\nobject--an object.\n\ngeneralized-boolean--a generalized boolean.\n\nDescription::\n.............\n\nReturns true if object is of type package; otherwise, returns false.\n\nExamples::\n..........\n\n      (packagep *package*) =>  true\n      (packagep 'common-lisp) =>  false\n      (packagep (find-package 'common-lisp)) =>  true\n\nNotes::\n.......\n\n      (packagep object) == (typep object 'package)\n\n"
}