{
    "name": "pathnamep",
    "prev": "make-pathname",
    "next": "pathname-host",
    "up": "Filenames Dictionary",
    "header": {
        "type": "Function",
        "text": "pathnamep"
    },
    "sections": [
        {
            "type": "Syntax",
            "defs": [
                {
                    "name": "pathnamep",
                    "text": " object =>  generalized-boolean\n"
                }
            ],
            "text": ""
        },
        {
            "type": "Arguments and Values",
            "text": "",
            "values": [
                {
                    "name": "object",
                    "desc": "an object."
                },
                {
                    "name": "generalized-boolean",
                    "desc": "a generalized boolean."
                }
            ]
        },
        {
            "type": "Description",
            "text": "Returns true if object is of type pathname; otherwise, returns false.\n"
        },
        {
            "type": "Examples",
            "text": "      (setq q \"test\")  =>  \"test\"\n      (pathnamep q) =>  false\n      (setq q (pathname \"test\"))\n     =>  #S(PATHNAME :HOST NIL :DEVICE NIL :DIRECTORY NIL :NAME \"test\" :TYPE NIL\n            :VERSION NIL)\n      (pathnamep q) =>  true\n      (setq q (logical-pathname \"SYS:SITE;FOO.SYSTEM\"))\n     =>  #P\"SYS:SITE;FOO.SYSTEM\"\n      (pathnamep q) =>  true\n"
        },
        {
            "type": "Notes",
            "text": "      (pathnamep object) == (typep object 'pathname)\n"
        }
    ],
    "_otext": "File: gcl.info,  Node: pathnamep,  Next: pathname-host,  Prev: make-pathname,  Up: Filenames Dictionary\n\npathnamep                                                        [Function]\n---------------------------------------------------------------------------\n\n`pathnamep'  object =>  generalized-boolean\n\nArguments and Values::\n......................\n\nobject--an object.\n\ngeneralized-boolean--a generalized boolean.\n\nDescription::\n.............\n\nReturns true if object is of type pathname; otherwise, returns false.\n\nExamples::\n..........\n\n      (setq q \"test\")  =>  \"test\"\n      (pathnamep q) =>  false\n      (setq q (pathname \"test\"))\n     =>  #S(PATHNAME :HOST NIL :DEVICE NIL :DIRECTORY NIL :NAME \"test\" :TYPE NIL\n            :VERSION NIL)\n      (pathnamep q) =>  true\n      (setq q (logical-pathname \"SYS:SITE;FOO.SYSTEM\"))\n     =>  #P\"SYS:SITE;FOO.SYSTEM\"\n      (pathnamep q) =>  true\n\nNotes::\n.......\n\n      (pathnamep object) == (typep object 'pathname)\n\n"
}