{
    "name": "phase",
    "prev": "conjugate",
    "next": "realpart",
    "up": "Numbers Dictionary",
    "header": {
        "type": "Function",
        "text": "phase"
    },
    "sections": [
        {
            "type": "Syntax",
            "defs": [
                {
                    "name": "phase",
                    "text": " number =>  phase\n"
                }
            ],
            "text": ""
        },
        {
            "type": "Arguments and Values",
            "text": "",
            "values": [
                {
                    "name": "number",
                    "desc": "a number."
                },
                {
                    "name": "phase",
                    "desc": "a number."
                }
            ]
        },
        {
            "type": "Description",
            "text": "phase returns the phase of number (the angle part of its polar\nrepresentation) in radians, in the range\n-\\pi (exclusive) if minus zero is not supported, or -\\pi (inclusive) if\nminus zero is supported,\nto \\pi (inclusive).  The phase of a positive\nreal\nnumber is zero; that of a negative\nreal\nnumber is \\pi.  The phase of zero is defined to be zero.\nIf number is a complex float, the result is a float of the same type as\nthe components of number.  If number is a float, the result is a float of\nthe same type.  If number is a rational or a complex rational, the result\nis a single float.\nThe branch cut for phase lies along the negative real axis, continuous\nwith quadrant II.  The range consists of that portion of the real axis\nbetween -\\pi (exclusive) and~\\pi (inclusive).\nThe mathematical definition of phase is as follows:\n(phase x) = (atan (imagpart x) (realpart x))\n"
        },
        {
            "type": "Examples",
            "text": "      (phase 1) =>  0.0s0\n      (phase 0) =>  0.0s0\n      (phase (cis 30)) =>  -1.4159266\n      (phase #c(0 1)) =>  1.5707964\n"
        },
        {
            "type": "Exceptional Situations",
            "text": "Should signal type-error if its argument is not a number.  Might signal\narithmetic-error.\n"
        },
        {
            "type": "See Also",
            "text": "*Note Rule of Float Substitutability::\n"
        }
    ],
    "_otext": "File: gcl.info,  Node: phase,  Next: realpart,  Prev: conjugate,  Up: Numbers Dictionary\n\nphase                                                            [Function]\n---------------------------------------------------------------------------\n\n`phase'  number =>  phase\n\nArguments and Values::\n......................\n\nnumber--a number.\n\nphase--a number.\n\nDescription::\n.............\n\nphase returns the phase of number (the angle part of its polar\nrepresentation) in radians, in the range\n\n-\\pi (exclusive) if minus zero is not supported, or -\\pi (inclusive) if\nminus zero is supported,\n\nto \\pi (inclusive).  The phase of a positive\n\nreal\n\nnumber is zero; that of a negative\n\nreal\n\nnumber is \\pi.  The phase of zero is defined to be zero.\n\nIf number is a complex float, the result is a float of the same type as\nthe components of number.  If number is a float, the result is a float of\nthe same type.  If number is a rational or a complex rational, the result\nis a single float.\n\nThe branch cut for phase lies along the negative real axis, continuous\nwith quadrant II.  The range consists of that portion of the real axis\nbetween -\\pi (exclusive) and~\\pi (inclusive).\n\nThe mathematical definition of phase is as follows:\n\n(phase x) = (atan (imagpart x) (realpart x))\n\nExamples::\n..........\n\n      (phase 1) =>  0.0s0\n      (phase 0) =>  0.0s0\n      (phase (cis 30)) =>  -1.4159266\n      (phase #c(0 1)) =>  1.5707964\n\nExceptional Situations::\n........................\n\nShould signal type-error if its argument is not a number.  Might signal\narithmetic-error.\n\nSee Also::\n..........\n\n*Note Rule of Float Substitutability::\n\n"
}