{
    "name": "print-not-readable",
    "prev": "*print-right-margin*",
    "next": "print-not-readable-object",
    "up": "Printer Dictionary",
    "header": {
        "type": "Condition Type",
        "text": "print-not-readable"
    },
    "sections": [
        {
            "type": "",
            "text": ""
        },
        {
            "type": "Class Precedence List",
            "text": "",
            "items": [
                {
                    "name": "print-not-readable",
                    "link": "print-not-readable"
                },
                {
                    "name": " error",
                    "link": null
                },
                {
                    "name": " serious-condition",
                    "link": null
                },
                {
                    "name": " condition",
                    "link": null
                },
                {
                    "name": " t",
                    "link": null
                }
            ]
        },
        {
            "type": "Description",
            "text": "The type print-not-readable consists of error conditions that occur during\noutput while *print-readably* is true, as a result of attempting to write\na printed representation with the Lisp printer that would not be correctly\nread back with the Lisp reader.  The object which could not be printed is\ninitialized by the :object initialization argument to make-condition, and\nis accessed by the function print-not-readable-object.\n"
        },
        {
            "type": "See Also",
            "text": "*Note print-not-readable-object::\n"
        }
    ],
    "_otext": "File: gcl.info,  Node: print-not-readable,  Next: print-not-readable-object,  Prev: *print-right-margin*,  Up: Printer Dictionary\n\nprint-not-readable                                         [Condition Type]\n---------------------------------------------------------------------------\n\nClass Precedence List::\n.......................\n\nprint-not-readable, error, serious-condition, condition, t\n\nDescription::\n.............\n\nThe type print-not-readable consists of error conditions that occur during\noutput while *print-readably* is true, as a result of attempting to write\na printed representation with the Lisp printer that would not be correctly\nread back with the Lisp reader.  The object which could not be printed is\ninitialized by the :object initialization argument to make-condition, and\nis accessed by the function print-not-readable-object.\n\nSee Also::\n..........\n\n*Note print-not-readable-object::\n\n"
}