{
    "name": "print-not-readable-object",
    "prev": "print-not-readable",
    "next": "format",
    "up": "Printer Dictionary",
    "header": {
        "type": "Function",
        "text": "print-not-readable-object"
    },
    "sections": [
        {
            "type": "Syntax",
            "defs": [
                {
                    "name": "print-not-readable-object",
                    "text": " condition =>  object\n"
                }
            ],
            "text": ""
        },
        {
            "type": "Arguments and Values",
            "text": "",
            "values": [
                {
                    "name": "condition",
                    "desc": "a condition of type print-not-readable."
                },
                {
                    "name": "object",
                    "desc": "an object."
                }
            ]
        },
        {
            "type": "Description",
            "text": "Returns the object that could not be printed readably in the situation\nrepresented by condition.\n"
        },
        {
            "type": "See Also",
            "text": "print-not-readable, *Note Conditions::\n"
        }
    ],
    "_otext": "File: gcl.info,  Node: print-not-readable-object,  Next: format,  Prev: print-not-readable,  Up: Printer Dictionary\n\nprint-not-readable-object                                        [Function]\n---------------------------------------------------------------------------\n\n`print-not-readable-object'  condition =>  object\n\nArguments and Values::\n......................\n\ncondition--a condition of type print-not-readable.\n\nobject--an object.\n\nDescription::\n.............\n\nReturns the object that could not be printed readably in the situation\nrepresented by condition.\n\nSee Also::\n..........\n\nprint-not-readable, *Note Conditions::\n\n"
}