{
    "name": "program-error",
    "prev": "control-error",
    "next": "undefined-function",
    "up": "Data and Control Flow Dictionary",
    "header": {
        "type": "Condition Type",
        "text": "program-error"
    },
    "sections": [
        {
            "type": "",
            "text": ""
        },
        {
            "type": "Class Precedence List",
            "text": "",
            "items": [
                {
                    "name": "program-error",
                    "link": "program-error"
                },
                {
                    "name": " error",
                    "link": null
                },
                {
                    "name": " serious-condition",
                    "link": null
                },
                {
                    "name": " condition",
                    "link": null
                },
                {
                    "name": " t",
                    "link": null
                }
            ]
        },
        {
            "type": "Description",
            "text": "The type program-error consists of error conditions related to incorrect\nprogram syntax.  The errors that result from naming a go tag or a block tag\nthat is not lexically apparent are of type program-error.\n"
        }
    ],
    "_otext": "File: gcl.info,  Node: program-error,  Next: undefined-function,  Prev: control-error,  Up: Data and Control Flow Dictionary\n\nprogram-error                                              [Condition Type]\n---------------------------------------------------------------------------\n\nClass Precedence List::\n.......................\n\nprogram-error, error, serious-condition, condition, t\n\nDescription::\n.............\n\nThe type program-error consists of error conditions related to incorrect\nprogram syntax.  The errors that result from naming a go tag or a block tag\nthat is not lexically apparent are of type program-error.\n\n"
}