{
    "name": "random-state",
    "prev": "sqrt",
    "next": "make-random-state",
    "up": "Numbers Dictionary",
    "header": {
        "type": "System Class",
        "text": "random-state"
    },
    "sections": [
        {
            "type": "",
            "text": ""
        },
        {
            "type": "Class Precedence List",
            "text": "",
            "items": [
                {
                    "name": "random-state",
                    "link": "random-state"
                },
                {
                    "name": " t",
                    "link": null
                }
            ]
        },
        {
            "type": "Description",
            "text": "A random state object contains state information used by the pseudo-random\nnumber generator.  The nature of a random state object is\nimplementation-dependent.  It can be printed out and successfully read\nback in by the same implementation, but might not function correctly as a\nrandom state in another implementation.\nImplementations are required to provide a read syntax for objects of type\nrandom-state, but the specific nature of that syntax is\nimplementation-dependent.\n"
        },
        {
            "type": "See Also",
            "text": "*Note random-state:: , *Note random:: , *Note Printing Random States::\n"
        }
    ],
    "_otext": "File: gcl.info,  Node: random-state,  Next: make-random-state,  Prev: sqrt,  Up: Numbers Dictionary\n\nrandom-state                                                 [System Class]\n---------------------------------------------------------------------------\n\nClass Precedence List::\n.......................\n\nrandom-state, t\n\nDescription::\n.............\n\nA random state object contains state information used by the pseudo-random\nnumber generator.  The nature of a random state object is\nimplementation-dependent.  It can be printed out and successfully read\nback in by the same implementation, but might not function correctly as a\nrandom state in another implementation.\n\nImplementations are required to provide a read syntax for objects of type\nrandom-state, but the specific nature of that syntax is\nimplementation-dependent.\n\nSee Also::\n..........\n\n*Note random-state:: , *Note random:: , *Note Printing Random States::\n\n"
}