{
    "name": "rationalp",
    "prev": "rational",
    "next": "ash",
    "up": "Numbers Dictionary",
    "header": {
        "type": "Function",
        "text": "rationalp"
    },
    "sections": [
        {
            "type": "Syntax",
            "defs": [
                {
                    "name": "rationalp",
                    "text": " object =>  generalized-boolean\n"
                }
            ],
            "text": ""
        },
        {
            "type": "Arguments and Values",
            "text": "",
            "values": [
                {
                    "name": "object",
                    "desc": "an object."
                },
                {
                    "name": "generalized-boolean",
                    "desc": "a generalized boolean."
                }
            ]
        },
        {
            "type": "Description",
            "text": "Returns true if object is of type rational; otherwise, returns false.\n"
        },
        {
            "type": "Examples",
            "text": "      (rationalp 12) =>  true\n      (rationalp 6/5) =>  true\n      (rationalp 1.212) =>  false\n"
        },
        {
            "type": "See Also",
            "text": "*Note rational::\n"
        },
        {
            "type": "Notes",
            "text": "      (rationalp object) == (typep object 'rational)\n"
        }
    ],
    "_otext": "File: gcl.info,  Node: rationalp,  Next: ash,  Prev: rational,  Up: Numbers Dictionary\n\nrationalp                                                        [Function]\n---------------------------------------------------------------------------\n\n`rationalp'  object =>  generalized-boolean\n\nArguments and Values::\n......................\n\nobject--an object.\n\ngeneralized-boolean--a generalized boolean.\n\nDescription::\n.............\n\nReturns true if object is of type rational; otherwise, returns false.\n\nExamples::\n..........\n\n      (rationalp 12) =>  true\n      (rationalp 6/5) =>  true\n      (rationalp 1.212) =>  false\n\nSee Also::\n..........\n\n*Note rational::\n\nNotes::\n.......\n\n      (rationalp object) == (typep object 'rational)\n\n"
}