{
    "name": "readtable",
    "prev": "Reader Dictionary",
    "next": "copy-readtable",
    "up": "Reader Dictionary",
    "header": {
        "type": "System Class",
        "text": "readtable"
    },
    "sections": [
        {
            "type": "",
            "text": ""
        },
        {
            "type": "Class Precedence List",
            "text": "",
            "items": [
                {
                    "name": "readtable",
                    "link": "readtable"
                },
                {
                    "name": " t",
                    "link": null
                }
            ]
        },
        {
            "type": "Description",
            "text": "A readtable maps characters into syntax types for the Lisp reader; see\n*Note Syntax::.  A readtable also contains associations between macro\ncharacters and their reader macro functions, and records information about\nthe case conversion rules to be used by the Lisp reader when parsing\nsymbols.\nEach simple character must be representable in the readtable.  It is\nimplementation-defined whether non-simple characters can have syntax\ndescriptions in the readtable.\n"
        },
        {
            "type": "See Also",
            "text": "*Note Readtables::, *Note Printing Other Objects::\n"
        }
    ],
    "_otext": "File: gcl.info,  Node: readtable,  Next: copy-readtable,  Prev: Reader Dictionary,  Up: Reader Dictionary\n\nreadtable                                                    [System Class]\n---------------------------------------------------------------------------\n\nClass Precedence List::\n.......................\n\nreadtable, t\n\nDescription::\n.............\n\nA readtable maps characters into syntax types for the Lisp reader; see\n*Note Syntax::.  A readtable also contains associations between macro\ncharacters and their reader macro functions, and records information about\nthe case conversion rules to be used by the Lisp reader when parsing\nsymbols.\n\nEach simple character must be representable in the readtable.  It is\nimplementation-defined whether non-simple characters can have syntax\ndescriptions in the readtable.\n\nSee Also::\n..........\n\n*Note Readtables::, *Note Printing Other Objects::\n\n"
}