{
    "name": "readtablep",
    "prev": "readtable-case",
    "next": "set-dispatch-macro-character",
    "up": "Reader Dictionary",
    "header": {
        "type": "Function",
        "text": "readtablep"
    },
    "sections": [
        {
            "type": "Syntax",
            "defs": [
                {
                    "name": "readtablep",
                    "text": " object =>  generalized-boolean\n"
                }
            ],
            "text": ""
        },
        {
            "type": "Arguments and Values",
            "text": "",
            "values": [
                {
                    "name": "object",
                    "desc": "an object."
                },
                {
                    "name": "generalized-boolean",
                    "desc": "a generalized boolean."
                }
            ]
        },
        {
            "type": "Description",
            "text": "Returns true if object is of type readtable; otherwise, returns false.\n"
        },
        {
            "type": "Examples",
            "text": "      (readtablep *readtable*) =>  true\n      (readtablep (copy-readtable)) =>  true\n      (readtablep '*readtable*) =>  false\n"
        },
        {
            "type": "Notes",
            "text": "      (readtablep object) == (typep object 'readtable)\n"
        }
    ],
    "_otext": "File: gcl.info,  Node: readtablep,  Next: set-dispatch-macro-character,  Prev: readtable-case,  Up: Reader Dictionary\n\nreadtablep                                                       [Function]\n---------------------------------------------------------------------------\n\n`readtablep'  object =>  generalized-boolean\n\nArguments and Values::\n......................\n\nobject--an object.\n\ngeneralized-boolean--a generalized boolean.\n\nDescription::\n.............\n\nReturns true if object is of type readtable; otherwise, returns false.\n\nExamples::\n..........\n\n      (readtablep *readtable*) =>  true\n      (readtablep (copy-readtable)) =>  true\n      (readtablep '*readtable*) =>  false\n\nNotes::\n.......\n\n      (readtablep object) == (typep object 'readtable)\n\n"
}