{
    "name": "realp",
    "prev": "upgraded-complex-part-type",
    "next": "numerator",
    "up": "Numbers Dictionary",
    "header": {
        "type": "Function",
        "text": "realp"
    },
    "sections": [
        {
            "type": "Syntax",
            "defs": [
                {
                    "name": "realp",
                    "text": " object =>  generalized-boolean\n"
                }
            ],
            "text": ""
        },
        {
            "type": "Arguments and Values",
            "text": "",
            "values": [
                {
                    "name": "object",
                    "desc": "an object."
                },
                {
                    "name": "generalized-boolean",
                    "desc": "a generalized boolean."
                }
            ]
        },
        {
            "type": "Description",
            "text": "Returns true if object is of type real; otherwise, returns false.\n"
        },
        {
            "type": "Examples",
            "text": "      (realp 12) =>  true\n      (realp #c(5/3 7.2)) =>  false\n      (realp nil) =>  false\n      (realp (cons 1 2)) =>  false\n"
        },
        {
            "type": "Notes",
            "text": "      (realp object) == (typep object 'real)\n"
        }
    ],
    "_otext": "File: gcl.info,  Node: realp,  Next: numerator,  Prev: upgraded-complex-part-type,  Up: Numbers Dictionary\n\nrealp                                                            [Function]\n---------------------------------------------------------------------------\n\n`realp'  object =>  generalized-boolean\n\nArguments and Values::\n......................\n\nobject--an object.\n\ngeneralized-boolean--a generalized boolean.\n\nDescription::\n.............\n\nReturns true if object is of type real; otherwise, returns false.\n\nExamples::\n..........\n\n      (realp 12) =>  true\n      (realp #c(5/3 7.2)) =>  false\n      (realp nil) =>  false\n      (realp (cons 1 2)) =>  false\n\nNotes::\n.......\n\n      (realp object) == (typep object 'real)\n\n"
}