{
    "name": "remove-method",
    "prev": "no-next-method",
    "next": "make-instance",
    "up": "Objects Dictionary",
    "header": {
        "type": "Standard Generic Function",
        "text": "remove-method"
    },
    "sections": [
        {
            "type": "",
            "text": ""
        },
        {
            "type": "Syntax",
            "defs": [
                {
                    "name": "remove-method",
                    "text": " generic-function method =>  generic-function\n"
                }
            ],
            "text": ""
        },
        {
            "type": "Syntax",
            "defs": [
                {
                    "name": "remove-method",
                    "text": " (generic-function standard-generic-function) method\n"
                }
            ],
            "text": ""
        },
        {
            "type": "Arguments and Values",
            "text": "",
            "values": [
                {
                    "name": "generic-function",
                    "desc": "a generic function."
                },
                {
                    "name": "method",
                    "desc": "a method."
                }
            ]
        },
        {
            "type": "Description",
            "text": "The generic function remove-method removes a method from generic-function\nby modifying the generic-function (if necessary).\nremove-method must not signal an error if the method is not one of the\nmethods on the generic-function.\n"
        },
        {
            "type": "See Also",
            "text": "*Note find-method::\n"
        }
    ],
    "_otext": "File: gcl.info,  Node: remove-method,  Next: make-instance,  Prev: no-next-method,  Up: Objects Dictionary\n\nremove-method                                   [Standard Generic Function]\n---------------------------------------------------------------------------\n\nSyntax::\n........\n\n`remove-method'  generic-function method =>  generic-function\n\nMethod Signatures::\n...................\n\n`remove-method'  (generic-function standard-generic-function) method\n\nArguments and Values::\n......................\n\ngeneric-function--a generic function.\n\nmethod--a method.\n\nDescription::\n.............\n\nThe generic function remove-method removes a method from generic-function\nby modifying the generic-function (if necessary).\n\nremove-method must not signal an error if the method is not one of the\nmethods on the generic-function.\n\nSee Also::\n..........\n\n*Note find-method::\n\n"
}