{
    "name": "rename-package",
    "prev": "list-all-packages",
    "next": "shadow",
    "up": "Packages Dictionary",
    "header": {
        "type": "Function",
        "text": "rename-package"
    },
    "sections": [
        {
            "type": "Syntax",
            "defs": [
                {
                    "name": "rename-package",
                    "text": " package new-name &optional new-nicknames =>package-object\n\n"
                }
            ],
            "text": ""
        },
        {
            "type": "Arguments and Values",
            "text": "",
            "values": [
                {
                    "name": "package",
                    "desc": "a package designator."
                },
                {
                    "name": "new-name",
                    "desc": "a package designator."
                },
                {
                    "name": "new-nicknames",
                    "desc": "a list of string designators.  The default is the empty"
                },
                {
                    "name": "new-nicknames",
                    "desc": "a list of string designators.  The default is the emptylist.\n"
                },
                {
                    "name": "package-object",
                    "desc": "the renamed package object."
                }
            ]
        },
        {
            "type": "Description",
            "text": "Replaces the name and nicknames of package.  The old name and all of the\nold nicknames of package are eliminated and are replaced by new-name and\nnew-nicknames.\nThe consequences are undefined if new-name or any new-nickname conflicts\nwith any existing package names.\n"
        },
        {
            "type": "Examples",
            "text": "      (make-package 'temporary :nicknames '(\"TEMP\")) =>  #<PACKAGE \"TEMPORARY\">\n      (rename-package 'temp 'ephemeral) =>  #<PACKAGE \"EPHEMERAL\">\n      (package-nicknames (find-package 'ephemeral)) =>  ()\n      (find-package 'temporary) =>  NIL\n      (rename-package 'ephemeral 'temporary '(temp fleeting))\n     =>  #<PACKAGE \"TEMPORARY\">\n      (package-nicknames (find-package 'temp)) =>  (\"TEMP\" \"FLEETING\")\n"
        },
        {
            "type": "See Also",
            "text": "*Note make-package::\n"
        }
    ],
    "_otext": "File: gcl.info,  Node: rename-package,  Next: shadow,  Prev: list-all-packages,  Up: Packages Dictionary\n\nrename-package                                                   [Function]\n---------------------------------------------------------------------------\n\n`rename-package'  package new-name &optional new-nicknames =>\npackage-object\n\nArguments and Values::\n......................\n\npackage--a package designator.\n\nnew-name--a package designator.\n\nnew-nicknames--a list of string designators.  The default is the empty\nlist.\n\npackage-object--the renamed package object.\n\nDescription::\n.............\n\nReplaces the name and nicknames of package.  The old name and all of the\nold nicknames of package are eliminated and are replaced by new-name and\nnew-nicknames.\n\nThe consequences are undefined if new-name or any new-nickname conflicts\nwith any existing package names.\n\nExamples::\n..........\n\n      (make-package 'temporary :nicknames '(\"TEMP\")) =>  #<PACKAGE \"TEMPORARY\">\n      (rename-package 'temp 'ephemeral) =>  #<PACKAGE \"EPHEMERAL\">\n      (package-nicknames (find-package 'ephemeral)) =>  ()\n      (find-package 'temporary) =>  NIL\n      (rename-package 'ephemeral 'temporary '(temp fleeting))\n     =>  #<PACKAGE \"TEMPORARY\">\n      (package-nicknames (find-package 'temp)) =>  (\"TEMP\" \"FLEETING\")\n\nSee Also::\n..........\n\n*Note make-package::\n\n"
}