{
    "name": "restart",
    "prev": "make-condition",
    "next": "compute-restarts",
    "up": "Conditions Dictionary",
    "header": {
        "type": "System Class",
        "text": "restart"
    },
    "sections": [
        {
            "type": "",
            "text": ""
        },
        {
            "type": "Class Precedence List",
            "text": "",
            "items": [
                {
                    "name": "restart",
                    "link": "restart"
                },
                {
                    "name": " t",
                    "link": null
                }
            ]
        },
        {
            "type": "Description",
            "text": "An object of type restart represents a function that can be called to\nperform some form of recovery action, usually a transfer of control to an\nouter point in the running program.\nAn implementation is free to implement a restart in whatever manner is\nmost convenient; a restart has only dynamic extent relative to the scope\nof the binding form which establishes it.\n"
        }
    ],
    "_otext": "File: gcl.info,  Node: restart,  Next: compute-restarts,  Prev: make-condition,  Up: Conditions Dictionary\n\nrestart                                                      [System Class]\n---------------------------------------------------------------------------\n\nClass Precedence List::\n.......................\n\nrestart, t\n\nDescription::\n.............\n\nAn object of type restart represents a function that can be called to\nperform some form of recovery action, usually a transfer of control to an\nouter point in the running program.\n\nAn implementation is free to implement a restart in whatever manner is\nmost convenient; a restart has only dynamic extent relative to the scope\nof the binding form which establishes it.\n\n"
}