{
    "name": "serious-condition",
    "prev": "style-warning",
    "next": "error (Condition Type)",
    "up": "Conditions Dictionary",
    "header": {
        "type": "Condition Type",
        "text": "serious-condition"
    },
    "sections": [
        {
            "type": "",
            "text": ""
        },
        {
            "type": "Class Precedence List",
            "text": "",
            "items": [
                {
                    "name": "serious-condition",
                    "link": "serious-condition"
                },
                {
                    "name": " condition",
                    "link": null
                },
                {
                    "name": " t",
                    "link": null
                }
            ]
        },
        {
            "type": "Description",
            "text": "All conditions serious enough to require interactive intervention if not\nhandled should inherit from the type serious-condition.  This condition\ntype is provided primarily so that it may be included as a superclass of\nother condition types; it is not intended to be signaled directly.\n"
        },
        {
            "type": "Notes",
            "text": "Signaling a serious condition does not itself force entry into the\ndebugger.   However, except in the unusual situation where the programmer\ncan assure that no harm will come from failing to handle a serious\ncondition, such a condition is usually signaled with error rather than\nsignal in order to assure that the program does not continue without\nhandling the condition.  (And conversely, it is conventional to use signal\nrather than error to signal conditions which are not serious conditions,\nsince normally the failure to handle a non-serious condition is not reason\nenough for the debugger to be entered.)\n"
        }
    ],
    "_otext": "File: gcl.info,  Node: serious-condition,  Next: error (Condition Type),  Prev: style-warning,  Up: Conditions Dictionary\n\nserious-condition                                          [Condition Type]\n---------------------------------------------------------------------------\n\nClass Precedence List::\n.......................\n\nserious-condition, condition, t\n\nDescription::\n.............\n\nAll conditions serious enough to require interactive intervention if not\nhandled should inherit from the type serious-condition.  This condition\ntype is provided primarily so that it may be included as a superclass of\nother condition types; it is not intended to be signaled directly.\n\nNotes::\n.......\n\nSignaling a serious condition does not itself force entry into the\ndebugger.   However, except in the unusual situation where the programmer\ncan assure that no harm will come from failing to handle a serious\ncondition, such a condition is usually signaled with error rather than\nsignal in order to assure that the program does not continue without\nhandling the condition.  (And conversely, it is conventional to use signal\nrather than error to signal conditions which are not serious conditions,\nsince normally the failure to handle a non-serious condition is not reason\nenough for the debugger to be entered.)\n\n"
}