{
    "name": "(setf class-name)",
    "prev": "class-name",
    "next": "class-of",
    "up": "Objects Dictionary",
    "header": {
        "type": "Standard Generic Function",
        "text": "(setf class-name)"
    },
    "sections": [
        {
            "type": "",
            "text": ""
        },
        {
            "type": "Syntax",
            "defs": [
                {
                    "name": "(setf class-name)",
                    "text": " new-value class =>  new-value\n"
                }
            ],
            "text": ""
        },
        {
            "type": "Syntax",
            "defs": [
                {
                    "name": "(setf class-name)",
                    "text": " new-value (class class)\n"
                }
            ],
            "text": ""
        },
        {
            "type": "Arguments and Values",
            "text": "",
            "values": [
                {
                    "name": "new-value",
                    "desc": "a symbol."
                },
                {
                    "name": "class",
                    "desc": "a class."
                }
            ]
        },
        {
            "type": "Description",
            "text": "The generic function (setf class-name) sets the name of a class object.\n"
        },
        {
            "type": "See Also",
            "text": "*Note find-class:: , proper name, *Note Classes::\n"
        }
    ],
    "_otext": "File: gcl.info,  Node: (setf class-name),  Next: class-of,  Prev: class-name,  Up: Objects Dictionary\n\n(setf class-name)                               [Standard Generic Function]\n---------------------------------------------------------------------------\n\nSyntax::\n........\n\n`(setf class-name)'  new-value class =>  new-value\n\nMethod Signatures::\n...................\n\n`(setf class-name)'  new-value (class class)\n\nArguments and Values::\n......................\n\nnew-value--a symbol.\n\nclass--a class.\n\nDescription::\n.............\n\nThe generic function (setf class-name) sets the name of a class object.\n\nSee Also::\n..........\n\n*Note find-class:: , proper name, *Note Classes::\n\n"
}