{
    "name": "simple-string-p",
    "prev": "simple-base-string",
    "next": "char",
    "up": "Strings Dictionary",
    "header": {
        "type": "Function",
        "text": "simple-string-p"
    },
    "sections": [
        {
            "type": "Syntax",
            "defs": [
                {
                    "name": "simple-string-p",
                    "text": " object =>  generalized-boolean\n"
                }
            ],
            "text": ""
        },
        {
            "type": "Arguments and Values",
            "text": "",
            "values": [
                {
                    "name": "object",
                    "desc": "an object."
                },
                {
                    "name": "generalized-boolean",
                    "desc": "a generalized boolean."
                }
            ]
        },
        {
            "type": "Description",
            "text": "Returns true if object is of type simple-string; otherwise, returns false.\n"
        },
        {
            "type": "Examples",
            "text": "      (simple-string-p \"aaaaaa\") =>  true\n      (simple-string-p (make-array 6\n                                   :element-type 'character\n                                   :fill-pointer t)) =>  false\n"
        },
        {
            "type": "Notes",
            "text": "      (simple-string-p object) == (typep object 'simple-string)\n"
        }
    ],
    "_otext": "File: gcl.info,  Node: simple-string-p,  Next: char,  Prev: simple-base-string,  Up: Strings Dictionary\n\nsimple-string-p                                                  [Function]\n---------------------------------------------------------------------------\n\n`simple-string-p'  object =>  generalized-boolean\n\nArguments and Values::\n......................\n\nobject--an object.\n\ngeneralized-boolean--a generalized boolean.\n\nDescription::\n.............\n\nReturns true if object is of type simple-string; otherwise, returns false.\n\nExamples::\n..........\n\n      (simple-string-p \"aaaaaa\") =>  true\n      (simple-string-p (make-array 6\n                                   :element-type 'character\n                                   :fill-pointer t)) =>  false\n\nNotes::\n.......\n\n      (simple-string-p object) == (typep object 'simple-string)\n\n"
}