{
    "name": "sin",
    "prev": "floor",
    "next": "asin",
    "up": "Numbers Dictionary",
    "header": {
        "type": "Function",
        "text": "sin, cos, tan"
    },
    "sections": [
        {
            "type": "Syntax",
            "defs": [
                {
                    "name": "sin",
                    "text": " radians =>  number\n"
                },
                {
                    "name": "cos",
                    "text": " radians =>  number\n\n"
                },
                {
                    "name": "tan",
                    "text": " radians =>  number\n\n"
                }
            ],
            "text": ""
        },
        {
            "type": "Arguments and Values",
            "text": "",
            "values": [
                {
                    "name": "radians",
                    "desc": "a number given in radians."
                },
                {
                    "name": "number",
                    "desc": "a number."
                }
            ]
        },
        {
            "type": "Description",
            "text": "sin, cos, and tan return the sine, cosine, and tangent, respectively, of\nradians.\n"
        },
        {
            "type": "Examples",
            "text": "      (sin 0) =>  0.0\n      (cos 0.7853982) =>  0.707107\n      (tan #c(0 1)) =>  #C(0.0 0.761594)\n"
        },
        {
            "type": "Exceptional Situations",
            "text": "Should signal an error of type type-error if radians is not a number.\nMight signal arithmetic-error.\n"
        },
        {
            "type": "See Also",
            "text": "*Note asin; acos; atan:: , acos, atan, *Note Rule of Float\nSubstitutability::\n"
        }
    ],
    "_otext": "File: gcl.info,  Node: sin,  Next: asin,  Prev: floor,  Up: Numbers Dictionary\n\nsin, cos, tan                                                    [Function]\n---------------------------------------------------------------------------\n\n`sin'  radians =>  number\n\n`cos'  radians =>  number\n\n`tan'  radians =>  number\n\nArguments and Values::\n......................\n\nradians--a number given in radians.\n\nnumber--a number.\n\nDescription::\n.............\n\nsin, cos, and tan return the sine, cosine, and tangent, respectively, of\nradians.\n\nExamples::\n..........\n\n      (sin 0) =>  0.0\n      (cos 0.7853982) =>  0.707107\n      (tan #c(0 1)) =>  #C(0.0 0.761594)\n\nExceptional Situations::\n........................\n\nShould signal an error of type type-error if radians is not a number.\nMight signal arithmetic-error.\n\nSee Also::\n..........\n\n*Note asin; acos; atan:: , acos, atan, *Note Rule of Float\nSubstitutability::\n\n"
}