{
    "name": "software-type",
    "prev": "machine-version",
    "next": "user-homedir-pathname",
    "up": "Environment Dictionary",
    "header": {
        "type": "Function",
        "text": "software-type, software-version"
    },
    "sections": [
        {
            "type": "Syntax",
            "defs": [
                {
                    "name": "software-type",
                    "text": " <no arguments> =>  description\n"
                },
                {
                    "name": "software-version",
                    "text": " <no arguments> =>  description\n\n"
                }
            ],
            "text": ""
        },
        {
            "type": "Arguments and Values",
            "text": "",
            "values": [
                {
                    "name": "description",
                    "desc": "a string or nil."
                }
            ]
        },
        {
            "type": "Description",
            "text": "software-type returns a string that identifies the generic name of any\nrelevant supporting software, or nil if no appropriate or relevant result\ncan be produced.\nsoftware-version returns a string that identifies the version of any\nrelevant supporting software, or nil if no appropriate or relevant result\ncan be produced.\n"
        },
        {
            "type": "Examples",
            "text": "      (software-type) =>  \"Multics\"\n      (software-version) =>  \"1.3x\"\n"
        },
        {
            "type": "Affected By",
            "text": "Operating system environment.\n"
        },
        {
            "type": "Notes",
            "text": "This information should be of use to maintainers of the implementation.\n"
        }
    ],
    "_otext": "File: gcl.info,  Node: software-type,  Next: user-homedir-pathname,  Prev: machine-version,  Up: Environment Dictionary\n\nsoftware-type, software-version                                  [Function]\n---------------------------------------------------------------------------\n\n`software-type'  <no arguments> =>  description\n\n`software-version'  <no arguments> =>  description\n\nArguments and Values::\n......................\n\ndescription--a string or nil.\n\nDescription::\n.............\n\nsoftware-type returns a string that identifies the generic name of any\nrelevant supporting software, or nil if no appropriate or relevant result\ncan be produced.\n\nsoftware-version returns a string that identifies the version of any\nrelevant supporting software, or nil if no appropriate or relevant result\ncan be produced.\n\nExamples::\n..........\n\n      (software-type) =>  \"Multics\"\n      (software-version) =>  \"1.3x\"\n\nAffected By::\n.............\n\nOperating system environment.\n\nNotes::\n.......\n\nThis information should be of use to maintainers of the implementation.\n\n"
}