{
    "name": "stream",
    "prev": "Streams Dictionary",
    "next": "broadcast-stream",
    "up": "Streams Dictionary",
    "header": {
        "type": "System Class",
        "text": "stream"
    },
    "sections": [
        {
            "type": "",
            "text": ""
        },
        {
            "type": "Class Precedence List",
            "text": "",
            "items": [
                {
                    "name": "stream",
                    "link": "stream"
                },
                {
                    "name": " t",
                    "link": null
                }
            ]
        },
        {
            "type": "Description",
            "text": "A stream is an object that can be used with an input or output function to\nidentify an appropriate source or sink of characters or bytes for that\noperation.\nFor more complete information, see *Note Stream Concepts::.\n"
        },
        {
            "type": "See Also",
            "text": "*Note Stream Concepts::, *Note Printing Other Objects::, *Note Printer::,\n*Note Reader::\n"
        }
    ],
    "_otext": "File: gcl.info,  Node: stream,  Next: broadcast-stream,  Prev: Streams Dictionary,  Up: Streams Dictionary\n\nstream                                                       [System Class]\n---------------------------------------------------------------------------\n\nClass Precedence List::\n.......................\n\nstream, t\n\nDescription::\n.............\n\nA stream is an object that can be used with an input or output function to\nidentify an appropriate source or sink of characters or bytes for that\noperation.\n\nFor more complete information, see *Note Stream Concepts::.\n\nSee Also::\n..........\n\n*Note Stream Concepts::, *Note Printing Other Objects::, *Note Printer::,\n*Note Reader::\n\n"
}