{
    "name": "stream-error",
    "prev": "*terminal-io*",
    "next": "stream-error-stream",
    "up": "Streams Dictionary",
    "header": {
        "type": "Condition Type",
        "text": "stream-error"
    },
    "sections": [
        {
            "type": "",
            "text": ""
        },
        {
            "type": "Class Precedence List",
            "text": "",
            "items": [
                {
                    "name": "stream-error",
                    "link": "stream-error"
                },
                {
                    "name": " error",
                    "link": null
                },
                {
                    "name": " serious-condition",
                    "link": null
                },
                {
                    "name": " condition",
                    "link": null
                },
                {
                    "name": " t",
                    "link": null
                }
            ]
        },
        {
            "type": "Description",
            "text": "The type stream-error consists of error conditions that are related to\nreceiving input from or sending output to a stream.  The \"offending\nstream\" is initialized by the :stream initialization argument to\nmake-condition, and is accessed by the function stream-error-stream.\n"
        },
        {
            "type": "See Also",
            "text": "*Note stream-error-stream::\n"
        }
    ],
    "_otext": "File: gcl.info,  Node: stream-error,  Next: stream-error-stream,  Prev: *terminal-io*,  Up: Streams Dictionary\n\nstream-error                                               [Condition Type]\n---------------------------------------------------------------------------\n\nClass Precedence List::\n.......................\n\nstream-error, error, serious-condition, condition, t\n\nDescription::\n.............\n\nThe type stream-error consists of error conditions that are related to\nreceiving input from or sending output to a stream.  The \"offending\nstream\" is initialized by the :stream initialization argument to\nmake-condition, and is accessed by the function stream-error-stream.\n\nSee Also::\n..........\n\n*Note stream-error-stream::\n\n"
}