{
    "name": "stream-external-format",
    "prev": "open",
    "next": "with-open-file",
    "up": "Streams Dictionary",
    "header": {
        "type": "Function",
        "text": "stream-external-format"
    },
    "sections": [
        {
            "type": "Syntax",
            "defs": [
                {
                    "name": "stream-external-format",
                    "text": " stream =>  format\n"
                }
            ],
            "text": ""
        },
        {
            "type": "Arguments and Values",
            "text": "",
            "values": [
                {
                    "name": "stream",
                    "desc": "a file stream."
                },
                {
                    "name": "format",
                    "desc": "an external file format."
                }
            ]
        },
        {
            "type": "Description",
            "text": "Returns an external file format designator for the stream.\n"
        },
        {
            "type": "Examples",
            "text": "      (with-open-file (stream \"test\" :direction :output)\n        (stream-external-format stream))\n     =>  :DEFAULT\n     OR=> :ISO8859/1-1987\n     OR=> (:ASCII :SAIL)\n     OR=> ACME::PROPRIETARY-FILE-FORMAT-17\n     OR=> #<FILE-FORMAT :ISO646-1983 2343673>\n"
        },
        {
            "type": "See Also",
            "text": "the :external-format argument to the function *Note open:: and the *Note\nwith-open-file:: macro.\n"
        },
        {
            "type": "Notes",
            "text": "The format returned is not necessarily meaningful to other implementations.\n"
        }
    ],
    "_otext": "File: gcl.info,  Node: stream-external-format,  Next: with-open-file,  Prev: open,  Up: Streams Dictionary\n\nstream-external-format                                           [Function]\n---------------------------------------------------------------------------\n\n`stream-external-format'  stream =>  format\n\nArguments and Values::\n......................\n\nstream--a file stream.\n\nformat--an external file format.\n\nDescription::\n.............\n\nReturns an external file format designator for the stream.\n\nExamples::\n..........\n\n      (with-open-file (stream \"test\" :direction :output)\n        (stream-external-format stream))\n     =>  :DEFAULT\n     OR=> :ISO8859/1-1987\n     OR=> (:ASCII :SAIL)\n     OR=> ACME::PROPRIETARY-FILE-FORMAT-17\n     OR=> #<FILE-FORMAT :ISO646-1983 2343673>\n\nSee Also::\n..........\n\nthe :external-format argument to the function *Note open:: and the *Note\nwith-open-file:: macro.\n\nNotes::\n.......\n\nThe format returned is not necessarily meaningful to other implementations.\n\n"
}