{
    "name": "string (System Class)",
    "prev": "Strings Dictionary",
    "next": "base-string",
    "up": "Strings Dictionary",
    "header": {
        "type": "System Class",
        "text": "string"
    },
    "sections": [
        {
            "type": "",
            "text": ""
        },
        {
            "type": "Class Precedence List",
            "text": "",
            "items": [
                {
                    "name": "string",
                    "link": "string"
                },
                {
                    "name": " vector",
                    "link": null
                },
                {
                    "name": " array",
                    "link": null
                },
                {
                    "name": " sequence",
                    "link": null
                },
                {
                    "name": " t",
                    "link": null
                }
            ]
        },
        {
            "type": "Description",
            "text": "A string is a specialized vector whose elements are of type character or a\nsubtype of type character.  When used as a type specifier for object\ncreation, string means (vector character).\n"
        },
        {
            "type": "Compound Type Specifier Kind",
            "text": "Abbreviating.\n"
        },
        {
            "type": "Compound Type Specifier Syntax",
            "text": "(`string'{[size]})\n"
        },
        {
            "type": "Compound Type Specifier Arguments",
            "text": "size--a non-negative fixnum, or the symbol *.\n"
        },
        {
            "type": "Compound Type Specifier Description",
            "text": "This denotes the union of all types (array c (size)) for all subtypes c of\ncharacter; that is, the set of strings of size size.\n"
        },
        {
            "type": "See Also",
            "text": "*Note String Concepts::, *Note Double-Quote::, *Note Printing Strings::\n"
        }
    ],
    "_otext": "File: gcl.info,  Node: string (System Class),  Next: base-string,  Prev: Strings Dictionary,  Up: Strings Dictionary\n\nstring                                                       [System Class]\n---------------------------------------------------------------------------\n\nClass Precedence List::\n.......................\n\nstring, vector, array, sequence, t\n\nDescription::\n.............\n\nA string is a specialized vector whose elements are of type character or a\nsubtype of type character.  When used as a type specifier for object\ncreation, string means (vector character).\n\nCompound Type Specifier Kind::\n..............................\n\nAbbreviating.\n\nCompound Type Specifier Syntax::\n................................\n\n(`string'{[size]})\n\nCompound Type Specifier Arguments::\n...................................\n\nsize--a non-negative fixnum, or the symbol *.\n\nCompound Type Specifier Description::\n.....................................\n\nThis denotes the union of all types (array c (size)) for all subtypes c of\ncharacter; that is, the set of strings of size size.\n\nSee Also::\n..........\n\n*Note String Concepts::, *Note Double-Quote::, *Note Printing Strings::\n\n"
}