{
    "name": "stringp",
    "prev": "string=",
    "next": "make-string",
    "up": "Strings Dictionary",
    "header": {
        "type": "Function",
        "text": "stringp"
    },
    "sections": [
        {
            "type": "Syntax",
            "defs": [
                {
                    "name": "stringp",
                    "text": " object =>  generalized-boolean\n"
                }
            ],
            "text": ""
        },
        {
            "type": "Arguments and Values",
            "text": "",
            "values": [
                {
                    "name": "object",
                    "desc": "an object."
                },
                {
                    "name": "generalized-boolean",
                    "desc": "a generalized boolean."
                }
            ]
        },
        {
            "type": "Description",
            "text": "Returns true if object is of type string; otherwise, returns false.\n"
        },
        {
            "type": "Examples",
            "text": "      (stringp \"aaaaaa\") =>  true\n      (stringp #\\a) =>  false\n"
        },
        {
            "type": "See Also",
            "text": "*Note typep:: , string (type)\n"
        },
        {
            "type": "Notes",
            "text": "      (stringp object) == (typep object 'string)\n"
        }
    ],
    "_otext": "File: gcl.info,  Node: stringp,  Next: make-string,  Prev: string=,  Up: Strings Dictionary\n\nstringp                                                          [Function]\n---------------------------------------------------------------------------\n\n`stringp'  object =>  generalized-boolean\n\nArguments and Values::\n......................\n\nobject--an object.\n\ngeneralized-boolean--a generalized boolean.\n\nDescription::\n.............\n\nReturns true if object is of type string; otherwise, returns false.\n\nExamples::\n..........\n\n      (stringp \"aaaaaa\") =>  true\n      (stringp #\\a) =>  false\n\nSee Also::\n..........\n\n*Note typep:: , string (type)\n\nNotes::\n.......\n\n      (stringp object) == (typep object 'string)\n\n"
}