{
    "name": "string-stream",
    "prev": "file-stream",
    "next": "synonym-stream",
    "up": "Streams Dictionary",
    "header": {
        "type": "System Class",
        "text": "string-stream"
    },
    "sections": [
        {
            "type": "",
            "text": ""
        },
        {
            "type": "Class Precedence List",
            "text": "",
            "items": [
                {
                    "name": "string-stream",
                    "link": "string-stream"
                },
                {
                    "name": " stream",
                    "link": null
                },
                {
                    "name": " t",
                    "link": null
                }
            ]
        },
        {
            "type": "Description",
            "text": "A string stream is a stream which reads input from or writes output to an\nassociated string.\nThe stream element type of a string stream is always a subtype of type\ncharacter.\n"
        },
        {
            "type": "See Also",
            "text": "*Note make-string-input-stream:: , *Note make-string-output-stream:: ,\n*Note with-input-from-string:: , *Note with-output-to-string::\n"
        }
    ],
    "_otext": "File: gcl.info,  Node: string-stream,  Next: synonym-stream,  Prev: file-stream,  Up: Streams Dictionary\n\nstring-stream                                                [System Class]\n---------------------------------------------------------------------------\n\nClass Precedence List::\n.......................\n\nstring-stream, stream, t\n\nDescription::\n.............\n\nA string stream is a stream which reads input from or writes output to an\nassociated string.\n\nThe stream element type of a string stream is always a subtype of type\ncharacter.\n\nSee Also::\n..........\n\n*Note make-string-input-stream:: , *Note make-string-output-stream:: ,\n*Note with-input-from-string:: , *Note with-output-to-string::\n\n"
}