{
    "name": "structure-object",
    "prev": "standard-method",
    "next": "standard-object",
    "up": "Types and Classes Dictionary",
    "header": {
        "type": "Class",
        "text": "structure-object"
    },
    "sections": [
        {
            "type": "",
            "text": ""
        },
        {
            "type": "Class Precedence List",
            "text": "",
            "items": [
                {
                    "name": "structure-object",
                    "link": "structure-object"
                },
                {
                    "name": " t",
                    "link": null
                }
            ]
        },
        {
            "type": "Description",
            "text": "The class structure-object is an instance of structure-class and is a\nsuperclass of every class that is an instance of structure-class except\nitself, and is a superclass of every class that is defined by defstruct.\n"
        },
        {
            "type": "See Also",
            "text": "*Note defstruct:: , *Note Sharpsign S::, *Note Printing Structures::\n"
        }
    ],
    "_otext": "File: gcl.info,  Node: structure-object,  Next: standard-object,  Prev: standard-method,  Up: Types and Classes Dictionary\n\nstructure-object                                                    [Class]\n---------------------------------------------------------------------------\n\nClass Precedence List::\n.......................\n\nstructure-object, t\n\nDescription::\n.............\n\nThe class structure-object is an instance of structure-class and is a\nsuperclass of every class that is an instance of structure-class except\nitself, and is a superclass of every class that is defined by defstruct.\n\nSee Also::\n..........\n\n*Note defstruct:: , *Note Sharpsign S::, *Note Printing Structures::\n\n"
}