{
    "name": "symbolp",
    "prev": "keyword",
    "next": "keywordp",
    "up": "Symbols Dictionary",
    "header": {
        "type": "Function",
        "text": "symbolp"
    },
    "sections": [
        {
            "type": "Syntax",
            "defs": [
                {
                    "name": "symbolp",
                    "text": " object =>  generalized-boolean\n"
                }
            ],
            "text": ""
        },
        {
            "type": "Arguments and Values",
            "text": "",
            "values": [
                {
                    "name": "object",
                    "desc": "an object."
                },
                {
                    "name": "generalized-boolean",
                    "desc": "a generalized boolean."
                }
            ]
        },
        {
            "type": "Description",
            "text": "Returns true if object is of type symbol; otherwise, returns false.\n"
        },
        {
            "type": "Examples",
            "text": "      (symbolp 'elephant) =>  true\n      (symbolp 12) =>  false\n      (symbolp nil) =>  true\n      (symbolp '()) =>  true\n      (symbolp :test) =>  true\n      (symbolp \"hello\") =>  false\n"
        },
        {
            "type": "See Also",
            "text": "*Note keywordp:: , symbol, *Note typep::\n"
        },
        {
            "type": "Notes",
            "text": "      (symbolp object) == (typep object 'symbol)\n"
        }
    ],
    "_otext": "File: gcl.info,  Node: symbolp,  Next: keywordp,  Prev: keyword,  Up: Symbols Dictionary\n\nsymbolp                                                          [Function]\n---------------------------------------------------------------------------\n\n`symbolp'  object =>  generalized-boolean\n\nArguments and Values::\n......................\n\nobject--an object.\n\ngeneralized-boolean--a generalized boolean.\n\nDescription::\n.............\n\nReturns true if object is of type symbol; otherwise, returns false.\n\nExamples::\n..........\n\n      (symbolp 'elephant) =>  true\n      (symbolp 12) =>  false\n      (symbolp nil) =>  true\n      (symbolp '()) =>  true\n      (symbolp :test) =>  true\n      (symbolp \"hello\") =>  false\n\nSee Also::\n..........\n\n*Note keywordp:: , symbol, *Note typep::\n\nNotes::\n.......\n\n      (symbolp object) == (typep object 'symbol)\n\n"
}