{
    "name": "synonym-stream",
    "prev": "string-stream",
    "next": "two-way-stream",
    "up": "Streams Dictionary",
    "header": {
        "type": "System Class",
        "text": "synonym-stream"
    },
    "sections": [
        {
            "type": "",
            "text": ""
        },
        {
            "type": "Class Precedence List",
            "text": "",
            "items": [
                {
                    "name": "synonym-stream",
                    "link": "synonym-stream"
                },
                {
                    "name": " stream",
                    "link": null
                },
                {
                    "name": " t",
                    "link": null
                }
            ]
        },
        {
            "type": "Description",
            "text": "A stream that is an alias for another stream, which is the value of a\ndynamic variable whose name is the synonym stream symbol of the synonym\nstream.\nAny operations on a synonym stream will be performed on the stream that is\nthen the value of the dynamic variable named by the synonym stream symbol.\nIf the value of the variable should change, or if the variable should be\nbound, then the stream will operate on the new value of the variable.\n"
        },
        {
            "type": "See Also",
            "text": "*Note make-synonym-stream:: , *Note synonym-stream-symbol::\n"
        }
    ],
    "_otext": "File: gcl.info,  Node: synonym-stream,  Next: two-way-stream,  Prev: string-stream,  Up: Streams Dictionary\n\nsynonym-stream                                               [System Class]\n---------------------------------------------------------------------------\n\nClass Precedence List::\n.......................\n\nsynonym-stream, stream, t\n\nDescription::\n.............\n\nA stream that is an alias for another stream, which is the value of a\ndynamic variable whose name is the synonym stream symbol of the synonym\nstream.\n\nAny operations on a synonym stream will be performed on the stream that is\nthen the value of the dynamic variable named by the synonym stream symbol.\nIf the value of the variable should change, or if the variable should be\nbound, then the stream will operate on the new value of the variable.\n\nSee Also::\n..........\n\n*Note make-synonym-stream:: , *Note synonym-stream-symbol::\n\n"
}