{
    "name": "two-way-stream",
    "prev": "synonym-stream",
    "next": "input-stream-p",
    "up": "Streams Dictionary",
    "header": {
        "type": "System Class",
        "text": "two-way-stream"
    },
    "sections": [
        {
            "type": "",
            "text": ""
        },
        {
            "type": "Class Precedence List",
            "text": "",
            "items": [
                {
                    "name": "two-way-stream",
                    "link": "two-way-stream"
                },
                {
                    "name": " stream",
                    "link": null
                },
                {
                    "name": " t",
                    "link": null
                }
            ]
        },
        {
            "type": "Description",
            "text": "A bidirectional composite stream that receives its input  from an\nassociated input  stream and sends    its output to   an associated output\nstream.\n"
        },
        {
            "type": "See Also",
            "text": "*Note make-two-way-stream:: , *Note two-way-stream-input-stream;\ntwo-way-stream-output-stream:: , two-way-stream-output-stream\n"
        }
    ],
    "_otext": "File: gcl.info,  Node: two-way-stream,  Next: input-stream-p,  Prev: synonym-stream,  Up: Streams Dictionary\n\ntwo-way-stream                                               [System Class]\n---------------------------------------------------------------------------\n\nClass Precedence List::\n.......................\n\ntwo-way-stream, stream, t\n\nDescription::\n.............\n\nA bidirectional composite stream that receives its input  from an\nassociated input  stream and sends    its output to   an associated output\nstream.\n\nSee Also::\n..........\n\n*Note make-two-way-stream:: , *Note two-way-stream-input-stream;\ntwo-way-stream-output-stream:: , two-way-stream-output-stream\n\n"
}