{
    "name": "type-error",
    "prev": "typep",
    "next": "type-error-datum",
    "up": "Types and Classes Dictionary",
    "header": {
        "type": "Condition Type",
        "text": "type-error"
    },
    "sections": [
        {
            "type": "",
            "text": ""
        },
        {
            "type": "Class Precedence List",
            "text": "",
            "items": [
                {
                    "name": "type-error",
                    "link": "type-error"
                },
                {
                    "name": " error",
                    "link": null
                },
                {
                    "name": " serious-condition",
                    "link": null
                },
                {
                    "name": " condition",
                    "link": null
                },
                {
                    "name": " t",
                    "link": null
                }
            ]
        },
        {
            "type": "Description",
            "text": "The type type-error represents a situation in which an object is not of\nthe expected type.  The \"offending datum\" and \"expected type\" are\ninitialized by the initialization arguments named :datum and\n:expected-type to make-condition, and are accessed by the functions\ntype-error-datum and type-error-expected-type.\n"
        },
        {
            "type": "See Also",
            "text": "*Note type-error-datum; type-error-expected-type:: ,\ntype-error-expected-type\n"
        }
    ],
    "_otext": "File: gcl.info,  Node: type-error,  Next: type-error-datum,  Prev: typep,  Up: Types and Classes Dictionary\n\ntype-error                                                 [Condition Type]\n---------------------------------------------------------------------------\n\nClass Precedence List::\n.......................\n\ntype-error, error, serious-condition, condition, t\n\nDescription::\n.............\n\nThe type type-error represents a situation in which an object is not of\nthe expected type.  The \"offending datum\" and \"expected type\" are\ninitialized by the initialization arguments named :datum and\n:expected-type to make-condition, and are accessed by the functions\ntype-error-datum and type-error-expected-type.\n\nSee Also::\n..........\n\n*Note type-error-datum; type-error-expected-type:: ,\ntype-error-expected-type\n\n"
}