{
    "name": "unbound-slot",
    "prev": "class-of",
    "next": "unbound-slot-instance",
    "up": "Objects Dictionary",
    "header": {
        "type": "Condition Type",
        "text": "unbound-slot"
    },
    "sections": [
        {
            "type": "",
            "text": ""
        },
        {
            "type": "Class Precedence List",
            "text": "",
            "items": [
                {
                    "name": "unbound-slot",
                    "link": "unbound-slot"
                },
                {
                    "name": " cell-error",
                    "link": null
                },
                {
                    "name": " error",
                    "link": null
                },
                {
                    "name": " serious-condition",
                    "link": null
                },
                {
                    "name": " condition",
                    "link": null
                },
                {
                    "name": " t",
                    "link": null
                }
            ]
        },
        {
            "type": "Description",
            "text": "The object having the unbound slot is initialized by the :instance\ninitialization argument to make-condition, and is accessed by the function\nunbound-slot-instance.\nThe name of the cell (see cell-error) is the name of the slot.\n"
        },
        {
            "type": "See Also",
            "text": "*Note cell-error-name:: , unbound-slot-object, *Note Condition System\nConcepts::\n"
        }
    ],
    "_otext": "File: gcl.info,  Node: unbound-slot,  Next: unbound-slot-instance,  Prev: class-of,  Up: Objects Dictionary\n\nunbound-slot                                               [Condition Type]\n---------------------------------------------------------------------------\n\nClass Precedence List::\n.......................\n\nunbound-slot, cell-error, error, serious-condition, condition, t\n\nDescription::\n.............\n\nThe object having the unbound slot is initialized by the :instance\ninitialization argument to make-condition, and is accessed by the function\nunbound-slot-instance.\n\nThe name of the cell (see cell-error) is the name of the slot.\n\nSee Also::\n..........\n\n*Note cell-error-name:: , unbound-slot-object, *Note Condition System\nConcepts::\n\n"
}