{
    "name": "unuse-package",
    "prev": "in-package",
    "next": "use-package",
    "up": "Packages Dictionary",
    "header": {
        "type": "Function",
        "text": "unuse-package"
    },
    "sections": [
        {
            "type": "Syntax",
            "defs": [
                {
                    "name": "unuse-package",
                    "text": " packages-to-unuse &optional package =>  t\n"
                }
            ],
            "text": ""
        },
        {
            "type": "Arguments and Values",
            "text": "",
            "values": [
                {
                    "name": "packages-to-unuse",
                    "desc": "a designator for a list of package designators."
                },
                {
                    "name": "package",
                    "desc": "a package designator.  The default is the current package."
                }
            ]
        },
        {
            "type": "Description",
            "text": "unuse-package causes package to cease inheriting all the external symbols\nof packages-to-unuse; unuse-package undoes the effects of use-package.\nThe packages-to-unuse are removed from the use list of package.\nAny symbols that have been imported into package continue to be present in\npackage.\n"
        },
        {
            "type": "Examples",
            "text": "      (in-package \"COMMON-LISP-USER\") =>  #<PACKAGE \"COMMON-LISP-USER\">\n      (export (intern \"SHOES\" (make-package 'temp)) 'temp) =>  T\n      (find-symbol \"SHOES\") =>  NIL, NIL\n      (use-package 'temp) =>  T\n      (find-symbol \"SHOES\") =>  SHOES, :INHERITED\n      (find (find-package 'temp) (package-use-list 'common-lisp-user)) =>  #<PACKAGE \"TEMP\">\n      (unuse-package 'temp) =>  T\n      (find-symbol \"SHOES\") =>  NIL, NIL\n"
        },
        {
            "type": "Side Effects",
            "text": "The use list of package is modified.\n"
        },
        {
            "type": "Affected By",
            "text": "Current state of the package system.\n"
        },
        {
            "type": "See Also",
            "text": "*Note use-package:: , *Note package-use-list::\n"
        }
    ],
    "_otext": "File: gcl.info,  Node: unuse-package,  Next: use-package,  Prev: in-package,  Up: Packages Dictionary\n\nunuse-package                                                    [Function]\n---------------------------------------------------------------------------\n\n`unuse-package'  packages-to-unuse &optional package =>  t\n\nArguments and Values::\n......................\n\npackages-to-unuse--a designator for a list of package designators.\n\npackage--a package designator.  The default is the current package.\n\nDescription::\n.............\n\nunuse-package causes package to cease inheriting all the external symbols\nof packages-to-unuse; unuse-package undoes the effects of use-package.\nThe packages-to-unuse are removed from the use list of package.\n\nAny symbols that have been imported into package continue to be present in\npackage.\n\nExamples::\n..........\n\n      (in-package \"COMMON-LISP-USER\") =>  #<PACKAGE \"COMMON-LISP-USER\">\n      (export (intern \"SHOES\" (make-package 'temp)) 'temp) =>  T\n      (find-symbol \"SHOES\") =>  NIL, NIL\n      (use-package 'temp) =>  T\n      (find-symbol \"SHOES\") =>  SHOES, :INHERITED\n      (find (find-package 'temp) (package-use-list 'common-lisp-user)) =>  #<PACKAGE \"TEMP\">\n      (unuse-package 'temp) =>  T\n      (find-symbol \"SHOES\") =>  NIL, NIL\n\nSide Effects::\n..............\n\nThe use list of package is modified.\n\nAffected By::\n.............\n\nCurrent state of the package system.\n\nSee Also::\n..........\n\n*Note use-package:: , *Note package-use-list::\n\n"
}