{
    "name": "vector-pop",
    "prev": "vector",
    "next": "vector-push",
    "up": "Arrays Dictionary",
    "header": {
        "type": "Function",
        "text": "vector-pop"
    },
    "sections": [
        {
            "type": "Syntax",
            "defs": [
                {
                    "name": "vector-pop",
                    "text": " vector =>  element\n"
                }
            ],
            "text": ""
        },
        {
            "type": "Arguments and Values",
            "text": "",
            "values": [
                {
                    "name": "vector",
                    "desc": "a vector with a fill pointer."
                },
                {
                    "name": "element",
                    "desc": "an object."
                }
            ]
        },
        {
            "type": "Description",
            "text": "Decreases the fill pointer of vector by one, and retrieves the element of\nvector that is designated by the new fill pointer.\n"
        },
        {
            "type": "Examples",
            "text": "      (vector-push (setq fable (list 'fable))\n                   (setq fa (make-array 8\n                                        :fill-pointer 2\n                                        :initial-element 'sisyphus))) =>  2\n      (fill-pointer fa) =>  3\n      (eq (vector-pop fa) fable) =>  true\n      (vector-pop fa) =>  SISYPHUS\n      (fill-pointer fa) =>  1\n"
        },
        {
            "type": "Side Effects",
            "text": "The fill pointer is decreased by one.\n"
        },
        {
            "type": "Affected By",
            "text": "The value of the fill pointer.\n"
        },
        {
            "type": "Exceptional Situations",
            "text": "An error of type type-error is signaled if vector does not have a fill\npointer.\nIf the fill pointer is zero, vector-pop signals an error of type error.\n"
        },
        {
            "type": "See Also",
            "text": "*Note vector-push; vector-push-extend:: , vector-push-extend, *Note\nfill-pointer::\n"
        }
    ],
    "_otext": "File: gcl.info,  Node: vector-pop,  Next: vector-push,  Prev: vector,  Up: Arrays Dictionary\n\nvector-pop                                                       [Function]\n---------------------------------------------------------------------------\n\n`vector-pop'  vector =>  element\n\nArguments and Values::\n......................\n\nvector--a vector with a fill pointer.\n\nelement--an object.\n\nDescription::\n.............\n\nDecreases the fill pointer of vector by one, and retrieves the element of\nvector that is designated by the new fill pointer.\n\nExamples::\n..........\n\n      (vector-push (setq fable (list 'fable))\n                   (setq fa (make-array 8\n                                        :fill-pointer 2\n                                        :initial-element 'sisyphus))) =>  2\n      (fill-pointer fa) =>  3\n      (eq (vector-pop fa) fable) =>  true\n      (vector-pop fa) =>  SISYPHUS\n      (fill-pointer fa) =>  1\n\nSide Effects::\n..............\n\nThe fill pointer is decreased by one.\n\nAffected By::\n.............\n\nThe value of the fill pointer.\n\nExceptional Situations::\n........................\n\nAn error of type type-error is signaled if vector does not have a fill\npointer.\n\nIf the fill pointer is zero, vector-pop signals an error of type error.\n\nSee Also::\n..........\n\n*Note vector-push; vector-push-extend:: , vector-push-extend, *Note\nfill-pointer::\n\n"
}