{
    "name": "with-condition-restarts",
    "prev": "restart-name",
    "next": "with-simple-restart",
    "up": "Conditions Dictionary",
    "header": {
        "type": "Macro",
        "text": "with-condition-restarts"
    },
    "sections": [
        {
            "type": "Syntax",
            "defs": [
                {
                    "name": "with-condition-restarts",
                    "text": " condition-form restarts-form {form}*=>  {result}*\n\n"
                }
            ],
            "text": ""
        },
        {
            "type": "Arguments and Values",
            "text": "",
            "values": [
                {
                    "name": "condition-form",
                    "desc": "a form; evaluated to produce a condition."
                },
                {
                    "name": "condition",
                    "desc": "a condition object resulting from the evaluation of"
                },
                {
                    "name": "condition",
                    "desc": "a condition object resulting from the evaluation ofcondition-form.\n"
                },
                {
                    "name": "restart-form",
                    "desc": "a form; evaluated to produce a restart-list."
                },
                {
                    "name": "restart-list",
                    "desc": "a list of restart objects resulting from the evaluation of"
                },
                {
                    "name": "restart-list",
                    "desc": "a list of restart objects resulting from the evaluation ofrestart-form.\n"
                },
                {
                    "name": "forms",
                    "desc": "an implicit progn; evaluated."
                },
                {
                    "name": "results",
                    "desc": "the values returned by forms."
                }
            ]
        },
        {
            "type": "Description",
            "text": "First, the condition-form and restarts-form are evaluated in normal\nleft-to-right order; the primary values yielded by these evaluations are\nrespectively called the condition and the restart-list.\nNext, the forms are evaluated in a dynamic environment in which each\nrestart in restart-list is associated with the condition.  See *Note\nAssociating a Restart with a Condition::.\n"
        },
        {
            "type": "See Also",
            "text": "*Note restart-case::\n"
        },
        {
            "type": "Notes",
            "text": "Usually this macro is not used explicitly in code, since restart-case\nhandles most of the common cases in a way that is syntactically more\nconcise.\n"
        }
    ],
    "_otext": "File: gcl.info,  Node: with-condition-restarts,  Next: with-simple-restart,  Prev: restart-name,  Up: Conditions Dictionary\n\nwith-condition-restarts                                             [Macro]\n---------------------------------------------------------------------------\n\n`with-condition-restarts'  condition-form restarts-form {form}*\n=>  {result}*\n\nArguments and Values::\n......................\n\ncondition-form--a form; evaluated to produce a condition.\n\ncondition--a condition object resulting from the evaluation of\ncondition-form.\n\nrestart-form--a form; evaluated to produce a restart-list.\n\nrestart-list--a list of restart objects resulting from the evaluation of\nrestart-form.\n\nforms--an implicit progn; evaluated.\n\nresults--the values returned by forms.\n\nDescription::\n.............\n\nFirst, the condition-form and restarts-form are evaluated in normal\nleft-to-right order; the primary values yielded by these evaluations are\nrespectively called the condition and the restart-list.\n\nNext, the forms are evaluated in a dynamic environment in which each\nrestart in restart-list is associated with the condition.  See *Note\nAssociating a Restart with a Condition::.\n\nSee Also::\n..........\n\n*Note restart-case::\n\nNotes::\n.......\n\nUsually this macro is not used explicitly in code, since restart-case\nhandles most of the common cases in a way that is syntactically more\nconcise.\n\n"
}