{
    "name": "write-byte",
    "prev": "read-byte",
    "next": "peek-char",
    "up": "Streams Dictionary",
    "header": {
        "type": "Function",
        "text": "write-byte"
    },
    "sections": [
        {
            "type": "Syntax",
            "defs": [
                {
                    "name": "write-byte",
                    "text": " byte stream =>  byte\n"
                }
            ],
            "text": ""
        },
        {
            "type": "Arguments and Values",
            "text": "",
            "values": [
                {
                    "name": "byte",
                    "desc": "an integer of the stream element type of stream."
                },
                {
                    "name": "stream",
                    "desc": "a binary output stream."
                }
            ]
        },
        {
            "type": "Description",
            "text": "write-byte writes one byte, byte, to stream.\n"
        },
        {
            "type": "Examples",
            "text": "      (with-open-file (s \"temp-bytes\"\n                         :direction :output\n                         :element-type 'unsigned-byte)\n         (write-byte 101 s)) =>  101\n"
        },
        {
            "type": "Side Effects",
            "text": "stream is modified.\n"
        },
        {
            "type": "Affected By",
            "text": "The element type of the stream.\n"
        },
        {
            "type": "Exceptional Situations",
            "text": "Should signal an error of type type-error if stream is not a stream.\nShould signal an error of type error if stream is not  a binary output\nstream.\nMight signal an error of type type-error if byte is not an integer of the\nstream element type of stream.\n"
        },
        {
            "type": "See Also",
            "text": "*Note read-byte:: , *Note write-char:: ,\n*Note write-sequence::\n"
        }
    ],
    "_otext": "File: gcl.info,  Node: write-byte,  Next: peek-char,  Prev: read-byte,  Up: Streams Dictionary\n\nwrite-byte                                                       [Function]\n---------------------------------------------------------------------------\n\n`write-byte'  byte stream =>  byte\n\nArguments and Values::\n......................\n\nbyte--an integer of the stream element type of stream.\n\nstream--a binary output stream.\n\nDescription::\n.............\n\nwrite-byte writes one byte, byte, to stream.\n\nExamples::\n..........\n\n      (with-open-file (s \"temp-bytes\"\n                         :direction :output\n                         :element-type 'unsigned-byte)\n         (write-byte 101 s)) =>  101\n\nSide Effects::\n..............\n\nstream is modified.\n\nAffected By::\n.............\n\nThe element type of the stream.\n\nExceptional Situations::\n........................\n\nShould signal an error of type type-error if stream is not a stream.\nShould signal an error of type error if stream is not  a binary output\nstream.\n\nMight signal an error of type type-error if byte is not an integer of the\nstream element type of stream.\n\nSee Also::\n..........\n\n*Note read-byte:: , *Note write-char:: ,\n\n*Note write-sequence::\n\n"
}